"ulasan","pfm+","pfm-","psn+","psn-","byr+","byr-","ftr+","ftr-","tpl+","tpl-","umu+","umu-"
"Ko tiba tiba update kaget ama logo dan mana barunya tapi jadi makin lancar sihh","1","0","0","0","0","0","0","0","0","0","0","0"
"Malah semakin bagus dan lancar banget aplikasi nya di versi terbaru ini...","1","0","0","0","0","0","0","0","0","0","1","0"
"Setelah update yang terbaru tampilan oke, kualitasnya juga bagus banget. Load pas buka appnya juga ga lama, pas mau ke pembayaran juga lancar banget, pembayarannya dapat dilakukan dengan mudah. Ini nih aplikasi yang kita butuhkan cepet, simple, dan mudah.","1","0","0","0","1","0","0","0","1","0","1","0"
"Udah bisapake Qris di kai access aya suka dengan pembayaran Qris jadi lebih simpel ditambah uga aplikasinya makin satset","1","0","0","0","1","0","0","0","0","0","0","0"
"Setelah update tampilan lebih colourfull lebih lengkap bahkan jadwal commuterline..suka dg versi baru kai performnya meningkt jadi lebih cepet","1","0","0","0","0","0","1","0","1","0","0","0"
"setelah di upgrade malah jadi lancar. aplikasi nya buka jadwal/pembayaran malah jadi lebih cepet","1","0","0","0","0","0","1","0","0","0","0","0"
"Mau masuk lancar bgt, proses ke pembayaran juga lancar, sampai- sampai waktu pembayaran hanya butuh waktu yang cepet ga lama. Ini aplikasi super lancar dari segala2nya","1","0","0","0","1","0","0","0","0","0","1","0"
"Aplikasi bagus banget setelah di update sudah tidak ada bug dan lancar banget","1","0","0","0","0","0","0","1","0","1","0","0"
"Bagus nih, tampilan enak diliat, tapi di gua gak lemot kok tampilannya, enteng juga apk nya ga berat","1","0","0","0","0","0","0","0","1","0","1","0"
"Setelah update jadi lancar, tapi tampilan antarmukanya bagusan yang sebelumnya","1","0","0","0","0","0","0","0","0","1","0","0"
"lancar banget tdk kendala wktu mau pembayaran malah jadi efektif","1","0","0","0","1","0","0","0","0","0","0","0"
"Semakin memberikan kemudahan customer update an yg baru ini. Bintang 5 buat update an terbarunya kai udah ga lemot lagi jadi jos mantp is the best lancar jaya. Lebih suka aplikasi terbaru ini karena mudah dimengerti oleh customer/pengguna","1","0","0","0","0","0","0","0","0","0","1","0"
"Sejak diupdate malah makin mudah Aplikasinya ga lemot lagi. mudah sekali ketika cek tiket dan ketika menyelesaikan step by step setelah isi data penumpang. Update terbaru ini sangat membantu saya puas","1","0","0","0","0","0","1","0","0","0","1","0"
"Setelah update jadi makin lancar, untuk buka aplikasinya langsung satset, tpi menurut saya tampilan antarmukanya bagusan yang sebelumnya","1","0","0","0","0","0","0","0","0","1","0","0"
"Abis tak update tampikan baru malah makin bagus dan jadi makin lancar, mw cari tiket juga gampang","1","0","0","0","0","0","1","0","1","0","0","0"
"Saya pelanggan setia kai merasa paus dengan versi terbaruny memudahkan dlm segala hal pesan tiket mudah, cek tiket kereta mudah, bayrnya mudah, fitur tambahan yng juga berguna bagi saya. salutnya dg tambahan fitur yg banyak tpai masih lancar terus ga lemot lemot","1","0","1","0","1","0","1","0","0","0","0","0"
"Aplikasinya sangat mudah di gunakan tambah bagus dan tidak lemot","1","0","0","0","0","0","0","0","0","0","1","0"
"Versi baru memang lebih menarik dengan tanpilan dan fitur baru, saya pesen tiket goshow langsung dapet ga ada lagi tuh macet lemot semua lancar2 aja. kalo saya suka dg pembayaran qrisnya lebih  simepl","1","0","1","0","1","0","1","0","1","0","0","0"
"Pembayaran ga ribet pake kaipay makin mempermudah user kai buat pesen tikt sih ini fiturbarunya satset parah lagi","1","0","0","0","1","0","1","0","0","0","0","0"
"Di update malah lancar bangettt yg dulu rada"" lemot soal ny,,,,,,buat pesen tiket & bayrnya lbh mudah skrang","1","0","1","0","1","0","0","0","0","0","0","0"
"Setelah aplikasi diupdate semakin lancar bgt. Sangat memudahkan.....","1","0","0","0","0","0","0","0","0","0","1","0"
"Bagus nih, tampilan enak diliat, tapi di gua gak lemot kok tampilannya, enteng juga apk nya ga berat","1","0","0","0","0","0","0","0","1","0","1","0"
"Mau naik kereta api bookingnya makin mudah, aplikase lancar.. ","1","0","1","0","0","0","0","0","0","0","0","0"
"Saya pelanggan setia kai merasa paus dengan versi terbaruny memudahkan dlm segala hal pesan tiket mudah, cek tiket kereta mudah, bayrnya mudah, fitur tambahan yng juga berguna bagi saya. salutnya dg tambahan fitur yg banyak tpai masih lancar terus ga lemot lemot","1","0","1","0","1","0","1","0","0","0","0","0"
"Diupdate malah bisa beli tiket dg mudah... lancar terus... UI nya yg diperbaiki jg lebih keren... lebih baik dari versi yg lama.. versi yg baru bagus banget performanya..","1","0","0","0","1","0","0","0","1","0","0","0"
