"ulasan","pfm+","pfm-","psn+","psn-","byr+","byr-","ftr+","ftr-","tpl+","tpl-","umu+","umu-"
"Sudah tidak ada kendala lagi buat pesen tiket kereta pake aplikasi kai ini jadi makin mudah dan cepet","1","0","1","0","0","0","0","0","0","0","0","0"
"Aplikasi kaiacces ada update semakin simpel dan mempermudah. makin lancar dan ga lemot juga","1","0","0","0","0","0","0","0","0","0","1","0"
"Aplikasi bagus banget setelah di update sudah tidak ada bug dan lancar banget","1","0","0","0","0","0","0","1","0","1","0","0"
"Setelah di update jadi lebih baik ngga zonk lagi baik dari performa fitur""nya dll. tampilan dan pengoperasian jugalebih efisien versi terbaru sumpah, versi lamanya nyebelin. Aneh","1","0","0","0","0","0","1","0","1","0","0","0"
"Aplikasi update terbaru bagus, tp Saran q baikny harga2 tiket yg sdh habis terjual, d taruh paling bawah seperti aplikasi sebelumnya supaya gx bingung. Klu skrang d kirain msh ada tiketny, ternyata zonk.","1","0","0","0","0","0","0","0","0","0","1","0"
"Dari segi tampilan udah oke tapi udah nyaman sama versi lama dan lebih satset tiap pembelian kerta KAJJ versi baru pendingnya lumayan lama","1","0","0","0","0","0","1","0","0","0","0","0"
"Kalo dibandingin kai yg dulu sama sekarang beda bgt dari segi performa nya makin lancar dari pesen tiket, bayarnya, tmpilannya menarik juga ditambah fitur2 terbaru yg bermanfaat bangett menurut saya","1","0","1","0","1","0","0","0","1","0","0","0"
"kualitasnya lebih baik untuk baru di update, saya mau pesan tiket juga makin mudah sudah tidak eror dan lemot","1","0","1","0","0","0","0","0","0","0","0","0"
"Setelah update yang terbaru tampilan oke, kualitasnya juga bagus banget. Load pas buka appnya juga ga lama, pas mau ke pembayaran juga lancar banget, pembayarannya dapat dilakukan dengan mudah. Ini nih aplikasi yang kita butuhkan cepet, simple, dan mudah.","1","0","0","0","1","0","0","0","1","0","1","0"
"Performany sedikit lebih baik darisebelumnya,,,,","1","0","0","0","0","0","0","0","0","0","0","0"
"Bagus.... benr2 bagus baik performa & tampilan","1","0","0","0","0","0","0","0","1","0","1","0"
"Semenjak upgrade makin lancar untuk pembayaran makin memudahkan","1","0","0","0","1","0","0","0","0","0","0","0"
"Aplikasi bagus banget setelah di update sudah tidak ada bug dan lancar banget","1","0","0","0","0","0","0","0","0","0","1","0"
"Setelah Update malah makin lancar g lemot, seblumnya saat masuk ke apk nya lemot bgt,sekarnang yg mau bli tiket atau mau bepergian naik Kereta jdi mudah apalagi yg mau pergi kerja","1","0","0","0","1","0","0","0","0","0","0","0"
"Di upgrade tambah satset","1","0","0","0","0","0","0","0","0","0","0","0"
"Setelah update jadi mudah buat login, ga butuh waktu yang lama untuk login. Keren nih app terupdatenya","1","0","0","0","0","0","1","0","0","0","1","0"
"Pembayaran ga ribet pake kaipay makin mempermudah user kai buat pesen tikt sih ini fiturbarunya satset parah lagi","1","0","0","0","1","0","1","0","0","0","0","0"
"Saya pelanggan setia kai merasa paus dengan versi terbaruny memudahkan dlm segala hal pesan tiket mudah, cek tiket kereta mudah, bayrnya mudah, fitur tambahan yng juga berguna bagi saya. salutnya dg tambahan fitur yg banyak tpai masih lancar terus ga lemot lemot","1","0","1","0","1","0","1","0","0","0","0","0"
"Iya sih makin lancar tapi aplikasi yang baru tidak efektif dalam pemilihan kursi. Tampilan kursi mending di aplikasi yang lama lebih efektif dan efisien","1","0","0","0","0","0","0","1","0","1","0","0"
"Semenjak update aplikasi udah ngak lemot,,tapi tampilan membingungkan. Kereta yang penuh masih muncul untungnya pesen tiket sama bayar nya aman dan gampang bgt.","1","0","1","0","1","0","0","1","0","1","0","0"
"alhamdulillah jd lebih mudah... lancar, dulu susah banget kl mau hapus email (akun) krn sdh tdk aktif, skrg kl mau ganti nomer caranya udh gampang bgt. sukaaa","1","0","0","0","0","0","1","0","0","0","1","0"
"Iya sih makin lancar tapi aplikasi yang baru tidak efektif dalam pemilihan kursi. Tampilan kursi mending di aplikasi yang lama lebih efektif dan efisien","1","0","0","0","0","0","0","1","0","1","0","0"
"baru di update apknya lancar terus, ga bikin nggu makin lama","1","0","0","0","0","0","0","0","0","0","0","0"
"Setelah update tampilan lebih colourfull lebih lengkap bahkan jadwal commuterline..suka dg versi baru kai performnya meningkt jadi lebih cepet","1","0","0","0","0","0","1","0","1","0","0","0"
"Otomatis terupdate, versi baru memudahkan, lebih lancar. Mau pesan tiket jadi mudah kearena saya PP kerja naik commuter","1","0","1","0","0","0","0","0","0","0","1","0"
"Diupdate malah bisa beli tiket dg mudah... lancar terus... UI nya yg diperbaiki jg lebih keren... lebih baik dari versi yg lama.. versi yg baru bagus banget performanya..","1","0","0","0","1","0","0","0","1","0","0","0"
"Mau masuk lancar bgt, proses ke pembayaran juga lancar, sampai- sampai waktu pembayaran hanya butuh waktu yang cepet ga lama. Ini aplikasi super lancar dari segala2nya","1","0","0","0","1","0","0","0","0","0","1","0"
"Tampilan jauh lebih baik dengan fitur unggulan terbarunya yang menarik, thanks kai aplikasinya bagus dan lancar tdk ada trouble","1","0","0","0","0","0","1","0","1","0","1","0"
"Update besar2an aplikasi KAI semakin bagus, respon cepat dan UI keren. Cuma ada kekurangan yaitu metode pembayaran e wallet cuma ada opsi OVO, mungkin kedepan bisa ditambahkan wallet lain seperti gopay, shopeepay, dana atau virtual account.","1","0","0","0","0","1","0","0","1","0","0","0"
"Untuk update aplikasi nya lancar bangett, tapi lebih enak dilihat yang dulu tampilan menu aplikasinya","1","0","0","0","0","0","0","0","0","1","0","0"
"Pembayaran ga ribet pake kaipay makin mempermudah user kai buat pesen tikt sih ini fiturbarunya satset parah lagi","1","0","0","0","1","0","1","0","0","0","0","0"
"Semenjak update aplikasi udah ngak lemot,,tapi tampilan membingungkan. Kereta yang penuh masih muncul untungnya pesen tiket sama bayar nya aman dan gampang bgt.","1","0","1","0","1","0","0","1","0","1","0","0"
"Gini dong lancar severny yg kemaren kok koneksinya timeout terus,    kalo diplikasi yg baru bisa sat set pesen tiket","1","0","1","0","0","0","0","0","0","0","0","0"
"Diupgrade malah tambah lancar,dari proses login sampe pambayran tiket","1","0","0","0","0","0","0","0","0","0","0","0"
"Setelah diupdate , aplikasinya makin lancar ga lemot","1","0","0","0","0","0","0","0","0","0","0","0"
"Diperbarui makin bagus, lancar trus fiturnya juga banyak dan lengkap jadi pesen tiket kereta bisa seklain pesen hotel beli kuota internet juga","1","0","1","0","0","0","1","0","0","0","1","0"
"Diupdate malah bisa beli tiket dg mudah... lancar terus... UI nya yg diperbaiki jg lebih keren... lebih baik dari versi yg lama.. versi yg baru bagus banget performanya..","1","0","0","0","1","0","0","0","1","0","0","0"
"Sejak diupdate malah makin mudah Aplikasinya ga lemot lagi. mudah sekali ketika cek tiket dan ketika menyelesaikan step by step setelah isi data penumpang. Update terbaru ini sangat membantu saya puas","1","0","0","0","0","0","1","0","0","0","1","0"
"Versi baru memang lebih menarik dengan tanpilan dan fitur baru, saya pesen tiket goshow langsung dapet ga ada lagi tuh macet lemot semua lancar2 aja. kalo saya suka dg pembayaran qrisnya lebih  simepl","1","0","1","0","1","0","1","0","1","0","0","0"
"LANCARR DI HP ku tapi dg spek lumayan tinggi lo, gatau kok orang-orang bilanylemot banget tapi di aku lancar. Banyak promo hotel jug","1","0","0","0","0","0","1","0","0","0","0","0"
"Udah bisapake Qris di kai access aya suka dengan pembayaran Qris jadi lebih simpel ditambah uga aplikasinya makin satset","1","0","0","0","1","0","0","0","0","0","0","0"
"Setelah update gak ada masalah, login aman, cek fitur lain aman, aplikasi nya lebih smooth. Padahal hpku kentang lho 🤣","1","0","0","0","0","0","1","0","0","0","1","0"
"setelah di upgrade malah jadi lancar. aplikasi nya buka jadwal/pembayaran malah jadi lebih cepet","1","0","0","0","0","0","1","0","0","0","0","0"
"Bagus.... benr2 bagus baik performa & tampilan","1","0","0","0","0","0","0","0","1","0","1","0"
"Pake aplikasi dulu setiap mau pesan tiket sering gagal tapi diaplikasi sekarang selalu berhasil dna lebih cepet juga tidak lemot","1","0","1","0","0","0","0","0","0","0","0","0"
"Aplikasinya sangat mudah di gunakan tambah bagus dan tidak lemot","1","0","0","0","0","0","0","0","0","0","1","0"
"Setelah update yang terbaru tampilan oke, kualitasnya juga bagus banget. Load pas buka appnya juga ga lama, pas mau ke pembayaran juga lancar banget, pembayarannya dapat dilakukan dengan mudah. Ini nih aplikasi yang kita butuhkan cepet, simple, dan mudah.","1","0","0","0","1","0","0","0","1","0","1","0"
"Bagus nih, tampilan enak diliat, tapi di gua gak lemot kok tampilannya, enteng juga apk nya ga berat","1","0","0","0","0","0","0","0","1","0","1","0"
"Performany sedikit lebih baik darisebelumnya,,,,","1","0","0","0","0","0","0","0","0","0","0","0"
"baru di update apknya lancar terus, ga bikin nggu makin lama","1","0","0","0","0","0","0","0","0","0","0","0"
"KAI update otomatis di hp saya seltah saya buka dan ccoba versi barunya emang lebih user freandly,,,, syaa juga langsung pesan tiket untk kebernagkatan ke surabaya dg commuterline wah dari pencarian, pemesanan dan bayarnya mudah bettt lancar. suwun kai","1","0","1","0","1","0","0","0","1","0","0","0"
"Biasanya lemot poll...tapi setelah update malah lancar teros","1","0","0","0","0","0","0","0","0","0","0","0"
"semenjak update aplikasi jd ringan dan lancar bet","1","0","0","0","0","0","0","0","0","0","0","0"
"Udahh Lancar banget buat beli dan cari tiket malah tambah enak dipandaang ux terbaru nya","1","0","0","0","0","0","0","0","1","0","0","0"
"Saya pelanggan setia kai merasa paus dengan versi terbaruny memudahkan dlm segala hal pesan tiket mudah, cek tiket kereta mudah, bayrnya mudah, fitur tambahan yng juga berguna bagi saya. salutnya dg tambahan fitur yg banyak tpai masih lancar terus ga lemot lemot","1","0","1","0","1","0","1","0","0","0","0","0"
"Saya senang dengan pembaruan aplikasi ini. Karena di aplikasi KAI accesa saat ini saya bisa melakukan update no hp. Karena di aplikasi sebelumnya tidak bisa dan sering gagal. Di tambah fitur² terbaru nya yg sangat membantu pengguna nya. Buat performanya juga makin canggih dan makin cepet","1","0","0","0","0","0","1","0","0","0","1","0"
"Setelah update jadi lancar, tapi tampilan antarmukanya bagusan yang sebelumnya","1","0","0","0","0","0","0","0","0","1","0","0"
"Iya sih makin lancar tapi aplikasi yang baru tidak efektif dalam pemilihan kursi. Tampilan kursi mending di aplikasi yang lama lebih efektif dan efisien","1","0","0","0","0","0","0","1","0","1","0","0"
"Saya senang dengan pembaruan aplikasi ini. Karena di aplikasi KAI accesa saat ini saya bisa melakukan update no hp. Karena di aplikasi sebelumnya tidak bisa dan sering gagal. Di tambah fitur² terbaru nya yg sangat membantu pengguna nya. Buat performanya juga makin canggih dan makin cepet","1","0","0","0","0","0","1","0","0","0","1","0"
"lancar banget tdk kendala wktu mau pembayaran malah jadi efektif","1","0","0","0","1","0","0","0","0","0","0","0"
"Diperbarui makin bagus, lancar trus fiturnya juga banyak dan lengkap jadi pesen tiket kereta bisa seklain pesen hotel beli kuota internet juga","1","0","1","0","0","0","1","0","0","0","1","0"
"Selain apknya udah gak lemott lagi dan makin satset.... aku jg suka saat pesen tiket buat pilih kursinya lebih enak aja di versi skarang  daripada dulu","1","0","1","0","0","0","0","0","0","0","0","0"
"Setelah update palah makin baik.. Apk ringan lancar tidak lemot","1","0","0","0","0","0","0","0","0","0","0","0"
"Kalo dibandingin kai yg dulu sama sekarang beda bgt dari segi performa nya makin lancar dari pesen tiket, bayarnya, tmpilannya menarik juga ditambah fitur2 terbaru yg bermanfaat bangett menurut saya","1","0","1","0","1","0","0","0","1","0","0","0"
"Pake aplikasi dulu setiap mau pesan tiket sering gagal tapi diaplikasi sekarang selalu berhasil dna lebih cepet juga tidak lemot","1","0","1","0","0","0","0","0","0","0","0","0"
"Semakin memberikan kemudahan customer update an yg baru ini. Bintang 5 buat update an terbarunya kai udah ga lemot lagi jadi jos mantp is the best lancar jaya. Lebih suka aplikasi terbaru ini karena mudah dimengerti oleh customer/pengguna","1","0","0","0","0","0","0","0","0","0","1","0"
"Sejak diupdate malah makin mudah Aplikasinya ga lemot lagi. mudah sekali ketika cek tiket dan ketika menyelesaikan step by step setelah isi data penumpang. Update terbaru ini sangat membantu saya puas","1","0","0","0","0","0","1","0","0","0","1","0"
"Setelah Update malah makin lancar g lemot, seblumnya saat masuk ke apk nya lemot bgt,sekarnang yg mau bli tiket atau mau bepergian naik Kereta jdi mudah apalagi yg mau pergi kerja","1","0","0","0","1","0","0","0","0","0","0","0"
"Saya mau lihat jadwal kereta sekaligus pesan tiket udah lbih mudah.padahal sblmnya lemottt parah pdhal waktu itu lgi urgent..","1","0","1","0","0","0","0","0","0","0","0","0"
"Setelah di update jadi lebih baik ngga zonk lagi baik dari performa fitur""nya dll. tampilan dan pengoperasian jugalebih efisien versi terbaru sumpah, versi lamanya nyebelin. Aneh","1","0","0","0","0","0","1","0","1","0","0","0"
"Udah update versi terbaru tampilanya GEMESSSSS banget sukaa malah lancarr banget juga","1","0","0","0","0","0","0","0","1","0","0","0"
"Udah gk lemot lagi mau mesen tiket lokal tiket antarkota semua pake online tapi apk nya lancar parah gk lemot. jadi makin memudahkan juga setelah diperbarui huhuhhu suka....","1","0","1","0","0","0","0","0","0","0","0","0"
"alhamdulillah jd lebih mudah... lancar, dulu susah banget kl mau hapus email (akun) krn sdh tdk aktif, skrg kl mau ganti nomer caranya udh gampang bgt. sukaaa","1","0","0","0","0","0","1","0","0","0","1","0"
"Diperbarui makin bagus, lancar trus fiturnya juga banyak dan lengkap jadi pesen tiket kereta bisa seklain pesen hotel beli kuota internet juga","1","0","0","0","0","0","1","0","0","0","1","0"
"Setelah update malah ga lemot masuk nya, dr segi tampilan makin oke dan performanya makin baik","1","0","0","0","0","0","0","0","1","0","0","0"
"Aplikasi update terbaru bagus, tp Saran q baikny harga2 tiket yg sdh habis terjual, d taruh paling bawah seperti aplikasi sebelumnya supaya gx bingung. Klu skrang d kirain msh ada tiketny, ternyata zonk.","1","0","0","0","0","0","0","0","0","0","1","0"
"KAI access terupdete fiturnya makin lengkp tapi ga lemot  dan lancar juga,,pesan tiket kereta lancar seperti biasanya","1","0","1","0","0","0","0","0","0","0","0","0"
"Untuk update aplikasi nya lancar bangett, tapi lebih enak dilihat yang dulu tampilan menu aplikasinya","1","0","0","0","0","0","0","0","0","1","0","0"
"Udah maakin lancar ga lemot lagi, tapi tampilan masih enak dulu . Tampilan sekarang kayak pelangi, perpaduan warna kurang cocok","1","0","0","0","0","0","0","0","0","1","0","0"
"KAI update otomatis di hp saya seltah saya buka dan ccoba versi barunya emang lebih user freandly,,,, syaa juga langsung pesan tiket untk kebernagkatan ke surabaya dg commuterline wah dari pencarian, pemesanan dan bayarnya mudah bettt lancar. suwun kai","1","0","1","0","1","0","0","0","1","0","0","0"
"Waktu may Bayar sudah tidak loading terus lebih baik dari seblum ny performa nya meningkat","1","0","0","0","1","0","0","0","0","0","0","0"
"Aplikasinya sangat mudah di gunakan tambah bagus dan tidak lemot","1","0","0","0","0","0","0","0","0","0","1","0"
"Diupdate malah bisa beli tiket dg mudah... lancar terus... UI nya yg diperbaiki jg lebih keren... lebih baik dari versi yg lama.. versi yg baru bagus banget performanya..","1","0","0","0","1","0","0","0","1","0","0","0"
"enakan yg sekarang aplikasinya lancar ga l emot, tampilan lebih kelihatan seger ga ngebosenin","1","0","0","0","0","0","0","0","1","0","0","0"
"Iya sih makin lancar tapi aplikasi yang baru tidak efektif dalam pemilihan kursi. Tampilan kursi mending di aplikasi yang lama lebih efektif dan efisien","1","0","0","0","0","0","0","1","0","1","0","0"
"Ternyata harus restart hp setelah update aplikasi biar ga lemot","1","0","0","0","0","0","0","0","0","0","0","0"
"Udah bisapake Qris di kai access aya suka dengan pembayaran Qris jadi lebih simpel ditambah uga aplikasinya makin satset","1","0","0","0","1","0","0","0","0","0","0","0"
"Udah maakin lancar ga lemot lagi, tapi tampilan masih enak dulu . Tampilan sekarang kayak pelangi, perpaduan warna kurang cocok","1","0","0","0","0","0","0","0","0","1","0","0"
"Untuk proses pemesanan tiket lokal cepat banget, utk pembayaran ovo juga mudah","1","0","0","0","1","0","0","0","0","0","0","0"
"Saya mau lihat jadwal kereta sekaligus pesan tiket udah lbih mudah.padahal sblmnya lemottt parah pdhal waktu itu lgi urgent..","1","0","1","0","0","0","0","0","0","0","0","0"
"Apk nya sekarang sudah tidak sering crash, jadi waktu mau memesan tiket selalu lancar tidak kehabisan waktu, pembayarannya juga mudah dg menggunaakn qris","1","0","1","0","1","0","0","0","0","0","0","0"
"Updetan versi terbaru bner2 makin bagus deh dah gaLemot banget, sanagat memudhakan daripada versi lama","1","0","0","0","0","0","0","0","0","0","1","0"
"Saya senang dengan pembaruan aplikasi ini. Karena di aplikasi KAI accesa saat ini saya bisa melakukan update no hp. Karena di aplikasi sebelumnya tidak bisa dan sering gagal. Di tambah fitur² terbaru nya yg sangat membantu pengguna nya. Buat performanya juga makin canggih dan makin cepet","1","0","0","0","0","0","1","0","0","0","1","0"
"Good job KAI aplikasinya jadi lancar banget, pemesanan cepat bgt, di upgrade jd lebih baik dan lebih mudah diakses","1","0","1","0","0","0","0","0","0","0","1","0"
"aplikasi menjadi lebih lancar sesudah di update, smuanya lancar dan cepat, mudah login, mudah booking, yang dulu lemot muter terus saya pernah nunggu hampir 1 jam bulak balik masih saja lemot, untung sekarnag sudah di update lebih memudahkan booking tiket online","1","0","1","0","0","0","0","0","0","0","0","0"
"alhamdulillah jd lebih mudah... lancar, dulu susah banget kl mau hapus email (akun) krn sdh tdk aktif, skrg kl mau ganti nomer caranya udh gampang bgt. sukaaa","1","0","0","0","0","0","1","0","0","0","1","0"
"Untuk proses pemesanan tiket lokal cepat banget, utk pembayaran ovo juga mudah","1","0","0","0","1","0","0","0","0","0","0","0"
"Updetan versi terbaru bner2 makin bagus deh dah gaLemot banget, sanagat memudhakan daripada versi lama","1","0","0","0","0","0","0","0","0","0","1","0"
"Pake aplikasi dulu setiap mau pesan tiket sering gagal tapi diaplikasi sekarang selalu berhasil dna lebih cepet juga tidak lemot","1","0","1","0","0","0","0","0","0","0","0","0"
"Tidak megnecewakan siii setelah di update malah satset parah. Ada prommo kemerdekaan jgu sangat membantu sekali tengkyu kai","1","0","0","0","0","0","1","0","0","0","0","0"
"Lancar banget... Mau melakukan pembayaran juga gamapng","1","0","0","0","1","0","0","0","0","0","0","0"
"Mau naik kereta api bookingnya makin mudah, aplikase lancar.. ","1","0","1","0","0","0","0","0","0","0","0","0"
"Biasanya lemot poll...tapi setelah update malah lancar teros","1","0","0","0","0","0","0","0","0","0","0","0"
"tampilan ok pemesanan cepat lgsung dapat","1","0","0","0","0","0","0","0","1","0","0","0"
"Sejak diperbarui makin garibet.. Pesen tiket jadi sat set.. ga lemot.. lbih mudah beli tiket di aplikasi skrng.. Hhh.. lebih baik daripada seblumnya.. Thx","1","0","0","0","1","0","0","0","0","0","1","0"
"alhamdulillah jd lebih mudah... lancar, dulu susah banget kl mau hapus email (akun) krn sdh tdk aktif, skrg kl mau ganti nomer caranya udh gampang bgt. sukaaa","1","0","0","0","0","0","1","0","0","0","1","0"
"kualitasnya lebih baik untuk baru di update, saya mau pesan tiket juga makin mudah sudah tidak eror dan lemot","1","0","1","0","0","0","0","0","0","0","0","0"
"Setelah update malah ga lemot masuk nya, dr segi tampilan makin oke dan performanya makin baik","1","0","0","0","0","0","0","0","1","0","0","0"
"Setelah di update jadi lebih baik ngga zonk lagi baik dari performa fitur""nya dll. tampilan dan pengoperasian jugalebih efisien versi terbaru sumpah, versi lamanya nyebelin. Aneh","1","0","0","0","0","0","1","0","1","0","0","0"
"Alamdulillah setelah update akses menjadi lebih lancar, tidak seperti pada aplikasi sebelumnya lemot. Saat memilih kursi timeout tdk perlu nunggu waktu lama & membuang waktu","1","0","1","0","0","0","0","0","0","0","0","0"
"Setelah update jadi makin lancar, untuk buka aplikasinya langsung satset, tpi menurut saya tampilan antarmukanya bagusan yang sebelumnya","1","0","0","0","0","0","0","0","0","1","0","0"
"Semenjak pembaruan sudah tidak ngelag, touchscreen responsif, lancar. suka jg ama fitur2 tambahnnya jadi app yg lebih multifungsi","1","0","0","0","0","0","1","0","1","0","0","0"
"Dari segi performa kai accsess terbaru lbih baik daripada seblumnya, booking tiekt makin mudah dan bayarnya bisa pake Qris ada fiturbuat pesen hotel juga lengkap","1","0","0","0","1","0","1","0","0","0","0","0"
"Tampilan jauh lebih baik dengan fitur unggulan terbarunya yang menarik, thanks kai aplikasinya bagus dan lancar tdk ada trouble","1","0","0","0","0","0","1","0","1","0","1","0"
"Udah gk lemot lagi mau mesen tiket lokal tiket antarkota semua pake online tapi apk nya lancar parah gk lemot. jadi makin memudahkan juga setelah diperbarui huhuhhu suka....","1","0","1","0","0","0","0","0","0","0","0","0"
"Tampilan jauh lebih baik dengan fitur unggulan terbarunya yang menarik, thanks kai aplikasinya bagus dan lancar tdk ada trouble","1","0","0","0","0","0","1","0","1","0","1","0"
"Diupgrade malah tambah lancar,dari proses login sampe pambayran tiket","1","0","0","0","0","0","0","0","0","0","0","0"
"Dari segi performa kai accsess terbaru lbih baik daripada seblumnya, booking tiekt makin mudah dan bayarnya bisa pake Qris ada fiturbuat pesen hotel juga lengkap","1","0","0","0","1","0","1","0","0","0","0","0"
"Mau masuk lancar bgt, proses ke pembayaran juga lancar, sampai- sampai waktu pembayaran hanya butuh waktu yang cepet ga lama. Ini aplikasi super lancar dari segala2nya","1","0","0","0","1","0","0","0","0","0","1","0"
"Alamdulillah setelah update akses menjadi lebih lancar, tidak seperti pada aplikasi sebelumnya lemot. Saat memilih kursi timeout tdk perlu nunggu waktu lama & membuang waktu","1","0","1","0","0","0","0","0","0","0","0","0"
"Versi baru lebih ga lemot ... loadingnya ga pke lama buat akses masuk aplikasinya, pindah"" menu jg ga lemot","1","0","0","0","0","0","0","0","0","0","0","0"
"Diupdate jdi makin lancar, tak kasih bintang 5 deh buat aplikasi ini","1","0","0","0","0","0","0","0","0","0","1","0"
"Aplikasi bagus banget setelah di update sudah tidak ada bug dan lancar banget","1","0","0","0","0","0","0","1","0","1","0","0"
"Kalo dibandingin kai yg dulu sama sekarang beda bgt dari segi performa nya makin lancar dari pesen tiket, bayarnya, tmpilannya menarik juga ditambah fitur2 terbaru yg bermanfaat bangett menurut saya","1","0","1","0","1","0","0","0","1","0","0","0"
"Stelah saya updte lagi app nya udah lebih lancar   pemesanan tiket commuter line sudah tidak eror lagi","1","0","1","0","0","0","0","0","0","0","0","0"
"semenjak update aplikasi jd ringan dan lancar bet","1","0","0","0","0","0","0","0","0","0","0","0"
"Sejak diupdate malah makin mudah Aplikasinya ga lemot lagi. mudah sekali ketika cek tiket dan ketika menyelesaikan step by step setelah isi data penumpang. Update terbaru ini sangat membantu saya puas","1","0","0","0","0","0","1","0","0","0","1","0"
"update jadi ringan dan lebih cepat. UX buat lihat detail harga inovasinya bagus","1","0","0","0","0","0","0","0","1","0","0","0"
"tampilan ok pemesanan cepat lgsung dapat","1","0","0","0","0","0","0","0","1","0","0","0"
"Versi baru memang lebih menarik dengan tanpilan dan fitur baru, saya pesen tiket goshow langsung dapet ga ada lagi tuh macet lemot semua lancar2 aja. kalo saya suka dg pembayaran qrisnya lebih  simepl","1","0","1","0","1","0","1","0","1","0","0","0"
"Dari segi performa kai accsess terbaru lbih baik daripada seblumnya, booking tiekt makin mudah dan bayarnya bisa pake Qris ada fiturbuat pesen hotel juga lengkap","1","0","0","0","1","0","1","0","0","0","0","0"
"Aplikasi bagus banget setelah di update sudah tidak ada bug dan lancar banget","1","0","0","0","0","0","0","0","0","0","1","0"
"LANCARR DI HP ku tapi dg spek lumayan tinggi lo, gatau kok orang-orang bilanylemot banget tapi di aku lancar. Banyak promo hotel jug","1","0","0","0","0","0","1","0","0","0","0","0"
"Setelah update yang terbaru tampilan oke, kualitasnya juga bagus banget. Load pas buka appnya juga ga lama, pas mau ke pembayaran juga lancar banget, pembayarannya dapat dilakukan dengan mudah. Ini nih aplikasi yang kita butuhkan cepet, simple, dan mudah.","1","0","0","0","1","0","0","0","1","0","1","0"
"Sejak diperbarui makin garibet.. Pesen tiket jadi sat set.. ga lemot.. lbih mudah beli tiket di aplikasi skrng.. Hhh.. lebih baik daripada seblumnya.. Thx","1","0","0","0","1","0","0","0","0","0","1","0"
"Di update malah lancar bangettt yg dulu rada"" lemot soal ny,,,,,,buat pesen tiket & bayrnya lbh mudah skrang","1","0","1","0","1","0","0","0","0","0","0","0"
"Apk nya sekarang sudah tidak sering crash, jadi waktu mau memesan tiket selalu lancar tidak kehabisan waktu, pembayarannya juga mudah dg menggunaakn qris","1","0","1","0","1","0","0","0","0","0","0","0"
"lancar banget tdk kendala wktu mau pembayaran malah jadi efektif","1","0","0","0","1","0","0","0","0","0","0","0"
"Abis tak update tampikan baru malah makin bagus dan jadi makin lancar, mw cari tiket juga gampang","1","0","0","0","0","0","1","0","1","0","0","0"
"Ternyata harus restart hp setelah update aplikasi biar ga lemot","1","0","0","0","0","0","0","0","0","0","0","0"
"Sejak diperbarui makin garibet.. Pesen tiket jadi sat set.. ga lemot.. lbih mudah beli tiket di aplikasi skrng.. Hhh.. lebih baik daripada seblumnya.. Thx","1","0","0","0","1","0","0","0","0","0","1","0"
