,kalimat,kalimat_norm,kalimat_cf,kalimat_token,kalimat_stopwords,kalimat_stemmed
188,Tampilan baru mengecewakan Mau bayar knp kadaluarsa terus sih,Tampilan baru mengecewakan mau bayar kenapa kedaluwarsa terus sih,tampilan baru mengecewakan mau bayar kenapa kedaluwarsa terus sih,"['tampilan', 'baru', 'mengecewakan', 'mau', 'bayar', 'kenapa', 'kedaluwarsa', 'terus', 'sih']","['tampilan', 'mengecewakan', 'bayar', 'kedaluwarsa', 'sih']","['tampil', 'kecewa', 'bayar', 'kedaluwarsa', 'sih']"
236,lama makin lemot tiba time out padahal tinggal bayar doang,lama makin lama tiba time out padahal tinggal bayar doang,lama makin lama tiba time out padahal tinggal bayar doang,"['lama', 'makin', 'lama', 'tiba', 'time', 'out', 'padahal', 'tinggal', 'bayar', 'doang']","['time', 'out', 'tinggal', 'bayar', 'doang']","['time', 'out', 'tinggal', 'bayar', 'doang']"
88,Akunya suka tiba tiba keluar sendiri,Akunya suka tiba-tiba keluar sendiri,akunya suka tiba-tiba keluar sendiri,"['akunya', 'suka', 'tiba-tiba', 'keluar', 'sendiri']","['akunya', 'suka']","['aku', 'suka']"
588,Maaf bintang setelah updet karena klo mau pilih tiket malah nampilin semua relasi tp harus buka satu per satu buat liat ketersediaan waktunya lama mending kaya yang awal tampilan langsung direct ke yg tersedia,Maaf bintang setelah perbarui karena kalau mau pilih tiket malah menampilkan semua relasi tetapi harus buka satu per satu buat lihat ketersediaan waktunya lama mending kayak yang awal tampilan langsung dibaca ke yang tersedia,maaf bintang setelah perbarui karena kalau mau pilih tiket malah menampilkan semua relasi tetapi harus buka satu per satu buat lihat ketersediaan waktunya lama mending kayak yang awal tampilan langsung dibaca ke yang tersedia,"['maaf', 'bintang', 'setelah', 'perbarui', 'karena', 'kalau', 'mau', 'pilih', 'tiket', 'malah', 'menampilkan', 'semua', 'relasi', 'tetapi', 'harus', 'buka', 'satu', 'per', 'satu', 'buat', 'lihat', 'ketersediaan', 'waktunya', 'lama', 'mending', 'kayak', 'yang', 'awal', 'tampilan', 'langsung', 'dibaca', 'ke', 'yang', 'tersedia']","['maaf', 'bintang', 'perbarui', 'pilih', 'tiket', 'menampilkan', 'relasi', 'buka', 'lihat', 'ketersediaan', 'mending', 'kayak', 'tampilan', 'langsung', 'dibaca', 'tersedia']","['maaf', 'bintang', 'baru', 'pilih', 'tiket', 'tampil', 'relasi', 'buka', 'lihat', 'sedia', 'mending', 'kayak', 'tampil', 'langsung', 'baca', 'sedia']"
117,Sudah transaksi Qris sukses tiket buat besok PP tapi ngk ada di aplikasi bordingnya Membingungkan aplikasinya,Sudah transaksi Qris sukses tiket buat besok PP tetapi enggak ada di aplikasi perbatasannya membingungkan aplikasinya,sudah transaksi qris sukses tiket buat besok pp tetapi enggak ada di aplikasi perbatasannya membingungkan aplikasinya,"['sudah', 'transaksi', 'qris', 'sukses', 'tiket', 'buat', 'besok', 'pp', 'tetapi', 'enggak', 'ada', 'di', 'aplikasi', 'perbatasannya', 'membingungkan', 'aplikasinya']","['transaksi', 'qris', 'sukses', 'tiket', 'besok', 'pp', 'aplikasi', 'perbatasannya', 'membingungkan', 'aplikasinya']","['transaksi', 'qris', 'sukses', 'tiket', 'besok', 'pp', 'aplikasi', 'batas', 'bingung', 'aplikasi']"
125,PECAT UI UX DESIGNERNYA SUMPAH UI bagus tapi UX jelek UI UX designernyagausah ngide dah modal bagusin tampilan tapi user journey ga diperhatiin makin ribet belajar lagi UI UX nya ,pecat UI UX desainernya sumpah UI bagus tetapi UX jelek UI UX desainernya enggak usah mengide deh modal baguskan tampilan tetapi pengguna Journey enggak diperhatikan makin ribet belajar lagi UI UX-nya,pecat ui ux desainernya sumpah ui bagus tetapi ux jelek ui ux desainernya enggak usah mengide deh modal baguskan tampilan tetapi pengguna journey enggak diperhatikan makin ribet belajar lagi ui ux-nya,"['pecat', 'ui', 'ux', 'desainernya', 'sumpah', 'ui', 'bagus', 'tetapi', 'ux', 'jelek', 'ui', 'ux', 'desainernya', 'enggak', 'usah', 'mengide', 'deh', 'modal', 'baguskan', 'tampilan', 'tetapi', 'pengguna', 'journey', 'enggak', 'diperhatikan', 'makin', 'ribet', 'belajar', 'lagi', 'ui', 'ux-nya']","['pecat', 'ui', 'ux', 'desainernya', 'sumpah', 'ui', 'bagus', 'ux', 'jelek', 'ui', 'ux', 'desainernya', 'mengide', 'deh', 'modal', 'baguskan', 'tampilan', 'pengguna', 'journey', 'diperhatikan', 'ribet', 'belajar', 'ui', 'ux-nya']","['pecat', 'ui', 'ux', 'desainer', 'sumpah', 'ui', 'bagus', 'ux', 'jelek', 'ui', 'ux', 'desainer', 'ide', 'deh', 'modal', 'bagus', 'tampil', 'guna', 'journey', 'perhati', 'ribet', 'ajar', 'ui', 'ux-nya']"
570,Tampilan emang have fun and youth Fasilitas lebih banyak tapi masih belum berfungsi Tapi namanya jadi tidak spesial Orang lebih mudah mencari KAI dari pada Access Nama Kai Access lebih keren dan spesial menunjukkan identitas aplikasi pesan tiket kereta api Lah kalo ACCESS ini maknanya apa Revamp ya revamp Tapi gak jadi lebih aneh gitu Jadi inget bikin stasiun tapi lupa buat jalan akses Kan aneh Mmm mungkin mau buat kayak LIVIN by mandiri,Tampilan memang bersenang-senang dan youth Fasilitas lebih banyak tetapi masih belum berfungsi tetapi namanya jadi tidak spesial orang lebih mudah mencari KAI dari pada Access Nama Kai Access lebih keren dan spesial menunjukkan identitas aplikasi pesan tiket kereta apilah kalau Access ini maknanya apa Revamp ya Revamp tetapi enggak jadi lebih aneh begitu jadi ingat bikin stasiun tetapi lupa buat jalan akses kan aneh hem mungkin mau buat kayak Livin By Mandiri,tampilan memang bersenang-senang dan youth fasilitas lebih banyak tetapi masih belum berfungsi tetapi namanya jadi tidak spesial orang lebih mudah mencari kai dari pada access nama kai access lebih keren dan spesial menunjukkan identitas aplikasi pesan tiket kereta apilah kalau access ini maknanya apa revamp ya revamp tetapi enggak jadi lebih aneh begitu jadi ingat bikin stasiun tetapi lupa buat jalan akses kan aneh hem mungkin mau buat kayak livin by mandiri,"['tampilan', 'memang', 'bersenang-senang', 'dan', 'youth', 'fasilitas', 'lebih', 'banyak', 'tetapi', 'masih', 'belum', 'berfungsi', 'tetapi', 'namanya', 'jadi', 'tidak', 'spesial', 'orang', 'lebih', 'mudah', 'mencari', 'kai', 'dari', 'pada', 'access', 'nama', 'kai', 'access', 'lebih', 'keren', 'dan', 'spesial', 'menunjukkan', 'identitas', 'aplikasi', 'pesan', 'tiket', 'kereta', 'apilah', 'kalau', 'access', 'ini', 'maknanya', 'apa', 'revamp', 'ya', 'revamp', 'tetapi', 'enggak', 'jadi', 'lebih', 'aneh', 'begitu', 'jadi', 'ingat', 'bikin', 'stasiun', 'tetapi', 'lupa', 'buat', 'jalan', 'akses', 'kan', 'aneh', 'hem', 'mungkin', 'mau', 'buat', 'kayak', 'livin', 'by', 'mandiri']","['tampilan', 'bersenang-senang', 'youth', 'fasilitas', 'berfungsi', 'namanya', 'spesial', 'orang', 'mudah', 'mencari', 'kai', 'access', 'nama', 'kai', 'access', 'keren', 'spesial', 'identitas', 'aplikasi', 'pesan', 'tiket', 'kereta', 'apilah', 'access', 'maknanya', 'revamp', 'ya', 'revamp', 'aneh', 'bikin', 'stasiun', 'lupa', 'jalan', 'akses', 'aneh', 'hem', 'kayak', 'livin', 'by', 'mandiri']","['tampil', 'senang', 'youth', 'fasilitas', 'fungsi', 'nama', 'spesial', 'orang', 'mudah', 'cari', 'kai', 'access', 'nama', 'kai', 'access', 'keren', 'spesial', 'identitas', 'aplikasi', 'pesan', 'tiket', 'kereta', 'api', 'access', 'makna', 'revamp', 'ya', 'revamp', 'aneh', 'bikin', 'stasiun', 'lupa', 'jalan', 'akses', 'aneh', 'hem', 'kayak', 'livin', 'by', 'mandiri']"
238,nambah parah aplikasinya,tambah parah aplikasinya,tambah parah aplikasinya,"['tambah', 'parah', 'aplikasinya']","['parah', 'aplikasinya']","['parah', 'aplikasi']"
0,Tolong di perbaiki lagi aplikasi ini sering logout sendiri untuk mengakses jg sangat lama Disappointed Terimakasih,Tolong diperbaiki lagi aplikasi ini sering keluar sendiri untuk mengakses juga sangat lama Disappointed Terima kasih,tolong diperbaiki lagi aplikasi ini sering keluar sendiri untuk mengakses juga sangat lama disappointed terima kasih,"['tolong', 'diperbaiki', 'lagi', 'aplikasi', 'ini', 'sering', 'keluar', 'sendiri', 'untuk', 'mengakses', 'juga', 'sangat', 'lama', 'disappointed', 'terima', 'kasih']","['tolong', 'diperbaiki', 'aplikasi', 'mengakses', 'disappointed', 'terima', 'kasih']","['tolong', 'baik', 'aplikasi', 'akses', 'disappointed', 'terima', 'kasih']"
689,uangel,UangEl,uangel,['uangel'],['uangel'],['uangel']
530,Tambahkan metode pembayaran baik antar kota lokal commuter dll dengan dompet digital lain seperti ovo gopay linkaja Masukan fitur fitur pada app KRL access access agar ringkas cukup aplikasi,Tambahkan metode pembayaran baik antar kota lokal komuter dll. dengan dompet digital lain seperti OVO Gopay Linkaja masukan fitur fitur pada aplikasi KRL Access agar ringkas cukup aplikasi,tambahkan metode pembayaran baik antar kota lokal komuter dll. dengan dompet digital lain seperti ovo gopay linkaja masukan fitur fitur pada aplikasi krl access agar ringkas cukup aplikasi,"['tambahkan', 'metode', 'pembayaran', 'baik', 'antar', 'kota', 'lokal', 'komuter', 'dll', '.', 'dengan', 'dompet', 'digital', 'lain', 'seperti', 'ovo', 'gopay', 'linkaja', 'masukan', 'fitur', 'fitur', 'pada', 'aplikasi', 'krl', 'access', 'agar', 'ringkas', 'cukup', 'aplikasi']","['tambahkan', 'metode', 'pembayaran', 'kota', 'lokal', 'komuter', 'dll', '.', 'dompet', 'digital', 'ovo', 'gopay', 'linkaja', 'masukan', 'fitur', 'fitur', 'aplikasi', 'krl', 'access', 'ringkas', 'aplikasi']","['tambah', 'metode', 'bayar', 'kota', 'lokal', 'komuter', 'dll', '', 'dompet', 'digital', 'ovo', 'gopay', 'linkaja', 'masuk', 'fitur', 'fitur', 'aplikasi', 'krl', 'access', 'ringkas', 'aplikasi']"
665,Tidak bisa ubah jadwal padahal pesan tiket dari seminggu dan kursi masih pada kosong,Tidak bisa ubah jadwal padahal pesan tiket dari seminggu dan kursi masih pada kosong,tidak bisa ubah jadwal padahal pesan tiket dari seminggu dan kursi masih pada kosong,"['tidak', 'bisa', 'ubah', 'jadwal', 'padahal', 'pesan', 'tiket', 'dari', 'seminggu', 'dan', 'kursi', 'masih', 'pada', 'kosong']","['ubah', 'jadwal', 'pesan', 'tiket', 'seminggu', 'kursi', 'kosong']","['ubah', 'jadwal', 'pesan', 'tiket', 'minggu', 'kursi', 'kosong']"
606,Msh blm familiar dengan tampilan barunya,Masih belum familier dengan tampilan barunya,masih belum familier dengan tampilan barunya,"['masih', 'belum', 'familier', 'dengan', 'tampilan', 'barunya']","['familier', 'tampilan', 'barunya']","['familier', 'tampil', 'baru']"
278,Banyak fitur dan pilihannya tapi gabusa sama saja kalo tidak bisa terakses lebih running sama versi yang lama nya Merugikan konsumen apabila ada sesuatu mendesak dan butuh reshcedulle tiket tetapi gabisa sudah coba telpon dan tanya ke service center juga ga ada solusi sudah saya coba manual unistall kemudian download install lagi sama saja gabisa harus jadi perhatian dong ini,Banyak fitur dan pilihannya tetapi enggak busa sama saja kalau tidak bisa terakses lebih running sama versi yang lamanya merugikan konsumen apabila ada sesuatu mendesak dan butuh reshcedulle tiket tetapi enggak bisa sudah coba telepon dan tanya ke pelayanan center juga enggak ada solusi sudah saya coba manual copot kemudian unduh pasang lagi sama saja enggak bisa harus jadi perhatian dong ini,banyak fitur dan pilihannya tetapi enggak busa sama saja kalau tidak bisa terakses lebih running sama versi yang lamanya merugikan konsumen apabila ada sesuatu mendesak dan butuh reshcedulle tiket tetapi enggak bisa sudah coba telepon dan tanya ke pelayanan center juga enggak ada solusi sudah saya coba manual copot kemudian unduh pasang lagi sama saja enggak bisa harus jadi perhatian dong ini,"['banyak', 'fitur', 'dan', 'pilihannya', 'tetapi', 'enggak', 'busa', 'sama', 'saja', 'kalau', 'tidak', 'bisa', 'terakses', 'lebih', 'running', 'sama', 'versi', 'yang', 'lamanya', 'merugikan', 'konsumen', 'apabila', 'ada', 'sesuatu', 'mendesak', 'dan', 'butuh', 'reshcedulle', 'tiket', 'tetapi', 'enggak', 'bisa', 'sudah', 'coba', 'telepon', 'dan', 'tanya', 'ke', 'pelayanan', 'center', 'juga', 'enggak', 'ada', 'solusi', 'sudah', 'saya', 'coba', 'manual', 'copot', 'kemudian', 'unduh', 'pasang', 'lagi', 'sama', 'saja', 'enggak', 'bisa', 'harus', 'jadi', 'perhatian', 'dong', 'ini']","['fitur', 'pilihannya', 'busa', 'terakses', 'running', 'versi', 'merugikan', 'konsumen', 'mendesak', 'butuh', 'reshcedulle', 'tiket', 'coba', 'telepon', 'pelayanan', 'center', 'solusi', 'coba', 'manual', 'copot', 'unduh', 'pasang', 'perhatian']","['fitur', 'pilih', 'busa', 'akses', 'running', 'versi', 'rugi', 'konsumen', 'desak', 'butuh', 'reshcedulle', 'tiket', 'coba', 'telepon', 'layan', 'center', 'solusi', 'coba', 'manual', 'copot', 'unduh', 'pasang', 'perhati']"
116,Yg versi baru lemot pol masih mending yg versi sebelumnya,Yang versi baru lambat pol masih mending yang versi sebelumnya,yang versi baru lambat pol masih mending yang versi sebelumnya,"['yang', 'versi', 'baru', 'lambat', 'pol', 'masih', 'mending', 'yang', 'versi', 'sebelumnya']","['versi', 'lambat', 'pol', 'mending', 'versi']","['versi', 'lambat', 'pol', 'mending', 'versi']"
228,Kenapa di upgrade malahbikin lama bukanyav,Kenapa ditingkatkan malah bikin lama bukanya,kenapa ditingkatkan malah bikin lama bukanya,"['kenapa', 'ditingkatkan', 'malah', 'bikin', 'lama', 'bukanya']","['ditingkatkan', 'bikin', 'bukanya']","['tingkat', 'bikin', 'buka']"
420,Tolong dong ini aplikasi nya di perbaiki lagi lemot banget mau buka tiket keburu ebording sebelum di update lancar lancar aja sekarang lemot banget sumpah,Tolong dong ini aplikasinya diperbaiki lagi lambat banget mau buka tiket keburu pembosanan sebelum diperbarui lancar saja sekarang lambat banget sumpah,tolong dong ini aplikasinya diperbaiki lagi lambat banget mau buka tiket keburu pembosanan sebelum diperbarui lancar saja sekarang lambat banget sumpah,"['tolong', 'dong', 'ini', 'aplikasinya', 'diperbaiki', 'lagi', 'lambat', 'banget', 'mau', 'buka', 'tiket', 'keburu', 'pembosanan', 'sebelum', 'diperbarui', 'lancar', 'saja', 'sekarang', 'lambat', 'banget', 'sumpah']","['tolong', 'aplikasinya', 'diperbaiki', 'lambat', 'banget', 'buka', 'tiket', 'keburu', 'pembosanan', 'diperbarui', 'lancar', 'lambat', 'banget', 'sumpah']","['tolong', 'aplikasi', 'baik', 'lambat', 'banget', 'buka', 'tiket', 'keburu', 'bosan', 'baru', 'lancar', 'lambat', 'banget', 'sumpah']"
319,Setelah update jadi susah login butuh waktu yang amat sangat lama itupun gak berhasil juga untuk login Udh terlanjur kesel saya uninstall lagi aja,Setelah memperbarui jadi susah masuk butuh waktu yang amat sangat lama itu pun enggak berhasil juga untuk masuk sudah terlanjur kesal saya copot lagi saja,setelah memperbarui jadi susah masuk butuh waktu yang amat sangat lama itu pun enggak berhasil juga untuk masuk sudah terlanjur kesal saya copot lagi saja,"['setelah', 'memperbarui', 'jadi', 'susah', 'masuk', 'butuh', 'waktu', 'yang', 'amat', 'sangat', 'lama', 'itu', 'pun', 'enggak', 'berhasil', 'juga', 'untuk', 'masuk', 'sudah', 'terlanjur', 'kesal', 'saya', 'copot', 'lagi', 'saja']","['memperbarui', 'susah', 'masuk', 'butuh', 'berhasil', 'masuk', 'terlanjur', 'kesal', 'copot']","['baru', 'susah', 'masuk', 'butuh', 'hasil', 'masuk', 'lanjur', 'kesal', 'copot']"
274,MASALAH MULU,masalah melulu,masalah melulu,"['masalah', 'melulu']",['melulu'],['melulu']
533,metode pembayaran sangat terbatas tidak ada fitur ganti nomor padahal nomor sudah tidak aktif tidak ada tombol pembayaran jika tidak sengaja keluar dr aplikasi,metode pembayaran sangat terbatas tidak ada fitur ganti nomor padahal nomor sudah tidak aktif tidak ada tombol pembayaran jika tidak sengaja keluar dari aplikasi,metode pembayaran sangat terbatas tidak ada fitur ganti nomor padahal nomor sudah tidak aktif tidak ada tombol pembayaran jika tidak sengaja keluar dari aplikasi,"['metode', 'pembayaran', 'sangat', 'terbatas', 'tidak', 'ada', 'fitur', 'ganti', 'nomor', 'padahal', 'nomor', 'sudah', 'tidak', 'aktif', 'tidak', 'ada', 'tombol', 'pembayaran', 'jika', 'tidak', 'sengaja', 'keluar', 'dari', 'aplikasi']","['metode', 'pembayaran', 'terbatas', 'fitur', 'ganti', 'nomor', 'nomor', 'aktif', 'tombol', 'pembayaran', 'sengaja', 'aplikasi']","['metode', 'bayar', 'batas', 'fitur', 'ganti', 'nomor', 'nomor', 'aktif', 'tombol', 'bayar', 'sengaja', 'aplikasi']"
144,Tolong dong kalo update aplikasi blm bisa maksimal jangan di paksain Udah kembali aja di jalan batu Buka aplikasi aja susah bgt berak kaya bawa gunung,Tolong dong kalau memperbarui aplikasi belum bisa maksimal jangan dipaksakan sudah kembali saja di jalan batu buka aplikasi saja susah banget berak kayak bawa gunung,tolong dong kalau memperbarui aplikasi belum bisa maksimal jangan dipaksakan sudah kembali saja di jalan batu buka aplikasi saja susah banget berak kayak bawa gunung,"['tolong', 'dong', 'kalau', 'memperbarui', 'aplikasi', 'belum', 'bisa', 'maksimal', 'jangan', 'dipaksakan', 'sudah', 'kembali', 'saja', 'di', 'jalan', 'batu', 'buka', 'aplikasi', 'saja', 'susah', 'banget', 'berak', 'kayak', 'bawa', 'gunung']","['tolong', 'memperbarui', 'aplikasi', 'maksimal', 'dipaksakan', 'jalan', 'batu', 'buka', 'aplikasi', 'susah', 'banget', 'berak', 'kayak', 'bawa', 'gunung']","['tolong', 'baru', 'aplikasi', 'maksimal', 'paksa', 'jalan', 'batu', 'buka', 'aplikasi', 'susah', 'banget', 'berak', 'kayak', 'bawa', 'gunung']"
381,Setelah update aplikasi sering bermasalah Tidak bisa login ke aplikasi setelah pengisian kode otp karena selalu loading sehingga harus menunggu di block jam karena terlalu sering masukkan kode otp ingin melakukan pembayaran melalui QRIS namun kode QRIS tidak kunjung muncul sehingga tidak bisa bayar tiket jenis kelamin sudah diubah namun setelah direfresh kembali lagi ke jenis kelamin yang salah tertukar antara laki dan perempuan untuk semua penumpang,Setelah memperbarui aplikasi sering bermasalah tidak bisa masuk ke aplikasi setelah pengisian kode OTP karena selalu memuat sehingga harus menunggu diblokir jam karena terlalu sering masukkan kode OTP ingin melakukan pembayaran melalui QRIS namun kode QRIS tidak kunjung muncul sehingga tidak bisa bayar tiket jenis kelamin sudah diubah namun setelah di-refresh kembali lagi ke jenis kelamin yang salah tertukar antara laki dan perempuan untuk semua penumpang,setelah memperbarui aplikasi sering bermasalah tidak bisa masuk ke aplikasi setelah pengisian kode otp karena selalu memuat sehingga harus menunggu diblokir jam karena terlalu sering masukkan kode otp ingin melakukan pembayaran melalui qris namun kode qris tidak kunjung muncul sehingga tidak bisa bayar tiket jenis kelamin sudah diubah namun setelah di-refresh kembali lagi ke jenis kelamin yang salah tertukar antara laki dan perempuan untuk semua penumpang,"['setelah', 'memperbarui', 'aplikasi', 'sering', 'bermasalah', 'tidak', 'bisa', 'masuk', 'ke', 'aplikasi', 'setelah', 'pengisian', 'kode', 'otp', 'karena', 'selalu', 'memuat', 'sehingga', 'harus', 'menunggu', 'diblokir', 'jam', 'karena', 'terlalu', 'sering', 'masukkan', 'kode', 'otp', 'ingin', 'melakukan', 'pembayaran', 'melalui', 'qris', 'namun', 'kode', 'qris', 'tidak', 'kunjung', 'muncul', 'sehingga', 'tidak', 'bisa', 'bayar', 'tiket', 'jenis', 'kelamin', 'sudah', 'diubah', 'namun', 'setelah', 'di-refresh', 'kembali', 'lagi', 'ke', 'jenis', 'kelamin', 'yang', 'salah', 'tertukar', 'antara', 'laki', 'dan', 'perempuan', 'untuk', 'semua', 'penumpang']","['memperbarui', 'aplikasi', 'bermasalah', 'masuk', 'aplikasi', 'pengisian', 'kode', 'otp', 'memuat', 'menunggu', 'diblokir', 'jam', 'masukkan', 'kode', 'otp', 'pembayaran', 'qris', 'kode', 'qris', 'kunjung', 'muncul', 'bayar', 'tiket', 'jenis', 'kelamin', 'diubah', 'di-refresh', 'jenis', 'kelamin', 'salah', 'tertukar', 'laki', 'perempuan', 'penumpang']","['baru', 'aplikasi', 'masalah', 'masuk', 'aplikasi', 'isi', 'kode', 'otp', 'muat', 'tunggu', 'blokir', 'jam', 'masuk', 'kode', 'otp', 'bayar', 'qris', 'kode', 'qris', 'kunjung', 'muncul', 'bayar', 'tiket', 'jenis', 'kelamin', 'ubah', 'di-refresh', 'jenis', 'kelamin', 'salah', 'tukar', 'laki', 'perempuan', 'tumpang']"
538,Nggak jelas banget ni aplikasi ketika di masukan email data nggak kedeteksi padahal dulu udah daftat dan sering makai juga tiba setelah di perbaharui data tidak terdeteksi oleh sistemnya Udah tampilan biasa aja bermasalah pula udah coba install ulang tetap aja kayak gitu Bagusan yang sebelumnya karena yang sekarang lebih ribet pula mesan tiketnya,Enggak jelas banget ini aplikasi ketika dimasukkan surel data tidak terdeteksi padahal dahulu sudah daftat dan sering pakai juga tiba setelah diperbaharui data tidak terdeteksi oleh sistemnya sudah tampilan biasa saja bermasalah pula sudah coba pasang ulang tetap saja kayak begitu bagusan yang sebelumnya karena yang sekarang lebih ribet pula mesan tiketnya,enggak jelas banget ini aplikasi ketika dimasukkan surel data tidak terdeteksi padahal dahulu sudah daftat dan sering pakai juga tiba setelah diperbaharui data tidak terdeteksi oleh sistemnya sudah tampilan biasa saja bermasalah pula sudah coba pasang ulang tetap saja kayak begitu bagusan yang sebelumnya karena yang sekarang lebih ribet pula mesan tiketnya,"['enggak', 'jelas', 'banget', 'ini', 'aplikasi', 'ketika', 'dimasukkan', 'surel', 'data', 'tidak', 'terdeteksi', 'padahal', 'dahulu', 'sudah', 'daftat', 'dan', 'sering', 'pakai', 'juga', 'tiba', 'setelah', 'diperbaharui', 'data', 'tidak', 'terdeteksi', 'oleh', 'sistemnya', 'sudah', 'tampilan', 'biasa', 'saja', 'bermasalah', 'pula', 'sudah', 'coba', 'pasang', 'ulang', 'tetap', 'saja', 'kayak', 'begitu', 'bagusan', 'yang', 'sebelumnya', 'karena', 'yang', 'sekarang', 'lebih', 'ribet', 'pula', 'mesan', 'tiketnya']","['banget', 'aplikasi', 'dimasukkan', 'surel', 'data', 'terdeteksi', 'daftat', 'pakai', 'diperbaharui', 'data', 'terdeteksi', 'sistemnya', 'tampilan', 'bermasalah', 'coba', 'pasang', 'ulang', 'kayak', 'bagusan', 'ribet', 'mesan', 'tiketnya']","['banget', 'aplikasi', 'masuk', 'surel', 'data', 'deteksi', 'daftat', 'pakai', 'baharu', 'data', 'deteksi', 'sistem', 'tampil', 'masalah', 'coba', 'pasang', 'ulang', 'kayak', 'bagus', 'ribet', 'mesan', 'tiket']"
629,Update semakin susah buat pesan tiket,Pembaruan makin susah buat pesan tiket,pembaruan makin susah buat pesan tiket,"['pembaruan', 'makin', 'susah', 'buat', 'pesan', 'tiket']","['pembaruan', 'susah', 'pesan', 'tiket']","['baru', 'susah', 'pesan', 'tiket']"
601,Sy lebih suka tampilan KAI mobile yang lama Tampilan yang baru ini setelah di upgrafe jadi lwbih ribet ga sesimple seperti sebelumnya apk KAI yg sblmnya kalau tiket sudh habis ga ada di tampilkan di bagian list Sekarang ini udh habis pun tiket nya tp masi aja muncul di bagian list,Saya lebih suka tampilan KAI mobile yang lama tampilan yang baru ini setelah di upgrafe jadi lebih ribet enggak sesimpel seperti sebelumnya aplikasi KAI yang sebelumnya kalau tiket sudah habis enggak ada ditampilkan di bagian lis sekarang ini sudah habis pun tiketnya tetapi masih saja muncul di bagian daftar,saya lebih suka tampilan kai mobile yang lama tampilan yang baru ini setelah di upgrafe jadi lebih ribet enggak sesimpel seperti sebelumnya aplikasi kai yang sebelumnya kalau tiket sudah habis enggak ada ditampilkan di bagian lis sekarang ini sudah habis pun tiketnya tetapi masih saja muncul di bagian daftar,"['saya', 'lebih', 'suka', 'tampilan', 'kai', 'mobile', 'yang', 'lama', 'tampilan', 'yang', 'baru', 'ini', 'setelah', 'di', 'upgrafe', 'jadi', 'lebih', 'ribet', 'enggak', 'sesimpel', 'seperti', 'sebelumnya', 'aplikasi', 'kai', 'yang', 'sebelumnya', 'kalau', 'tiket', 'sudah', 'habis', 'enggak', 'ada', 'ditampilkan', 'di', 'bagian', 'lis', 'sekarang', 'ini', 'sudah', 'habis', 'pun', 'tiketnya', 'tetapi', 'masih', 'saja', 'muncul', 'di', 'bagian', 'daftar']","['suka', 'tampilan', 'kai', 'mobile', 'tampilan', 'upgrafe', 'ribet', 'sesimpel', 'aplikasi', 'kai', 'tiket', 'habis', 'ditampilkan', 'lis', 'habis', 'tiketnya', 'muncul', 'daftar']","['suka', 'tampil', 'kai', 'mobile', 'tampil', 'upgrafe', 'ribet', 'simpel', 'aplikasi', 'kai', 'tiket', 'habis', 'tampil', 'lis', 'habis', 'tiket', 'muncul', 'daftar']"
268,diupgrade malah sering blank hitam,ditingkatkan malah sering belank hitam,ditingkatkan malah sering belank hitam,"['ditingkatkan', 'malah', 'sering', 'belank', 'hitam']","['ditingkatkan', 'belank', 'hitam']","['tingkat', 'bank', 'hitam']"
464,Di update kok jadi tidak bisa dibuka malah dihalaman pertama saja,Diperbarui kok jadi tidak bisa dibuka malah di halaman pertama saja,diperbarui kok jadi tidak bisa dibuka malah di halaman pertama saja,"['diperbarui', 'kok', 'jadi', 'tidak', 'bisa', 'dibuka', 'malah', 'di', 'halaman', 'pertama', 'saja']","['diperbarui', 'dibuka', 'halaman']","['baru', 'buka', 'halaman']"
46,Aplikasi yang baru tampilannya makin ribet enak yang dulu tampilan simple dan lebih cepat dalam proses transaksi nya Mungkin bisa diperbaiki lagi dengan tidak terlalu meninggalkan tampilan lama yang lebih sederhana dan tidak ribet dalam proses pemesanan tiket,Aplikasi yang baru tampilannya makin ribet enak yang dahulu tampilan simpel dan lebih cepat dalam proses transaksinya mungkin bisa diperbaiki lagi dengan tidak terlalu meninggalkan tampilan lama yang lebih sederhana dan tidak ribet dalam proses pemesanan tiket,aplikasi yang baru tampilannya makin ribet enak yang dahulu tampilan simpel dan lebih cepat dalam proses transaksinya mungkin bisa diperbaiki lagi dengan tidak terlalu meninggalkan tampilan lama yang lebih sederhana dan tidak ribet dalam proses pemesanan tiket,"['aplikasi', 'yang', 'baru', 'tampilannya', 'makin', 'ribet', 'enak', 'yang', 'dahulu', 'tampilan', 'simpel', 'dan', 'lebih', 'cepat', 'dalam', 'proses', 'transaksinya', 'mungkin', 'bisa', 'diperbaiki', 'lagi', 'dengan', 'tidak', 'terlalu', 'meninggalkan', 'tampilan', 'lama', 'yang', 'lebih', 'sederhana', 'dan', 'tidak', 'ribet', 'dalam', 'proses', 'pemesanan', 'tiket']","['aplikasi', 'tampilannya', 'ribet', 'enak', 'tampilan', 'simpel', 'cepat', 'proses', 'transaksinya', 'diperbaiki', 'meninggalkan', 'tampilan', 'sederhana', 'ribet', 'proses', 'pemesanan', 'tiket']","['aplikasi', 'tampil', 'ribet', 'enak', 'tampil', 'simpel', 'cepat', 'proses', 'transaksi', 'baik', 'tinggal', 'tampil', 'sederhana', 'ribet', 'proses', 'mesan', 'tiket']"
