,kalimat,kalimat_norm,kalimat_cf,kalimat_token,kalimat_stopwords,kalimat_stemmed
472,Setelah update yang terbaru tampilan oke tapi kualitas menurun banget Load lama pas buka app atau pas mencet menu pas mau ke pembayaran juga load lama banget pembayarannya sempet gagal Kita butuh cepet simple dan mudah Ga butuh yang tampilan modern banget atau ala ala anak muda tapi performanya kurang gini apalagi buat yang kebutuhannya setiap hari,Setelah memperbarui yang terbaru tampilan oke tetapi kualitas menurun banget Load lama pas buka aplikasi atau pas mencet menu pas mau ke pembayaran juga memuat lama banget pembayarannya sempat gagal Kita butuh cepat simpel dan mudah enggak butuh yang tampilan modern banget atau ala-ala anak muda tetapi performanya kurang begini apalagi buat yang kebutuhannya setiap hari,setelah memperbarui yang terbaru tampilan oke tetapi kualitas menurun banget load lama pas buka aplikasi atau pas mencet menu pas mau ke pembayaran juga memuat lama banget pembayarannya sempat gagal kita butuh cepat simpel dan mudah enggak butuh yang tampilan modern banget atau ala-ala anak muda tetapi performanya kurang begini apalagi buat yang kebutuhannya setiap hari,"['setelah', 'memperbarui', 'yang', 'terbaru', 'tampilan', 'oke', 'tetapi', 'kualitas', 'menurun', 'banget', 'load', 'lama', 'pas', 'buka', 'aplikasi', 'atau', 'pas', 'mencet', 'menu', 'pas', 'mau', 'ke', 'pembayaran', 'juga', 'memuat', 'lama', 'banget', 'pembayarannya', 'sempat', 'gagal', 'kita', 'butuh', 'cepat', 'simpel', 'dan', 'mudah', 'enggak', 'butuh', 'yang', 'tampilan', 'modern', 'banget', 'atau', 'ala-ala', 'anak', 'muda', 'tetapi', 'performanya', 'kurang', 'begini', 'apalagi', 'buat', 'yang', 'kebutuhannya', 'setiap', 'hari']","['memperbarui', 'terbaru', 'tampilan', 'oke', 'kualitas', 'menurun', 'banget', 'load', 'pas', 'buka', 'aplikasi', 'pas', 'mencet', 'menu', 'pas', 'pembayaran', 'memuat', 'banget', 'pembayarannya', 'gagal', 'butuh', 'cepat', 'simpel', 'mudah', 'butuh', 'tampilan', 'modern', 'banget', 'ala-ala', 'anak', 'muda', 'performanya', 'kebutuhannya']","['baru', 'baru', 'tampil', 'oke', 'kualitas', 'turun', 'banget', 'load', 'pas', 'buka', 'aplikasi', 'pas', 'mencet', 'menu', 'pas', 'bayar', 'muat', 'banget', 'bayar', 'gagal', 'butuh', 'cepat', 'simpel', 'mudah', 'butuh', 'tampil', 'modern', 'banget', 'ala', 'anak', 'muda', 'performa', 'butuh']"
347,Saran aja mending gausah pake Aplikasi buat pesen tiket Skrg apk nya malah makin ribet Lemot juga udh update makin gajelas masukin nmr hp aja loading trs muter sampe sejam Klo dibilang transportasi nyaman murah dan ga bikin macet emg iya tpi liat skrg bnyak kendala klo lg urgent apa susah malah diribetin,Saran saja mending enggak usah pakai aplikasi buat pesan tiket sekarang aplikasinya malah makin ribet lambat juga sudah memperbarui makin enggak jelas masukkan nomor telepon seluler saja memuat terus berputar sampai sejam kalau dibilang transportasi nyaman murah dan enggak bikin macet memang iya tetapi lihat sekarang banyak kendala kalau lagi mendesak apa susah malah diribetkan,saran saja mending enggak usah pakai aplikasi buat pesan tiket sekarang aplikasinya malah makin ribet lambat juga sudah memperbarui makin enggak jelas masukkan nomor telepon seluler saja memuat terus berputar sampai sejam kalau dibilang transportasi nyaman murah dan enggak bikin macet memang iya tetapi lihat sekarang banyak kendala kalau lagi mendesak apa susah malah diribetkan,"['saran', 'saja', 'mending', 'enggak', 'usah', 'pakai', 'aplikasi', 'buat', 'pesan', 'tiket', 'sekarang', 'aplikasinya', 'malah', 'makin', 'ribet', 'lambat', 'juga', 'sudah', 'memperbarui', 'makin', 'enggak', 'jelas', 'masukkan', 'nomor', 'telepon', 'seluler', 'saja', 'memuat', 'terus', 'berputar', 'sampai', 'sejam', 'kalau', 'dibilang', 'transportasi', 'nyaman', 'murah', 'dan', 'enggak', 'bikin', 'macet', 'memang', 'iya', 'tetapi', 'lihat', 'sekarang', 'banyak', 'kendala', 'kalau', 'lagi', 'mendesak', 'apa', 'susah', 'malah', 'diribetkan']","['saran', 'mending', 'pakai', 'aplikasi', 'pesan', 'tiket', 'aplikasinya', 'ribet', 'lambat', 'memperbarui', 'masukkan', 'nomor', 'telepon', 'seluler', 'memuat', 'berputar', 'sejam', 'dibilang', 'transportasi', 'nyaman', 'murah', 'bikin', 'macet', 'iya', 'lihat', 'kendala', 'mendesak', 'susah', 'diribetkan']","['saran', 'mending', 'pakai', 'aplikasi', 'pesan', 'tiket', 'aplikasi', 'ribet', 'lambat', 'baru', 'masuk', 'nomor', 'telepon', 'seluler', 'muat', 'putar', 'jam', 'bilang', 'transportasi', 'nyaman', 'murah', 'bikin', 'macet', 'iya', 'lihat', 'kendala', 'desak', 'susah', 'diribetkan']"
505,Buruk sekali dengan aplikasi yg baru update ini Bayar melalui QRIS pdhal masih ada waktu tapi status tiketnya Tidak ada setelah di cek ternyata timeout hadeehh,Buruk sekali dengan aplikasi yang baru perbaruan ini bayar melalui QRIS padahal masih ada waktu tetapi status tiketnya tidak ada setelah dicek ternyata timeout aduh,buruk sekali dengan aplikasi yang baru perbaruan ini bayar melalui qris padahal masih ada waktu tetapi status tiketnya tidak ada setelah dicek ternyata timeout aduh,"['buruk', 'sekali', 'dengan', 'aplikasi', 'yang', 'baru', 'perbaruan', 'ini', 'bayar', 'melalui', 'qris', 'padahal', 'masih', 'ada', 'waktu', 'tetapi', 'status', 'tiketnya', 'tidak', 'ada', 'setelah', 'dicek', 'ternyata', 'timeout', 'aduh']","['buruk', 'aplikasi', 'perbaruan', 'bayar', 'qris', 'status', 'tiketnya', 'dicek', 'timeout', 'aduh']","['buruk', 'aplikasi', 'baru', 'bayar', 'qris', 'status', 'tiket', 'cek', 'timeout', 'aduh']"
686,Kok dsini umur diatas tahun sudh masuk kursi dewasa tpi nmr NIK ank kan masuknya KK bukan KTP tpi pilihan nya KTP pasor klo NIk KK gamau masuk Sebelum apk ini bisa kok gtu yaahhh,Kok di sini umur di atas tahun sudah masuk kursi dewasa tetapi nomor NIK anak kan masuknya kartu kredit bukan KTP tetapi pilihannya KTP pasor kalau NIk kartu kredit enggak mau masuk sebelum aplikasi ini bisa kok begitu yah,kok di sini umur di atas tahun sudah masuk kursi dewasa tetapi nomor nik anak kan masuknya kartu kredit bukan ktp tetapi pilihannya ktp pasor kalau nik kartu kredit enggak mau masuk sebelum aplikasi ini bisa kok begitu yah,"['kok', 'di', 'sini', 'umur', 'di', 'atas', 'tahun', 'sudah', 'masuk', 'kursi', 'dewasa', 'tetapi', 'nomor', 'nik', 'anak', 'kan', 'masuknya', 'kartu', 'kredit', 'bukan', 'ktp', 'tetapi', 'pilihannya', 'ktp', 'pasor', 'kalau', 'nik', 'kartu', 'kredit', 'enggak', 'mau', 'masuk', 'sebelum', 'aplikasi', 'ini', 'bisa', 'kok', 'begitu', 'yah']","['umur', 'masuk', 'kursi', 'dewasa', 'nomor', 'nik', 'anak', 'masuknya', 'kartu', 'kredit', 'ktp', 'pilihannya', 'ktp', 'pasor', 'nik', 'kartu', 'kredit', 'masuk', 'aplikasi', 'yah']","['umur', 'masuk', 'kursi', 'dewasa', 'nomor', 'nik', 'anak', 'masuk', 'kartu', 'kredit', 'ktp', 'pilih', 'ktp', 'pasor', 'nik', 'kartu', 'kredit', 'masuk', 'aplikasi', 'yah']"
643,Bagaimana ini di uprede terbaru malah tidak bisa pesan tiket muncul nama kereta kita pilih salah satu kreta tidak bisa knp jd ribet begini ya Lebih mudah masih yang lama logo masih warna biru kai bagus yang baru warna agak unggu malah tidak bisa pesan tiket gmn caranya ya pak,Bagaimana ini di uprede terbaru malah tidak bisa pesan tiket muncul nama kereta kita pilih salah satu kereta tidak bisa kenapa jadi ribet begini ya lebih mudah masih yang lama logo masih warna biru Kai bagus yang baru warna agak unggu malah tidak bisa pesan tiket bagaimana caranya ya Pak,bagaimana ini di uprede terbaru malah tidak bisa pesan tiket muncul nama kereta kita pilih salah satu kereta tidak bisa kenapa jadi ribet begini ya lebih mudah masih yang lama logo masih warna biru kai bagus yang baru warna agak unggu malah tidak bisa pesan tiket bagaimana caranya ya pak,"['bagaimana', 'ini', 'di', 'uprede', 'terbaru', 'malah', 'tidak', 'bisa', 'pesan', 'tiket', 'muncul', 'nama', 'kereta', 'kita', 'pilih', 'salah', 'satu', 'kereta', 'tidak', 'bisa', 'kenapa', 'jadi', 'ribet', 'begini', 'ya', 'lebih', 'mudah', 'masih', 'yang', 'lama', 'logo', 'masih', 'warna', 'biru', 'kai', 'bagus', 'yang', 'baru', 'warna', 'agak', 'unggu', 'malah', 'tidak', 'bisa', 'pesan', 'tiket', 'bagaimana', 'caranya', 'ya', 'pak']","['uprede', 'terbaru', 'pesan', 'tiket', 'muncul', 'nama', 'kereta', 'pilih', 'salah', 'kereta', 'ribet', 'ya', 'mudah', 'logo', 'warna', 'biru', 'kai', 'bagus', 'warna', 'unggu', 'pesan', 'tiket', 'ya']","['uprede', 'baru', 'pesan', 'tiket', 'muncul', 'nama', 'kereta', 'pilih', 'salah', 'kereta', 'ribet', 'ya', 'mudah', 'logo', 'warna', 'biru', 'kai', 'bagus', 'warna', 'unggu', 'pesan', 'tiket', 'ya']"
626,Pesan commuter line ga berfungsi Transportasi setua ini tapi aplikasinya ga mendukung,Pesan komuter LINE enggak berfungsi transportasi setua ini tetapi aplikasinya enggak mendukung,pesan komuter line enggak berfungsi transportasi setua ini tetapi aplikasinya enggak mendukung,"['pesan', 'komuter', 'line', 'enggak', 'berfungsi', 'transportasi', 'setua', 'ini', 'tetapi', 'aplikasinya', 'enggak', 'mendukung']","['pesan', 'komuter', 'line', 'berfungsi', 'transportasi', 'setua', 'aplikasinya', 'mendukung']","['pesan', 'komuter', 'line', 'fungsi', 'transportasi', 'tua', 'aplikasi', 'dukung']"
649,Baru upgrade ehh mau pesan tiket gk bs berhenti jumlah penumpang mau cari ka nya apa gak bs saya hrs bagaimana nih,Baru meningkatkan eh mau pesan tiket enggak bisa berhenti jumlah penumpang mau cari Kaknya apa enggak bisa saya harus bagaimana nih,baru meningkatkan eh mau pesan tiket enggak bisa berhenti jumlah penumpang mau cari kaknya apa enggak bisa saya harus bagaimana nih,"['baru', 'meningkatkan', 'eh', 'mau', 'pesan', 'tiket', 'enggak', 'bisa', 'berhenti', 'jumlah', 'penumpang', 'mau', 'cari', 'kaknya', 'apa', 'enggak', 'bisa', 'saya', 'harus', 'bagaimana', 'nih']","['meningkatkan', 'eh', 'pesan', 'tiket', 'berhenti', 'penumpang', 'cari', 'kaknya', 'nih']","['tingkat', 'eh', 'pesan', 'tiket', 'henti', 'tumpang', 'cari', 'kak', 'nih']"
556,Update malah jadi gk jelas tampilanya Logo tidak mencerminkan KAI Kenapa yang digedin malah tulisan ACCESSnya daripada KAI Tampilan pemilihan kereta jelek banget ngikut OTA Mending balikin yang lama aja kelihatan gede nama kereta harganya,Pembaruan malah jadi enggak jelas tampilanya logo tidak mencerminkan KAI Kenapa yang digedin malah tulisan ACCESS-nya daripada KAI Tampilan pemilihan kereta jelek banget mengikut ota mending kembalikan yang lama saja kelihatan gede nama kereta harganya,pembaruan malah jadi enggak jelas tampilanya logo tidak mencerminkan kai kenapa yang digedin malah tulisan access-nya daripada kai tampilan pemilihan kereta jelek banget mengikut ota mending kembalikan yang lama saja kelihatan gede nama kereta harganya,"['pembaruan', 'malah', 'jadi', 'enggak', 'jelas', 'tampilanya', 'logo', 'tidak', 'mencerminkan', 'kai', 'kenapa', 'yang', 'digedin', 'malah', 'tulisan', 'access-nya', 'daripada', 'kai', 'tampilan', 'pemilihan', 'kereta', 'jelek', 'banget', 'mengikut', 'ota', 'mending', 'kembalikan', 'yang', 'lama', 'saja', 'kelihatan', 'gede', 'nama', 'kereta', 'harganya']","['pembaruan', 'tampilanya', 'logo', 'mencerminkan', 'kai', 'digedin', 'tulisan', 'access-nya', 'kai', 'tampilan', 'pemilihan', 'kereta', 'jelek', 'banget', 'mengikut', 'ota', 'mending', 'kembalikan', 'gede', 'nama', 'kereta', 'harganya']","['baru', 'tampilanya', 'logo', 'cermin', 'kai', 'digedin', 'tulis', 'access-nya', 'kai', 'tampil', 'pilih', 'kereta', 'jelek', 'banget', 'ikut', 'ota', 'mending', 'kembali', 'gede', 'nama', 'kereta', 'harga']"
85,Bikin aturan seenaknya ya Bikin update tapi masih banyak bug jadi saya gabisa pulang pakai kereta Harusnya kalo aplikasi ada update gini ada aturan sementara untuk bisa beli tiket di konter untuk berapa minggu sampai aplikasi stabil Coba liat sekarang Karena cuma ada satu perusahaan yang punya kereta jadi seenaknya aja bikin aturan Tau ga sih efeknya ADA YANG GA BISA PERGI PULANG PAKE KERETA KARENA MASALAH APLIKASI Ngerti ga itu tuh vital Mending cari alternatif transportasi lain skrng,Bikin aturan seenaknya ya bikin memperbarui tetapi masih banyak eror jadi saya enggak bisa pulang pakai kereta harusnya kalau aplikasi ada perbarui begini ada aturan sementara untuk bisa beli tiket di konter untuk berapa minggu sampai aplikasi stabil coba lihat sekarang karena cuma ada satu perusahaan yang punya kereta jadi seenaknya saja bikin aturan tahu enggak sih efeknya ada yang enggak bisa pergi pulang pakai kereta karena masalah aplikasi mengerti enggak itu tuh vital mending cari alternatif transportasi lain sekarang,bikin aturan seenaknya ya bikin memperbarui tetapi masih banyak eror jadi saya enggak bisa pulang pakai kereta harusnya kalau aplikasi ada perbarui begini ada aturan sementara untuk bisa beli tiket di konter untuk berapa minggu sampai aplikasi stabil coba lihat sekarang karena cuma ada satu perusahaan yang punya kereta jadi seenaknya saja bikin aturan tahu enggak sih efeknya ada yang enggak bisa pergi pulang pakai kereta karena masalah aplikasi mengerti enggak itu tuh vital mending cari alternatif transportasi lain sekarang,"['bikin', 'aturan', 'seenaknya', 'ya', 'bikin', 'memperbarui', 'tetapi', 'masih', 'banyak', 'eror', 'jadi', 'saya', 'enggak', 'bisa', 'pulang', 'pakai', 'kereta', 'harusnya', 'kalau', 'aplikasi', 'ada', 'perbarui', 'begini', 'ada', 'aturan', 'sementara', 'untuk', 'bisa', 'beli', 'tiket', 'di', 'konter', 'untuk', 'berapa', 'minggu', 'sampai', 'aplikasi', 'stabil', 'coba', 'lihat', 'sekarang', 'karena', 'cuma', 'ada', 'satu', 'perusahaan', 'yang', 'punya', 'kereta', 'jadi', 'seenaknya', 'saja', 'bikin', 'aturan', 'tahu', 'enggak', 'sih', 'efeknya', 'ada', 'yang', 'enggak', 'bisa', 'pergi', 'pulang', 'pakai', 'kereta', 'karena', 'masalah', 'aplikasi', 'mengerti', 'enggak', 'itu', 'tuh', 'vital', 'mending', 'cari', 'alternatif', 'transportasi', 'lain', 'sekarang']","['bikin', 'aturan', 'ya', 'bikin', 'memperbarui', 'eror', 'pulang', 'pakai', 'kereta', 'aplikasi', 'perbarui', 'aturan', 'beli', 'tiket', 'konter', 'minggu', 'aplikasi', 'stabil', 'coba', 'lihat', 'perusahaan', 'kereta', 'bikin', 'aturan', 'sih', 'efeknya', 'pergi', 'pulang', 'pakai', 'kereta', 'aplikasi', 'mengerti', 'tuh', 'vital', 'mending', 'cari', 'alternatif', 'transportasi']","['bikin', 'atur', 'ya', 'bikin', 'baru', 'eror', 'pulang', 'pakai', 'kereta', 'aplikasi', 'baru', 'atur', 'beli', 'tiket', 'konter', 'minggu', 'aplikasi', 'stabil', 'coba', 'lihat', 'usaha', 'kereta', 'bikin', 'atur', 'sih', 'efek', 'pergi', 'pulang', 'pakai', 'kereta', 'aplikasi', 'erti', 'tuh', 'vital', 'mending', 'cari', 'alternatif', 'transportasi']"
242,Bagus,Bagus,bagus,['bagus'],['bagus'],['bagus']
159,Kok semakin lemot ya lebih suka apk yang lama,Kok makin lambat ya lebih suka aplikasi yang lama,kok makin lambat ya lebih suka aplikasi yang lama,"['kok', 'makin', 'lambat', 'ya', 'lebih', 'suka', 'aplikasi', 'yang', 'lama']","['lambat', 'ya', 'suka', 'aplikasi']","['lambat', 'ya', 'suka', 'aplikasi']"
524,Hbz updet pembayaran lewat DA Ako ngada tambah klo dah pesan tiken tinggal menit aj udah kadar luasa,Hubungi deter pembayaran lewat DA Ako mengada tambah kalau sudah pesan tiken tinggal menit saja sudah kadar luasa,hubungi deter pembayaran lewat da ako mengada tambah kalau sudah pesan tiken tinggal menit saja sudah kadar luasa,"['hubungi', 'deter', 'pembayaran', 'lewat', 'da', 'ako', 'mengada', 'tambah', 'kalau', 'sudah', 'pesan', 'tiken', 'tinggal', 'menit', 'saja', 'sudah', 'kadar', 'luasa']","['hubungi', 'deter', 'pembayaran', 'da', 'ako', 'mengada', 'pesan', 'tiken', 'tinggal', 'menit', 'kadar', 'luasa']","['hubung', 'deter', 'bayar', 'da', 'ako', 'ada', 'pesan', 'tiken', 'tinggal', 'menit', 'kadar', 'luasa']"
35,Update terbaru malah jadi parah Tambah lemot dan tambah ribet,Pembaruan terbaru malah jadi parah tambah lambat dan tambah ribet,pembaruan terbaru malah jadi parah tambah lambat dan tambah ribet,"['pembaruan', 'terbaru', 'malah', 'jadi', 'parah', 'tambah', 'lambat', 'dan', 'tambah', 'ribet']","['pembaruan', 'terbaru', 'parah', 'lambat', 'ribet']","['baru', 'baru', 'parah', 'lambat', 'ribet']"
540,Setelah update jadi lemot untuk buka aplikasinya aja lamaa bgt tampilan antarmukanya bagusan yang sebelumnya Tolong di perbaiki,Setelah memperbarui jadi lambat untuk buka aplikasinya saja lama banget tampilan antarmukanya bagusan yang sebelumnya tolong diperbaiki,setelah memperbarui jadi lambat untuk buka aplikasinya saja lama banget tampilan antarmukanya bagusan yang sebelumnya tolong diperbaiki,"['setelah', 'memperbarui', 'jadi', 'lambat', 'untuk', 'buka', 'aplikasinya', 'saja', 'lama', 'banget', 'tampilan', 'antarmukanya', 'bagusan', 'yang', 'sebelumnya', 'tolong', 'diperbaiki']","['memperbarui', 'lambat', 'buka', 'aplikasinya', 'banget', 'tampilan', 'antarmukanya', 'bagusan', 'tolong', 'diperbaiki']","['baru', 'lambat', 'buka', 'aplikasi', 'banget', 'tampil', 'antarmuka', 'bagus', 'tolong', 'baik']"
170,Aplikasi nya blm memuaskan masa loading terus sih masa mandang provider kartu Tolong dong di tingkan lagi sama meraka kesusahan pake aplikasi ini,Aplikasinya belum memuaskan masa memuat terus sih masa memandang penyedia kartu tolong dong ditingkan lagi sama meraka kesusahan pakai aplikasi ini,aplikasinya belum memuaskan masa memuat terus sih masa memandang penyedia kartu tolong dong ditingkan lagi sama meraka kesusahan pakai aplikasi ini,"['aplikasinya', 'belum', 'memuaskan', 'masa', 'memuat', 'terus', 'sih', 'masa', 'memandang', 'penyedia', 'kartu', 'tolong', 'dong', 'ditingkan', 'lagi', 'sama', 'meraka', 'kesusahan', 'pakai', 'aplikasi', 'ini']","['aplikasinya', 'memuaskan', 'memuat', 'sih', 'memandang', 'penyedia', 'kartu', 'tolong', 'ditingkan', 'meraka', 'kesusahan', 'pakai', 'aplikasi']","['aplikasi', 'muas', 'muat', 'sih', 'pandang', 'sedia', 'kartu', 'tolong', 'ting', 'raka', 'susah', 'pakai', 'aplikasi']"
594,Bagus nih tampilan enak diliat dan enteng juga apk nya ga berat,Bagus nih tampilan enak dilihat dan enteng juga aplikasinya enggak berat,bagus nih tampilan enak dilihat dan enteng juga aplikasinya enggak berat,"['bagus', 'nih', 'tampilan', 'enak', 'dilihat', 'dan', 'enteng', 'juga', 'aplikasinya', 'enggak', 'berat']","['bagus', 'nih', 'tampilan', 'enak', 'enteng', 'aplikasinya', 'berat']","['bagus', 'nih', 'tampil', 'enak', 'enteng', 'aplikasi', 'berat']"
586,Djupdate makin lemot mending aplikasi yg lama tampilannya oke tapi parah lemot bgt,diperbarui makin lemot mending aplikasi yang lama tampilannya oke tetapi parah lemot banget,diperbarui makin lemot mending aplikasi yang lama tampilannya oke tetapi parah lemot banget,"['diperbarui', 'makin', 'lemot', 'mending', 'aplikasi', 'yang', 'lama', 'tampilannya', 'oke', 'tetapi', 'parah', 'lemot', 'banget']","['diperbarui', 'lemot', 'mending', 'aplikasi', 'tampilannya', 'oke', 'parah', 'lemot', 'banget']","['baru', 'lot', 'mending', 'aplikasi', 'tampil', 'oke', 'parah', 'lot', 'banget']"
655,Saya ndak bisa login sama sekali dengan alasan sudah terdaftar jangankan upgrade layanan basic dan premium bikin akun saja kesulitan ini gimana se aplikasinya Sangat mengganggu perjalanan saya mau pesan tiket kesusahan gara ndak bisa login,Saya enggak bisa masuk sama sekali dengan alasan sudah terdaftar jangankan meningkatkan layanan dasar dan premium bikin akun saja kesulitan ini bagaimana seaplikasinya sangat mengganggu perjalanan saya mau pesan tiket kesusahan gara-gara enggak bisa masuk,saya enggak bisa masuk sama sekali dengan alasan sudah terdaftar jangankan meningkatkan layanan dasar dan premium bikin akun saja kesulitan ini bagaimana seaplikasinya sangat mengganggu perjalanan saya mau pesan tiket kesusahan gara-gara enggak bisa masuk,"['saya', 'enggak', 'bisa', 'masuk', 'sama', 'sekali', 'dengan', 'alasan', 'sudah', 'terdaftar', 'jangankan', 'meningkatkan', 'layanan', 'dasar', 'dan', 'premium', 'bikin', 'akun', 'saja', 'kesulitan', 'ini', 'bagaimana', 'seaplikasinya', 'sangat', 'mengganggu', 'perjalanan', 'saya', 'mau', 'pesan', 'tiket', 'kesusahan', 'gara-gara', 'enggak', 'bisa', 'masuk']","['masuk', 'alasan', 'terdaftar', 'meningkatkan', 'layanan', 'dasar', 'premium', 'bikin', 'akun', 'kesulitan', 'seaplikasinya', 'mengganggu', 'perjalanan', 'pesan', 'tiket', 'kesusahan', 'gara-gara', 'masuk']","['masuk', 'alas', 'daftar', 'tingkat', 'layan', 'dasar', 'premium', 'bikin', 'akun', 'sulit', 'aplikasi', 'ganggu', 'jalan', 'pesan', 'tiket', 'susah', 'gara-gara', 'masuk']"
95,Lebih enak versi lama,Lebih enak versi lama,lebih enak versi lama,"['lebih', 'enak', 'versi', 'lama']","['enak', 'versi']","['enak', 'versi']"
563,Ki diupdate tampilan nyar apik lakok ra kenek dibuka pye to ki min,Ki diperbarui tampilan nyar apik laki karena kenek dibuka punya ke Ki admin,ki diperbarui tampilan nyar apik laki karena kenek dibuka punya ke ki admin,"['ki', 'diperbarui', 'tampilan', 'nyar', 'apik', 'laki', 'karena', 'kenek', 'dibuka', 'punya', 'ke', 'ki', 'admin']","['ki', 'diperbarui', 'tampilan', 'nyar', 'apik', 'laki', 'kenek', 'dibuka', 'ki', 'admin']","['ki', 'baru', 'tampil', 'nyar', 'apik', 'laki', 'kenek', 'buka', 'ki', 'admin']"
240,Aplikasi di update tapi malah bikin masalah dak bisa login sign failed Coba lupa password masih tetap Sudah telpon kai dikasih password standar tetap saja Benar menghambat bukan malah perbaikan Sebelum diganti harusnya uji coba dulu Padahal harus segera booking tiket Dan sudah banyak penilaian bintang tetap saja aplikasi belum diperbaharui sampai sekarang,Aplikasi diperbarui tetapi malah bikin masalah enggak bisa masuk depan gagal coba lupa kata sandi masih tetap sudah telepon kali dikasih kata sandi standar tetap saja benar menghambat bukan malah perbaikan sebelum diganti harusnya uji coba dahulu padahal harus segera pesan tiket dan sudah banyak penilaian bintang tetap saja aplikasi belum diperbaharui sampai sekarang,aplikasi diperbarui tetapi malah bikin masalah enggak bisa masuk depan gagal coba lupa kata sandi masih tetap sudah telepon kali dikasih kata sandi standar tetap saja benar menghambat bukan malah perbaikan sebelum diganti harusnya uji coba dahulu padahal harus segera pesan tiket dan sudah banyak penilaian bintang tetap saja aplikasi belum diperbaharui sampai sekarang,"['aplikasi', 'diperbarui', 'tetapi', 'malah', 'bikin', 'masalah', 'enggak', 'bisa', 'masuk', 'depan', 'gagal', 'coba', 'lupa', 'kata', 'sandi', 'masih', 'tetap', 'sudah', 'telepon', 'kali', 'dikasih', 'kata', 'sandi', 'standar', 'tetap', 'saja', 'benar', 'menghambat', 'bukan', 'malah', 'perbaikan', 'sebelum', 'diganti', 'harusnya', 'uji', 'coba', 'dahulu', 'padahal', 'harus', 'segera', 'pesan', 'tiket', 'dan', 'sudah', 'banyak', 'penilaian', 'bintang', 'tetap', 'saja', 'aplikasi', 'belum', 'diperbaharui', 'sampai', 'sekarang']","['aplikasi', 'diperbarui', 'bikin', 'masuk', 'gagal', 'coba', 'lupa', 'sandi', 'telepon', 'kali', 'dikasih', 'sandi', 'standar', 'menghambat', 'perbaikan', 'diganti', 'uji', 'coba', 'pesan', 'tiket', 'penilaian', 'bintang', 'aplikasi', 'diperbaharui']","['aplikasi', 'baru', 'bikin', 'masuk', 'gagal', 'coba', 'lupa', 'sandi', 'telepon', 'kali', 'kasih', 'sandi', 'standar', 'hambat', 'baik', 'ganti', 'uji', 'coba', 'pesan', 'tiket', 'nilai', 'bintang', 'aplikasi', 'baharu']"
460,Bukannya di permudah malah makin dipersulit sudah banyak komentar keluhan bukannya malah di perbaiki upgrade malah makin bisa di buka Kecewa,Bukannya dipermudah malah makin dipersulit sudah banyak komentar keluhan bukannya malah diperbaiki meningkatkan malah makin bisa dibuka kecewa,bukannya dipermudah malah makin dipersulit sudah banyak komentar keluhan bukannya malah diperbaiki meningkatkan malah makin bisa dibuka kecewa,"['bukannya', 'dipermudah', 'malah', 'makin', 'dipersulit', 'sudah', 'banyak', 'komentar', 'keluhan', 'bukannya', 'malah', 'diperbaiki', 'meningkatkan', 'malah', 'makin', 'bisa', 'dibuka', 'kecewa']","['dipermudah', 'dipersulit', 'komentar', 'keluhan', 'diperbaiki', 'meningkatkan', 'dibuka', 'kecewa']","['mudah', 'sulit', 'komentar', 'keluh', 'baik', 'tingkat', 'buka', 'kecewa']"
553,semenjak update jadi berat tampilan ui juga ga nyaman,semenjak memperbarui jadi berat tampilan ini juga enggak nyaman,semenjak memperbarui jadi berat tampilan ini juga enggak nyaman,"['semenjak', 'memperbarui', 'jadi', 'berat', 'tampilan', 'ini', 'juga', 'enggak', 'nyaman']","['semenjak', 'memperbarui', 'berat', 'tampilan', 'nyaman']","['semenjak', 'baru', 'berat', 'tampil', 'nyaman']"
609,Tampilan baru Tp kok tambah error Log in ulang Mau coba pesan tiket Harus upgrade Basic member Sudah diikuti langkahnya Malah gk bisa muncul tulisan idnum has already exist Padahal sdh benar mengisinya Lah trus gmn ini,Tampilan baru tetapi kok tambah eror Log in ulang mau coba pesan tiket harus ditingkatkan Basic anggota sudah diikuti langkahnya malah enggak bisa muncul tulisan hidnum has already exist Padahal sudah benar mengisinya lah terus bagaimana ini,tampilan baru tetapi kok tambah eror log in ulang mau coba pesan tiket harus ditingkatkan basic anggota sudah diikuti langkahnya malah enggak bisa muncul tulisan hidnum has already exist padahal sudah benar mengisinya lah terus bagaimana ini,"['tampilan', 'baru', 'tetapi', 'kok', 'tambah', 'eror', 'log', 'in', 'ulang', 'mau', 'coba', 'pesan', 'tiket', 'harus', 'ditingkatkan', 'basic', 'anggota', 'sudah', 'diikuti', 'langkahnya', 'malah', 'enggak', 'bisa', 'muncul', 'tulisan', 'hidnum', 'has', 'already', 'exist', 'padahal', 'sudah', 'benar', 'mengisinya', 'lah', 'terus', 'bagaimana', 'ini']","['tampilan', 'eror', 'log', 'in', 'ulang', 'coba', 'pesan', 'tiket', 'ditingkatkan', 'basic', 'anggota', 'diikuti', 'langkahnya', 'muncul', 'tulisan', 'hidnum', 'has', 'already', 'exist', 'mengisinya']","['tampil', 'eror', 'log', 'in', 'ulang', 'coba', 'pesan', 'tiket', 'tingkat', 'basic', 'anggota', 'ikut', 'langkah', 'muncul', 'tulis', 'hidnum', 'has', 'already', 'exist', 'isi']"
