,kalimat,kalimat_norm,kalimat_cf,kalimat_token,kalimat_stopwords,kalimat_stemmed
194,Dulu sebelum di update jaringannya lancar sekarang Setelah update kok lebit lemot ya Kemarin saya mau pesan tiket sampai memakan waktu menit di ind buat menunggu kode keluar Sampai saya kali percobaan baru bisa Mohon kepada Developer KAI untuk memperbaiki jaringannya Terimakasih,Dahulu sebelum diperbarui jaringannya lancar sekarang setelah memperbarui kok lebit lambat ya kemarin saya mau pesan tiket sampai memakan waktu menit di indonesia buat menunggu kode keluar sampai saya kali percobaan baru bisa mohon kepada pengembang KAI untuk memperbaiki jaringannya terima kasih,dahulu sebelum diperbarui jaringannya lancar sekarang setelah memperbarui kok lebit lambat ya kemarin saya mau pesan tiket sampai memakan waktu menit di indonesia buat menunggu kode keluar sampai saya kali percobaan baru bisa mohon kepada pengembang kai untuk memperbaiki jaringannya terima kasih,"['dahulu', 'sebelum', 'diperbarui', 'jaringannya', 'lancar', 'sekarang', 'setelah', 'memperbarui', 'kok', 'lebit', 'lambat', 'ya', 'kemarin', 'saya', 'mau', 'pesan', 'tiket', 'sampai', 'memakan', 'waktu', 'menit', 'di', 'indonesia', 'buat', 'menunggu', 'kode', 'keluar', 'sampai', 'saya', 'kali', 'percobaan', 'baru', 'bisa', 'mohon', 'kepada', 'pengembang', 'kai', 'untuk', 'memperbaiki', 'jaringannya', 'terima', 'kasih']","['diperbarui', 'jaringannya', 'lancar', 'memperbarui', 'lebit', 'lambat', 'ya', 'kemarin', 'pesan', 'tiket', 'memakan', 'menit', 'indonesia', 'menunggu', 'kode', 'kali', 'percobaan', 'mohon', 'pengembang', 'kai', 'memperbaiki', 'jaringannya', 'terima', 'kasih']","['baru', 'jaring', 'lancar', 'baru', 'lebit', 'lambat', 'ya', 'kemarin', 'pesan', 'tiket', 'makan', 'menit', 'indonesia', 'tunggu', 'kode', 'kali', 'coba', 'mohon', 'kembang', 'kai', 'baik', 'jaring', 'terima', 'kasih']"
591,Setelah di upgrade tampilan baru bukan nya makin baik malah makin buruk apk payah,Setelah ditingkatkan tampilan baru bukannya makin baik malah makin buruk aplikasi payah,setelah ditingkatkan tampilan baru bukannya makin baik malah makin buruk aplikasi payah,"['setelah', 'ditingkatkan', 'tampilan', 'baru', 'bukannya', 'makin', 'baik', 'malah', 'makin', 'buruk', 'aplikasi', 'payah']","['ditingkatkan', 'tampilan', 'buruk', 'aplikasi', 'payah']","['tingkat', 'tampil', 'buruk', 'aplikasi', 'payah']"
599,Tampilan baru Bukan lebih mempermudah tapi lebih mempersulit Kasian kalo orang awam untuk melakukan pemesanan lewat apk kai access,Tampilan baru Bukan lebih mempermudah tetapi lebih mempersulit kasihan kalau orang awam untuk melakukan pemesanan lewat aplikasi KAI Access,tampilan baru bukan lebih mempermudah tetapi lebih mempersulit kasihan kalau orang awam untuk melakukan pemesanan lewat aplikasi kai access,"['tampilan', 'baru', 'bukan', 'lebih', 'mempermudah', 'tetapi', 'lebih', 'mempersulit', 'kasihan', 'kalau', 'orang', 'awam', 'untuk', 'melakukan', 'pemesanan', 'lewat', 'aplikasi', 'kai', 'access']","['tampilan', 'mempermudah', 'mempersulit', 'kasihan', 'orang', 'awam', 'pemesanan', 'aplikasi', 'kai', 'access']","['tampil', 'mudah', 'sulit', 'kasihan', 'orang', 'awam', 'mesan', 'aplikasi', 'kai', 'access']"
424,Payah banget Down semua,Payah banget Down semua,payah banget down semua,"['payah', 'banget', 'down', 'semua']","['payah', 'banget', 'down']","['payah', 'banget', 'down']"
444,Setelah di update semakin lemot parah ga bisa masuk sama sekali,Setelah diperbarui makin lambat parah enggak bisa masuk sama sekali,setelah diperbarui makin lambat parah enggak bisa masuk sama sekali,"['setelah', 'diperbarui', 'makin', 'lambat', 'parah', 'enggak', 'bisa', 'masuk', 'sama', 'sekali']","['diperbarui', 'lambat', 'parah', 'masuk']","['baru', 'lambat', 'parah', 'masuk']"
447,Nge down terus aplikasi nya Tolong perbaiki Sy pengguna setia KA tp knpa setelah update aplikasi malah erorr trs,Menurun terus aplikasinya tolong perbaiki saya pengguna setia KA tetapi kenapa setelah pembaruan aplikasi malah eror terus,menurun terus aplikasinya tolong perbaiki saya pengguna setia ka tetapi kenapa setelah pembaruan aplikasi malah eror terus,"['menurun', 'terus', 'aplikasinya', 'tolong', 'perbaiki', 'saya', 'pengguna', 'setia', 'ka', 'tetapi', 'kenapa', 'setelah', 'pembaruan', 'aplikasi', 'malah', 'eror', 'terus']","['menurun', 'aplikasinya', 'tolong', 'perbaiki', 'pengguna', 'setia', 'ka', 'pembaruan', 'aplikasi', 'eror']","['turun', 'aplikasi', 'tolong', 'baik', 'guna', 'setia', 'ka', 'baru', 'aplikasi', 'eror']"
672,Gimana sih lemot amat hampir ketinggalan kereta woy,Bagaimana sih lambat hampir ketinggalan kereta woi,bagaimana sih lambat hampir ketinggalan kereta woi,"['bagaimana', 'sih', 'lambat', 'hampir', 'ketinggalan', 'kereta', 'woi']","['sih', 'lambat', 'ketinggalan', 'kereta', 'woi']","['sih', 'lambat', 'tinggal', 'kereta', 'woi']"
578,Updatean aplikasiny lemot bener di buka Kai accessny masih enakan tampilan yg lama sebelum apdet,Pembaruan aplikasinya lemot benar dibuka Kai Accessnya masih enakan tampilan yang lama sebelum perbarui,pembaruan aplikasinya lemot benar dibuka kai accessnya masih enakan tampilan yang lama sebelum perbarui,"['pembaruan', 'aplikasinya', 'lemot', 'benar', 'dibuka', 'kai', 'accessnya', 'masih', 'enakan', 'tampilan', 'yang', 'lama', 'sebelum', 'perbarui']","['pembaruan', 'aplikasinya', 'lemot', 'dibuka', 'kai', 'accessnya', 'enakan', 'tampilan', 'perbarui']","['baru', 'aplikasi', 'lot', 'buka', 'kai', 'accessnya', 'enak', 'tampil', 'baru']"
597,Begitu buka aplikasinya layar blank Semakin buruk tampilannya,Begitu buka aplikasinya layar belank semakin buruk tampilannya,begitu buka aplikasinya layar belank semakin buruk tampilannya,"['begitu', 'buka', 'aplikasinya', 'layar', 'belank', 'semakin', 'buruk', 'tampilannya']","['buka', 'aplikasinya', 'layar', 'belank', 'buruk', 'tampilannya']","['buka', 'aplikasi', 'layar', 'bank', 'buruk', 'tampil']"
67,Gara gara ada promo kemerdekaan cara mendapatkan tiket jadi susah saat di search keterangannya semua tiket habis tapi kenapa pakai aplikasi selain KAI seperti olshop masih banyak stok nya Tolong untuk kejelasan slot kursinya diakuratkan lagi,Gara-gara ada promo kemerdekaan cara mendapatkan tiket jadi susah saat di cari keterangannya semua tiket habis tetapi kenapa pakai aplikasi selain KAI seperti toko daring masih banyak stoknya tolong untuk kejelasan slot kursinya diakuratkan lagi,gara-gara ada promo kemerdekaan cara mendapatkan tiket jadi susah saat di cari keterangannya semua tiket habis tetapi kenapa pakai aplikasi selain kai seperti toko daring masih banyak stoknya tolong untuk kejelasan slot kursinya diakuratkan lagi,"['gara-gara', 'ada', 'promo', 'kemerdekaan', 'cara', 'mendapatkan', 'tiket', 'jadi', 'susah', 'saat', 'di', 'cari', 'keterangannya', 'semua', 'tiket', 'habis', 'tetapi', 'kenapa', 'pakai', 'aplikasi', 'selain', 'kai', 'seperti', 'toko', 'daring', 'masih', 'banyak', 'stoknya', 'tolong', 'untuk', 'kejelasan', 'slot', 'kursinya', 'diakuratkan', 'lagi']","['gara-gara', 'promo', 'kemerdekaan', 'tiket', 'susah', 'cari', 'keterangannya', 'tiket', 'habis', 'pakai', 'aplikasi', 'kai', 'toko', 'daring', 'stoknya', 'tolong', 'kejelasan', 'slot', 'kursinya', 'diakuratkan']","['gara-gara', 'promo', 'merdeka', 'tiket', 'susah', 'cari', 'terang', 'tiket', 'habis', 'pakai', 'aplikasi', 'kai', 'toko', 'daring', 'stok', 'tolong', 'jelas', 'slot', 'kursi', 'akurat']"
552,Tampilan baru malah semakin buruk semakin lemot,Tampilan baru malah makin buruk makin lambat,tampilan baru malah makin buruk makin lambat,"['tampilan', 'baru', 'malah', 'makin', 'buruk', 'makin', 'lambat']","['tampilan', 'buruk', 'lambat']","['tampil', 'buruk', 'lambat']"
168,Gara gara update lemot bangattt,Gara-gara memperbarui lambat banget,gara-gara memperbarui lambat banget,"['gara-gara', 'memperbarui', 'lambat', 'banget']","['gara-gara', 'memperbarui', 'lambat', 'banget']","['gara-gara', 'baru', 'lambat', 'banget']"
446,Lemot dan gak bisa login gak jelas,Lemot dan enggak bisa masuk enggak jelas,lemot dan enggak bisa masuk enggak jelas,"['lemot', 'dan', 'enggak', 'bisa', 'masuk', 'enggak', 'jelas']","['lemot', 'masuk']","['lot', 'masuk']"
162,Setelah update kok malah makin lemot yah mau buka aplikasinya aja loading terus,Setelah memperbarui kok malah makin lambat ya mau buka aplikasinya saja memuat terus,setelah memperbarui kok malah makin lambat ya mau buka aplikasinya saja memuat terus,"['setelah', 'memperbarui', 'kok', 'malah', 'makin', 'lambat', 'ya', 'mau', 'buka', 'aplikasinya', 'saja', 'memuat', 'terus']","['memperbarui', 'lambat', 'ya', 'buka', 'aplikasinya', 'memuat']","['baru', 'lambat', 'ya', 'buka', 'aplikasi', 'muat']"
309,Tidak memberikan kemudahan customer update an yg baru ini Maaf bintang Lebih suka aplikasi sebelumnya karena lbh banyak dan mudah dimengerti oleh customer pengguna,Tidak memberikan kemudahan pelanggan perbaruan yang baru ini maaf bintang lebih suka aplikasi sebelumnya karena lebih banyak dan mudah dimengerti oleh pelanggan pengguna,tidak memberikan kemudahan pelanggan perbaruan yang baru ini maaf bintang lebih suka aplikasi sebelumnya karena lebih banyak dan mudah dimengerti oleh pelanggan pengguna,"['tidak', 'memberikan', 'kemudahan', 'pelanggan', 'perbaruan', 'yang', 'baru', 'ini', 'maaf', 'bintang', 'lebih', 'suka', 'aplikasi', 'sebelumnya', 'karena', 'lebih', 'banyak', 'dan', 'mudah', 'dimengerti', 'oleh', 'pelanggan', 'pengguna']","['kemudahan', 'pelanggan', 'perbaruan', 'maaf', 'bintang', 'suka', 'aplikasi', 'mudah', 'dimengerti', 'pelanggan', 'pengguna']","['mudah', 'langgan', 'baru', 'maaf', 'bintang', 'suka', 'aplikasi', 'mudah', 'erti', 'langgan', 'guna']"
193,Pembatalan tiket kereta melalui KAI access dipotong sudah itu proses refund hari baru akan ditransfer balik dan giliran pembatalan reservasi hotel melalui KAI access diarahkan untukmenghubungi traveloka pihak traveloka sudah dihubungi dan setuju serta mengkonfirmasi reservasi dibatalkan tanpa pinalti namun untuk pengembalian dana nya diarahkan menghubungi tempat awal melakukan pemesanan yaitu KAI access di aplikasi KAI access tidak ada sama sekali opsi chat minta bantuan,Pembatalan tiket kereta melalui KAI Access dipotong sudah itu proses pengembalian hari baru akan ditransfer balik dan giliran pembatalan reservasi hotel melalui KAI Access diarahkan untuk menghubungi Traveloka pihak Traveloka sudah dihubungi dan setuju serta mengkonfirmasi reservasi dibatalkan tanpa penalti namun untuk pengembalian dananya diarahkan menghubungi tempat awal melakukan pemesanan yaitu KAI Access di aplikasi KAI Access tidak ada sama sekali opsi percakapan minta bantuan,pembatalan tiket kereta melalui kai access dipotong sudah itu proses pengembalian hari baru akan ditransfer balik dan giliran pembatalan reservasi hotel melalui kai access diarahkan untuk menghubungi traveloka pihak traveloka sudah dihubungi dan setuju serta mengkonfirmasi reservasi dibatalkan tanpa penalti namun untuk pengembalian dananya diarahkan menghubungi tempat awal melakukan pemesanan yaitu kai access di aplikasi kai access tidak ada sama sekali opsi percakapan minta bantuan,"['pembatalan', 'tiket', 'kereta', 'melalui', 'kai', 'access', 'dipotong', 'sudah', 'itu', 'proses', 'pengembalian', 'hari', 'baru', 'akan', 'ditransfer', 'balik', 'dan', 'giliran', 'pembatalan', 'reservasi', 'hotel', 'melalui', 'kai', 'access', 'diarahkan', 'untuk', 'menghubungi', 'traveloka', 'pihak', 'traveloka', 'sudah', 'dihubungi', 'dan', 'setuju', 'serta', 'mengkonfirmasi', 'reservasi', 'dibatalkan', 'tanpa', 'penalti', 'namun', 'untuk', 'pengembalian', 'dananya', 'diarahkan', 'menghubungi', 'tempat', 'awal', 'melakukan', 'pemesanan', 'yaitu', 'kai', 'access', 'di', 'aplikasi', 'kai', 'access', 'tidak', 'ada', 'sama', 'sekali', 'opsi', 'percakapan', 'minta', 'bantuan']","['pembatalan', 'tiket', 'kereta', 'kai', 'access', 'dipotong', 'proses', 'pengembalian', 'ditransfer', 'giliran', 'pembatalan', 'reservasi', 'hotel', 'kai', 'access', 'diarahkan', 'menghubungi', 'traveloka', 'traveloka', 'dihubungi', 'setuju', 'mengkonfirmasi', 'reservasi', 'dibatalkan', 'penalti', 'pengembalian', 'dananya', 'diarahkan', 'menghubungi', 'pemesanan', 'kai', 'access', 'aplikasi', 'kai', 'access', 'opsi', 'percakapan', 'bantuan']","['batal', 'tiket', 'kereta', 'kai', 'access', 'potong', 'proses', 'kembali', 'transfer', 'gilir', 'batal', 'reservasi', 'hotel', 'kai', 'access', 'arah', 'hubung', 'traveloka', 'traveloka', 'hubung', 'tuju', 'konfirmasi', 'reservasi', 'batal', 'penalti', 'kembali', 'dana', 'arah', 'hubung', 'mesan', 'kai', 'access', 'aplikasi', 'kai', 'access', 'opsi', 'cakap', 'bantu']"
628,Kenapa jadi susah mau pesan tiket ya rada lemot dan ngga keluar jadwal kereta nya urgent padahal,Kenapa jadi susah mau pesan tiket ya rada lambat dan enggak keluar jadwal keretanya penting padahal,kenapa jadi susah mau pesan tiket ya rada lambat dan enggak keluar jadwal keretanya penting padahal,"['kenapa', 'jadi', 'susah', 'mau', 'pesan', 'tiket', 'ya', 'rada', 'lambat', 'dan', 'enggak', 'keluar', 'jadwal', 'keretanya', 'penting', 'padahal']","['susah', 'pesan', 'tiket', 'ya', 'rada', 'lambat', 'jadwal', 'keretanya']","['susah', 'pesan', 'tiket', 'ya', 'rada', 'lambat', 'jadwal', 'kereta']"
365,Kok sekarang malah jadi lemot aneh KAI access di uprgred malah makin parah,Kok sekarang malah jadi lambat aneh KAI Access di Uprgred malah makin parah,kok sekarang malah jadi lambat aneh kai access di uprgred malah makin parah,"['kok', 'sekarang', 'malah', 'jadi', 'lambat', 'aneh', 'kai', 'access', 'di', 'uprgred', 'malah', 'makin', 'parah']","['lambat', 'aneh', 'kai', 'access', 'uprgred', 'parah']","['lambat', 'aneh', 'kai', 'access', 'uprgred', 'parah']"
383,Semakin semakin jelek aplikasi nya bukan semakin bagus gabisa login sama sekali error terus pengembangnya kocak,Makin makin jelek aplikasinya bukan makin bagus enggak bisa masuk sama sekali eror terus pengembangnya kocak,makin makin jelek aplikasinya bukan makin bagus enggak bisa masuk sama sekali eror terus pengembangnya kocak,"['makin', 'makin', 'jelek', 'aplikasinya', 'bukan', 'makin', 'bagus', 'enggak', 'bisa', 'masuk', 'sama', 'sekali', 'eror', 'terus', 'pengembangnya', 'kocak']","['jelek', 'aplikasinya', 'bagus', 'masuk', 'eror', 'pengembangnya', 'kocak']","['jelek', 'aplikasi', 'bagus', 'masuk', 'eror', 'kembang', 'kocak']"
627,Balikin dong ke yang lama aja saya hampir tiap hari pakai ka lokal walahar Update yg baru bikin lama banget buat pesan tiket dan sekedar mau buka barcode tiket aja butuh waktu menit karena loading Sangat membuang waktu,Kembalikan dong ke yang lama saja saya hampir tiap hari pakai Kak lokal walahar memperbarui yang baru bikin lama banget buat pesan tiket dan sekadar mau buka barkode tiket saja butuh waktu menit karena memuat sangat membuang waktu,kembalikan dong ke yang lama saja saya hampir tiap hari pakai kak lokal walahar memperbarui yang baru bikin lama banget buat pesan tiket dan sekadar mau buka barkode tiket saja butuh waktu menit karena memuat sangat membuang waktu,"['kembalikan', 'dong', 'ke', 'yang', 'lama', 'saja', 'saya', 'hampir', 'tiap', 'hari', 'pakai', 'kak', 'lokal', 'walahar', 'memperbarui', 'yang', 'baru', 'bikin', 'lama', 'banget', 'buat', 'pesan', 'tiket', 'dan', 'sekadar', 'mau', 'buka', 'barkode', 'tiket', 'saja', 'butuh', 'waktu', 'menit', 'karena', 'memuat', 'sangat', 'membuang', 'waktu']","['kembalikan', 'pakai', 'kak', 'lokal', 'walahar', 'memperbarui', 'bikin', 'banget', 'pesan', 'tiket', 'buka', 'barkode', 'tiket', 'butuh', 'menit', 'memuat', 'membuang']","['kembali', 'pakai', 'kak', 'lokal', 'walahar', 'baru', 'bikin', 'banget', 'pesan', 'tiket', 'buka', 'barkode', 'tiket', 'butuh', 'menit', 'muat', 'buang']"
494,Apasih tiap mau bayar pake kaipay selalu ga bisa saldo berkurang tapi transaksi gagal bikin susah,Apa sih tiap mau bayar pakai Kaipay selalu enggak bisa saldo berkurang tetapi transaksi gagal bikin susah,apa sih tiap mau bayar pakai kaipay selalu enggak bisa saldo berkurang tetapi transaksi gagal bikin susah,"['apa', 'sih', 'tiap', 'mau', 'bayar', 'pakai', 'kaipay', 'selalu', 'enggak', 'bisa', 'saldo', 'berkurang', 'tetapi', 'transaksi', 'gagal', 'bikin', 'susah']","['sih', 'bayar', 'pakai', 'kaipay', 'saldo', 'berkurang', 'transaksi', 'gagal', 'bikin', 'susah']","['sih', 'bayar', 'pakai', 'kaipay', 'saldo', 'kurang', 'transaksi', 'gagal', 'bikin', 'susah']"
152,Setelah update ke logo baru kok malah jadi makin parah ya Untuk masuk ke aplikasinya lama banget dan kadang logout sendiri Saya mau pesen tiket kereta tp gak update akhirnya pesen via KAI web Gak bisa buka tiket padahal belom semua stasiun bisa pake face recognation jadi tetep harus liat kode booking sedangkan untuk masuk ke aplikasinya aja susah Tolong dong diperbaikin lagi kenapa masih bagus versi lama,Setelah memperbarui ke logo baru kok malah jadi makin parah ya Untuk masuk ke aplikasinya lama banget dan kadang keluar sendiri saya mau pesan tiket kereta tetapi enggak memperbarui akhirnya pesan via KAI web enggak bisa buka tiket padahal belum semua stasiun bisa pakai sabun wajah jadi tetap harus lihat kode pemesanan sedangkan untuk masuk ke aplikasinya saja susah tolong dong diperbaiki lagi kenapa masih bagus versi lama,setelah memperbarui ke logo baru kok malah jadi makin parah ya untuk masuk ke aplikasinya lama banget dan kadang keluar sendiri saya mau pesan tiket kereta tetapi enggak memperbarui akhirnya pesan via kai web enggak bisa buka tiket padahal belum semua stasiun bisa pakai sabun wajah jadi tetap harus lihat kode pemesanan sedangkan untuk masuk ke aplikasinya saja susah tolong dong diperbaiki lagi kenapa masih bagus versi lama,"['setelah', 'memperbarui', 'ke', 'logo', 'baru', 'kok', 'malah', 'jadi', 'makin', 'parah', 'ya', 'untuk', 'masuk', 'ke', 'aplikasinya', 'lama', 'banget', 'dan', 'kadang', 'keluar', 'sendiri', 'saya', 'mau', 'pesan', 'tiket', 'kereta', 'tetapi', 'enggak', 'memperbarui', 'akhirnya', 'pesan', 'via', 'kai', 'web', 'enggak', 'bisa', 'buka', 'tiket', 'padahal', 'belum', 'semua', 'stasiun', 'bisa', 'pakai', 'sabun', 'wajah', 'jadi', 'tetap', 'harus', 'lihat', 'kode', 'pemesanan', 'sedangkan', 'untuk', 'masuk', 'ke', 'aplikasinya', 'saja', 'susah', 'tolong', 'dong', 'diperbaiki', 'lagi', 'kenapa', 'masih', 'bagus', 'versi', 'lama']","['memperbarui', 'logo', 'parah', 'ya', 'masuk', 'aplikasinya', 'banget', 'kadang', 'pesan', 'tiket', 'kereta', 'memperbarui', 'pesan', 'via', 'kai', 'web', 'buka', 'tiket', 'stasiun', 'pakai', 'sabun', 'wajah', 'lihat', 'kode', 'pemesanan', 'masuk', 'aplikasinya', 'susah', 'tolong', 'diperbaiki', 'bagus', 'versi']","['baru', 'logo', 'parah', 'ya', 'masuk', 'aplikasi', 'banget', 'kadang', 'pesan', 'tiket', 'kereta', 'baru', 'pesan', 'via', 'kai', 'web', 'buka', 'tiket', 'stasiun', 'pakai', 'sabun', 'wajah', 'lihat', 'kode', 'mesan', 'masuk', 'aplikasi', 'susah', 'tolong', 'baik', 'bagus', 'versi']"
449,Aplikasi lemot cacad aplikasi rosaaakkkk lemot kaya siput rawa,Aplikasi lambat cacat aplikasi Rosak lambat kayak siput rawa,aplikasi lambat cacat aplikasi rosak lambat kayak siput rawa,"['aplikasi', 'lambat', 'cacat', 'aplikasi', 'rosak', 'lambat', 'kayak', 'siput', 'rawa']","['aplikasi', 'lambat', 'cacat', 'aplikasi', 'rosak', 'lambat', 'kayak', 'siput', 'rawa']","['aplikasi', 'lambat', 'cacat', 'aplikasi', 'rosak', 'lambat', 'kayak', 'siput', 'rawa']"
462,Aplikasinya bukan tambah baik malah tambah jelek dan gak bisa dibuka ini pasti ada yang korup biaya pemeliharaan nya upgrade itu harusnya tambah baik ini malah tambah jelek Bikin emosi ajaa,Aplikasinya bukan tambah baik malah tambah jelek dan enggak bisa dibuka ini pasti ada yang korupsi biaya pemeliharaannya meningkatkan itu harusnya tambah baik ini malah tambah jelek bikin emosi saja,aplikasinya bukan tambah baik malah tambah jelek dan enggak bisa dibuka ini pasti ada yang korupsi biaya pemeliharaannya meningkatkan itu harusnya tambah baik ini malah tambah jelek bikin emosi saja,"['aplikasinya', 'bukan', 'tambah', 'baik', 'malah', 'tambah', 'jelek', 'dan', 'enggak', 'bisa', 'dibuka', 'ini', 'pasti', 'ada', 'yang', 'korupsi', 'biaya', 'pemeliharaannya', 'meningkatkan', 'itu', 'harusnya', 'tambah', 'baik', 'ini', 'malah', 'tambah', 'jelek', 'bikin', 'emosi', 'saja']","['aplikasinya', 'jelek', 'dibuka', 'korupsi', 'biaya', 'pemeliharaannya', 'meningkatkan', 'jelek', 'bikin', 'emosi']","['aplikasi', 'jelek', 'buka', 'korupsi', 'biaya', 'pelihara', 'tingkat', 'jelek', 'bikin', 'emosi']"
226,Baru sadar ada pembaruan dari KAI Access ke Access by KAI Kirain ngga sengaja uninstall taunya ganti nama Fiturnya makin banyak iconnya makin banyak Udah enak tampilan sebelumnya sih Udah bener buat layanan pesen tiket doang sih sekarang jual pulsa data bayar listrik App nya makin berat buat pesen tiket makin susah daftar stasiunnya nggak muncul,Baru sadar ada pembaruan dari KAI Access ke Access by KAI Kirain enggak sengaja copot tahunya ganti nama Fiturnya makin banyak ikonnya makin banyak sudah enak tampilan sebelumnya sih sudah benar buat layanan pesan tiket doang sih sekarang jual pulsa data bayar listrik aplikasinya makin berat buat pesan tiket makin susah daftar stasiunnya enggak muncul,baru sadar ada pembaruan dari kai access ke access by kai kirain enggak sengaja copot tahunya ganti nama fiturnya makin banyak ikonnya makin banyak sudah enak tampilan sebelumnya sih sudah benar buat layanan pesan tiket doang sih sekarang jual pulsa data bayar listrik aplikasinya makin berat buat pesan tiket makin susah daftar stasiunnya enggak muncul,"['baru', 'sadar', 'ada', 'pembaruan', 'dari', 'kai', 'access', 'ke', 'access', 'by', 'kai', 'kirain', 'enggak', 'sengaja', 'copot', 'tahunya', 'ganti', 'nama', 'fiturnya', 'makin', 'banyak', 'ikonnya', 'makin', 'banyak', 'sudah', 'enak', 'tampilan', 'sebelumnya', 'sih', 'sudah', 'benar', 'buat', 'layanan', 'pesan', 'tiket', 'doang', 'sih', 'sekarang', 'jual', 'pulsa', 'data', 'bayar', 'listrik', 'aplikasinya', 'makin', 'berat', 'buat', 'pesan', 'tiket', 'makin', 'susah', 'daftar', 'stasiunnya', 'enggak', 'muncul']","['sadar', 'pembaruan', 'kai', 'access', 'access', 'by', 'kai', 'kirain', 'sengaja', 'copot', 'tahunya', 'ganti', 'nama', 'fiturnya', 'ikonnya', 'enak', 'tampilan', 'sih', 'layanan', 'pesan', 'tiket', 'doang', 'sih', 'jual', 'pulsa', 'data', 'bayar', 'listrik', 'aplikasinya', 'berat', 'pesan', 'tiket', 'susah', 'daftar', 'stasiunnya', 'muncul']","['sadar', 'baru', 'kai', 'access', 'access', 'by', 'kai', 'kirain', 'sengaja', 'copot', 'tahu', 'ganti', 'nama', 'fiturnya', 'ikon', 'enak', 'tampil', 'sih', 'layan', 'pesan', 'tiket', 'doang', 'sih', 'jual', 'pulsa', 'data', 'bayar', 'listrik', 'aplikasi', 'berat', 'pesan', 'tiket', 'susah', 'daftar', 'stasiun', 'muncul']"
456,aplikasi makin gak jelas mau masuk apk nya aja nunggu nunggu lama banget terus apa gunanya update malah makin gak jelas seperti ini mau mempermudah apa apa mau mempersulit konsumen kalo mempersulit konsumen berarti siap bangkrut,aplikasi makin enggak jelas mau masuk aplikasinya saja menunggu menunggu menunggu lama banget terus apa gunanya pembaruan malah makin enggak jelas seperti ini mau mempermudah apa-apa mau mempersulit konsumen kalau mempersulit konsumen berarti selesai bangkrut,aplikasi makin enggak jelas mau masuk aplikasinya saja menunggu menunggu menunggu lama banget terus apa gunanya pembaruan malah makin enggak jelas seperti ini mau mempermudah apa-apa mau mempersulit konsumen kalau mempersulit konsumen berarti selesai bangkrut,"['aplikasi', 'makin', 'enggak', 'jelas', 'mau', 'masuk', 'aplikasinya', 'saja', 'menunggu', 'menunggu', 'menunggu', 'lama', 'banget', 'terus', 'apa', 'gunanya', 'pembaruan', 'malah', 'makin', 'enggak', 'jelas', 'seperti', 'ini', 'mau', 'mempermudah', 'apa-apa', 'mau', 'mempersulit', 'konsumen', 'kalau', 'mempersulit', 'konsumen', 'berarti', 'selesai', 'bangkrut']","['aplikasi', 'masuk', 'aplikasinya', 'menunggu', 'menunggu', 'menunggu', 'banget', 'gunanya', 'pembaruan', 'mempermudah', 'apa-apa', 'mempersulit', 'konsumen', 'mempersulit', 'konsumen', 'selesai', 'bangkrut']","['aplikasi', 'masuk', 'aplikasi', 'tunggu', 'tunggu', 'tunggu', 'banget', 'guna', 'baru', 'mudah', 'apa', 'sulit', 'konsumen', 'sulit', 'konsumen', 'selesai', 'bangkrut']"
559,Lagi capek capeknya idup liat ini tambah capek Access by KAI Di update tampilannya malah bikin terkecohh dikira masihh ada ternyata harus dibuka dulu biar bisa liat tiketnya masih ato uda abis lebih ribet ga sii menurutku ya Jangan di judge karna pendapat orang beda,Lagi capek-capeknya hidup lihat ini tambah capek Access by KAI diperbarui tampilannya malah bikin terkecoh dikira masih ada ternyata harus dibuka dahulu biar bisa lihat tiketnya masih atau sudah habis lebih ribet enggak sih menurutku ya jangan di judge karena pendapat orang beda,lagi capek-capeknya hidup lihat ini tambah capek access by kai diperbarui tampilannya malah bikin terkecoh dikira masih ada ternyata harus dibuka dahulu biar bisa lihat tiketnya masih atau sudah habis lebih ribet enggak sih menurutku ya jangan di judge karena pendapat orang beda,"['lagi', 'capek-capeknya', 'hidup', 'lihat', 'ini', 'tambah', 'capek', 'access', 'by', 'kai', 'diperbarui', 'tampilannya', 'malah', 'bikin', 'terkecoh', 'dikira', 'masih', 'ada', 'ternyata', 'harus', 'dibuka', 'dahulu', 'biar', 'bisa', 'lihat', 'tiketnya', 'masih', 'atau', 'sudah', 'habis', 'lebih', 'ribet', 'enggak', 'sih', 'menurutku', 'ya', 'jangan', 'di', 'judge', 'karena', 'pendapat', 'orang', 'beda']","['capek-capeknya', 'hidup', 'lihat', 'capek', 'access', 'by', 'kai', 'diperbarui', 'tampilannya', 'bikin', 'terkecoh', 'dibuka', 'biar', 'lihat', 'tiketnya', 'habis', 'ribet', 'sih', 'menurutku', 'ya', 'judge', 'pendapat', 'orang', 'beda']","['capek', 'hidup', 'lihat', 'capek', 'access', 'by', 'kai', 'baru', 'tampil', 'bikin', 'kecoh', 'buka', 'biar', 'lihat', 'tiket', 'habis', 'ribet', 'sih', 'turut', 'ya', 'judge', 'dapat', 'orang', 'beda']"
