,kalimat,kalimat_norm,kalimat_cf,kalimat_token,kalimat_stopwords,kalimat_stemmed
507,tolong nih saya baru beli tiket baru aja bayar masa aplikasinya tidak bisa dibuka jangan bercanda saya beli tiket bukan termasuk murah lho ya pihak pemilik apk tolong dibenarkan distabilkan apk saya mau cetak tiket bagaimana ini astaghfirullah,tolong nih saya baru beli tiket baru saja bayar masa aplikasinya tidak bisa dibuka jangan bercanda saya beli tiket bukan termasuk murah lo ya pihak pemilik aplikasi tolong dibenarkan distabilkan aplikasi saya mau cetak tiket bagaimana ini astaghfirullah,tolong nih saya baru beli tiket baru saja bayar masa aplikasinya tidak bisa dibuka jangan bercanda saya beli tiket bukan termasuk murah lo ya pihak pemilik aplikasi tolong dibenarkan distabilkan aplikasi saya mau cetak tiket bagaimana ini astaghfirullah,"['tolong', 'nih', 'saya', 'baru', 'beli', 'tiket', 'baru', 'saja', 'bayar', 'masa', 'aplikasinya', 'tidak', 'bisa', 'dibuka', 'jangan', 'bercanda', 'saya', 'beli', 'tiket', 'bukan', 'termasuk', 'murah', 'lo', 'ya', 'pihak', 'pemilik', 'aplikasi', 'tolong', 'dibenarkan', 'distabilkan', 'aplikasi', 'saya', 'mau', 'cetak', 'tiket', 'bagaimana', 'ini', 'astaghfirullah']","['tolong', 'nih', 'beli', 'tiket', 'bayar', 'aplikasinya', 'dibuka', 'bercanda', 'beli', 'tiket', 'murah', 'lo', 'ya', 'pemilik', 'aplikasi', 'tolong', 'dibenarkan', 'distabilkan', 'aplikasi', 'cetak', 'tiket', 'astaghfirullah']","['tolong', 'nih', 'beli', 'tiket', 'bayar', 'aplikasi', 'buka', 'canda', 'beli', 'tiket', 'murah', 'lo', 'ya', 'milik', 'aplikasi', 'tolong', 'benar', 'stabil', 'aplikasi', 'cetak', 'tiket', 'astaghfirullah']"
375,ini kenapaaa gk bisaaa daftarrrr ajggg saya sebagai pengguna merasa kecewa parahhh bangettt makin di update malah makin tololll,ini kenapa enggak bisa daftar anjing saya sebagai pengguna merasa kecewa parah banget makin diperbarui malah makin tolol,ini kenapa enggak bisa daftar anjing saya sebagai pengguna merasa kecewa parah banget makin diperbarui malah makin tolol,"['ini', 'kenapa', 'enggak', 'bisa', 'daftar', 'anjing', 'saya', 'sebagai', 'pengguna', 'merasa', 'kecewa', 'parah', 'banget', 'makin', 'diperbarui', 'malah', 'makin', 'tolol']","['daftar', 'anjing', 'pengguna', 'kecewa', 'parah', 'banget', 'diperbarui', 'tolol']","['daftar', 'anjing', 'guna', 'kecewa', 'parah', 'banget', 'baru', 'tolol']"
211,abis di update malah makin lemot banget,habis diperbarui malah makin lambat banget,habis diperbarui malah makin lambat banget,"['habis', 'diperbarui', 'malah', 'makin', 'lambat', 'banget']","['habis', 'diperbarui', 'lambat', 'banget']","['habis', 'baru', 'lambat', 'banget']"
55,makin kesini makin susah terhubung sering gagal scan atau pembayaran lain ngapain nyediain aplikasi kalo masih eror dan gak bisa stabil mending beli di loker makin payah,makin ke sini makin susah terhubung sering gagal pindai atau pembayaran lain untuk apa menyediakan aplikasi kalau masih eror dan enggak bisa stabil mending beli di loker makin payah,makin ke sini makin susah terhubung sering gagal pindai atau pembayaran lain untuk apa menyediakan aplikasi kalau masih eror dan enggak bisa stabil mending beli di loker makin payah,"['makin', 'ke', 'sini', 'makin', 'susah', 'terhubung', 'sering', 'gagal', 'pindai', 'atau', 'pembayaran', 'lain', 'untuk', 'apa', 'menyediakan', 'aplikasi', 'kalau', 'masih', 'eror', 'dan', 'enggak', 'bisa', 'stabil', 'mending', 'beli', 'di', 'loker', 'makin', 'payah']","['susah', 'terhubung', 'gagal', 'pindai', 'pembayaran', 'menyediakan', 'aplikasi', 'eror', 'stabil', 'mending', 'beli', 'loker', 'payah']","['susah', 'hubung', 'gagal', 'pindai', 'bayar', 'sedia', 'aplikasi', 'eror', 'stabil', 'mending', 'beli', 'loker', 'payah']"
135,bagusan aplikasi lama pilihan reduksi tidak muncul dari segi visualisasi membagongkan tdk enak dilihat dan sulit dipahami user interface tuh jangan ramai banget warnanya user suka yg simpel apakah sblm launching tdk di uji dan analisis dulu ke user sampel balik kayak yg lama aja simpel kl pun mau tambah fungsi ya jangan diubah tampilannya semua,bagusan aplikasi lama pilihan reduksi tidak muncul dari segi visualisasi membagongkan tidak enak dilihat dan sulit dipahami pengguna interfas tuh jangan ramai banget warnanya pengguna suka yang simpel apakah sebelum permainan tidak diuji dan analisis dahulu ke pengguna sampel balik kayak yang lama saja simpel kalau pun mau tambah fungsi ya jangan diubah tampilannya semua,bagusan aplikasi lama pilihan reduksi tidak muncul dari segi visualisasi membagongkan tidak enak dilihat dan sulit dipahami pengguna interfas tuh jangan ramai banget warnanya pengguna suka yang simpel apakah sebelum permainan tidak diuji dan analisis dahulu ke pengguna sampel balik kayak yang lama saja simpel kalau pun mau tambah fungsi ya jangan diubah tampilannya semua,"['bagusan', 'aplikasi', 'lama', 'pilihan', 'reduksi', 'tidak', 'muncul', 'dari', 'segi', 'visualisasi', 'membagongkan', 'tidak', 'enak', 'dilihat', 'dan', 'sulit', 'dipahami', 'pengguna', 'interfas', 'tuh', 'jangan', 'ramai', 'banget', 'warnanya', 'pengguna', 'suka', 'yang', 'simpel', 'apakah', 'sebelum', 'permainan', 'tidak', 'diuji', 'dan', 'analisis', 'dahulu', 'ke', 'pengguna', 'sampel', 'balik', 'kayak', 'yang', 'lama', 'saja', 'simpel', 'kalau', 'pun', 'mau', 'tambah', 'fungsi', 'ya', 'jangan', 'diubah', 'tampilannya', 'semua']","['bagusan', 'aplikasi', 'pilihan', 'reduksi', 'muncul', 'segi', 'visualisasi', 'membagongkan', 'enak', 'sulit', 'dipahami', 'pengguna', 'interfas', 'tuh', 'ramai', 'banget', 'warnanya', 'pengguna', 'suka', 'simpel', 'permainan', 'diuji', 'analisis', 'pengguna', 'sampel', 'kayak', 'simpel', 'fungsi', 'ya', 'diubah', 'tampilannya']","['bagus', 'aplikasi', 'pilih', 'reduksi', 'muncul', 'segi', 'visualisasi', 'bagong', 'enak', 'sulit', 'paham', 'guna', 'interfas', 'tuh', 'ramai', 'banget', 'warna', 'guna', 'suka', 'simpel', 'main', 'uji', 'analisis', 'guna', 'sampel', 'kayak', 'simpel', 'fungsi', 'ya', 'ubah', 'tampil']"
669,tolong untuk topup kai pay pakai qris biar nggak ribet soalnya saya mau beli tiket krl harus pakai kai pay,tolong untuk isi ulang kali pay pakai Qris biar enggak ribet soalnya saya mau beli tiket kepala harus pakai Kai Pay,tolong untuk isi ulang kali pay pakai qris biar enggak ribet soalnya saya mau beli tiket kepala harus pakai kai pay,"['tolong', 'untuk', 'isi', 'ulang', 'kali', 'pay', 'pakai', 'qris', 'biar', 'enggak', 'ribet', 'soalnya', 'saya', 'mau', 'beli', 'tiket', 'kepala', 'harus', 'pakai', 'kai', 'pay']","['tolong', 'isi', 'ulang', 'kali', 'pay', 'pakai', 'qris', 'biar', 'ribet', 'beli', 'tiket', 'kepala', 'pakai', 'kai', 'pay']","['tolong', 'isi', 'ulang', 'kali', 'pay', 'pakai', 'qris', 'biar', 'ribet', 'beli', 'tiket', 'kepala', 'pakai', 'kai', 'pay']"
340,kayaknya sudah normal sukses access by kai,kayaknya sudah normal sukses Access By Kai,kayaknya sudah normal sukses access by kai,"['kayaknya', 'sudah', 'normal', 'sukses', 'access', 'by', 'kai']","['kayaknya', 'normal', 'sukses', 'access', 'by', 'kai']","['kayak', 'normal', 'sukses', 'access', 'by', 'kai']"
2,setelah update kenapa jadi susah buat cek tiket loading terus harus pakai waifi dulu baru bisa dibuka tolong dong diperbaiki,setelah memperbarui kenapa jadi susah buat cek tiket memuat terus harus pakai waifi dahulu baru bisa dibuka tolong dong diperbaiki,setelah memperbarui kenapa jadi susah buat cek tiket memuat terus harus pakai waifi dahulu baru bisa dibuka tolong dong diperbaiki,"['setelah', 'memperbarui', 'kenapa', 'jadi', 'susah', 'buat', 'cek', 'tiket', 'memuat', 'terus', 'harus', 'pakai', 'waifi', 'dahulu', 'baru', 'bisa', 'dibuka', 'tolong', 'dong', 'diperbaiki']","['memperbarui', 'susah', 'cek', 'tiket', 'memuat', 'pakai', 'waifi', 'dibuka', 'tolong', 'diperbaiki']","['baru', 'susah', 'cek', 'tiket', 'muat', 'pakai', 'waifi', 'buka', 'tolong', 'baik']"
227,pas mau buka susah masuknya loding lama banget masih relatif efisien yg lama,pas mau buka susah masuknya memuat lama banget masih relatif efisien yang lama,pas mau buka susah masuknya memuat lama banget masih relatif efisien yang lama,"['pas', 'mau', 'buka', 'susah', 'masuknya', 'memuat', 'lama', 'banget', 'masih', 'relatif', 'efisien', 'yang', 'lama']","['pas', 'buka', 'susah', 'masuknya', 'memuat', 'banget', 'relatif', 'efisien']","['pas', 'buka', 'susah', 'masuk', 'muat', 'banget', 'relatif', 'efisien']"
81,sortiran msh bagus di aplikasi sblmnya bs sort kelas kursi,sortiran masih bagus di aplikasi sebelumnya bisa sort kelas kursi,sortiran masih bagus di aplikasi sebelumnya bisa sort kelas kursi,"['sortiran', 'masih', 'bagus', 'di', 'aplikasi', 'sebelumnya', 'bisa', 'sort', 'kelas', 'kursi']","['sortiran', 'bagus', 'aplikasi', 'sort', 'kelas', 'kursi']","['sortir', 'bagus', 'aplikasi', 'sort', 'kelas', 'kursi']"
432,seletah otomatis update tiba tiba lelet banget terus pas mau aktifin kai pay juga failed gatau kenapa verifikasi otp udah diisi sesuai di sms tapi kode tidak valid sering tiba tiba log out sendiri tiap buka aplikasi harus log in lagi mohon diperbaiki lagi ya min,seletah otomatis memperbarui tiba-tiba lelet banget terus pas mau aktifkan Kai Pay juga keberkas enggak tahu kenapa verifikasi OTP sudah diisi sesuai di SMS tetapi kode tidak valid sering tiba-tiba keluar sendiri tiap buka aplikasi harus masuk lagi mohon diperbaiki lagi ya admin,seletah otomatis memperbarui tiba-tiba lelet banget terus pas mau aktifkan kai pay juga keberkas enggak tahu kenapa verifikasi otp sudah diisi sesuai di sms tetapi kode tidak valid sering tiba-tiba keluar sendiri tiap buka aplikasi harus masuk lagi mohon diperbaiki lagi ya admin,"['seletah', 'otomatis', 'memperbarui', 'tiba-tiba', 'lelet', 'banget', 'terus', 'pas', 'mau', 'aktifkan', 'kai', 'pay', 'juga', 'keberkas', 'enggak', 'tahu', 'kenapa', 'verifikasi', 'otp', 'sudah', 'diisi', 'sesuai', 'di', 'sms', 'tetapi', 'kode', 'tidak', 'valid', 'sering', 'tiba-tiba', 'keluar', 'sendiri', 'tiap', 'buka', 'aplikasi', 'harus', 'masuk', 'lagi', 'mohon', 'diperbaiki', 'lagi', 'ya', 'admin']","['seletah', 'otomatis', 'memperbarui', 'lelet', 'banget', 'pas', 'aktifkan', 'kai', 'pay', 'keberkas', 'verifikasi', 'otp', 'diisi', 'sesuai', 'sms', 'kode', 'valid', 'buka', 'aplikasi', 'masuk', 'mohon', 'diperbaiki', 'ya', 'admin']","['sele', 'otomatis', 'baru', 'lelet', 'banget', 'pas', 'aktif', 'kai', 'pay', 'berkas', 'verifikasi', 'otp', 'isi', 'sesuai', 'sms', 'kode', 'valid', 'buka', 'aplikasi', 'masuk', 'mohon', 'baik', 'ya', 'admin']"
692,sangat memudahkan,sangat memudahkan,sangat memudahkan,"['sangat', 'memudahkan']",['memudahkan'],['mudah']
638,apdet tanpa sepengetahuan saya udah pesan tiket semalem tapi sekarang gabisa login dan terpaksa harus beli tiket lagi di aplikasi lain,perbarui tanpa sepengetahuan saya sudah pesan tiket semalam tetapi sekarang enggak bisa masuk dan terpaksa harus beli tiket lagi di aplikasi lain,perbarui tanpa sepengetahuan saya sudah pesan tiket semalam tetapi sekarang enggak bisa masuk dan terpaksa harus beli tiket lagi di aplikasi lain,"['perbarui', 'tanpa', 'sepengetahuan', 'saya', 'sudah', 'pesan', 'tiket', 'semalam', 'tetapi', 'sekarang', 'enggak', 'bisa', 'masuk', 'dan', 'terpaksa', 'harus', 'beli', 'tiket', 'lagi', 'di', 'aplikasi', 'lain']","['perbarui', 'sepengetahuan', 'pesan', 'tiket', 'semalam', 'masuk', 'terpaksa', 'beli', 'tiket', 'aplikasi']","['baru', 'tahu', 'pesan', 'tiket', 'malam', 'masuk', 'paksa', 'beli', 'tiket', 'aplikasi']"
602,tampilannya lebih suka yang dulu lebih iconic,tampilannya lebih suka yang dahulu lebih ikonis,tampilannya lebih suka yang dahulu lebih ikonis,"['tampilannya', 'lebih', 'suka', 'yang', 'dahulu', 'lebih', 'ikonis']","['tampilannya', 'suka', 'ikonis']","['tampil', 'suka', 'ikonis']"
120,aplikasinya jadi ngaco begini mau cari nama kota stasiunnya jd susah,aplikasinya jadi kacau begini mau cari nama kota stasiunnya jadi susah,aplikasinya jadi kacau begini mau cari nama kota stasiunnya jadi susah,"['aplikasinya', 'jadi', 'kacau', 'begini', 'mau', 'cari', 'nama', 'kota', 'stasiunnya', 'jadi', 'susah']","['aplikasinya', 'kacau', 'cari', 'nama', 'kota', 'stasiunnya', 'susah']","['aplikasi', 'kacau', 'cari', 'nama', 'kota', 'stasiun', 'susah']"
311,abis di update lemoooottttttttt,habis diperbarui lemo,habis diperbarui lemo,"['habis', 'diperbarui', 'lemo']","['habis', 'diperbarui', 'lemo']","['habis', 'baru', 'lemo']"
204,tampilan bagus tp makin lama loadingnya mending versi yang lama simpel tp cepet,tampilan bagus tetapi makin lama memuatnya mending versi yang lama simpel tetapi cepat,tampilan bagus tetapi makin lama memuatnya mending versi yang lama simpel tetapi cepat,"['tampilan', 'bagus', 'tetapi', 'makin', 'lama', 'memuatnya', 'mending', 'versi', 'yang', 'lama', 'simpel', 'tetapi', 'cepat']","['tampilan', 'bagus', 'memuatnya', 'mending', 'versi', 'simpel', 'cepat']","['tampil', 'bagus', 'muat', 'mending', 'versi', 'simpel', 'cepat']"
244,mentenaince kah semenjak update jadi gabisa masuk apk lemottt ngebug udh tau urgent mau cepet pesen tiket lain kali bagusin dulu apk nyaaa baru suruh penumpang beuli online babi,menyenaikankah semenjak pembaruan jadi enggak bisa masuk aplikasi lambat mengepulkan sudah tahu mendesak mau cepat pesan tiket lain kali baguskan dahulu aplikasinya baru suruh penumpang beuli daring babi,menyenaikankah semenjak pembaruan jadi enggak bisa masuk aplikasi lambat mengepulkan sudah tahu mendesak mau cepat pesan tiket lain kali baguskan dahulu aplikasinya baru suruh penumpang beuli daring babi,"['menyenaikankah', 'semenjak', 'pembaruan', 'jadi', 'enggak', 'bisa', 'masuk', 'aplikasi', 'lambat', 'mengepulkan', 'sudah', 'tahu', 'mendesak', 'mau', 'cepat', 'pesan', 'tiket', 'lain', 'kali', 'baguskan', 'dahulu', 'aplikasinya', 'baru', 'suruh', 'penumpang', 'beuli', 'daring', 'babi']","['menyenaikankah', 'semenjak', 'pembaruan', 'masuk', 'aplikasi', 'lambat', 'mengepulkan', 'mendesak', 'cepat', 'pesan', 'tiket', 'kali', 'baguskan', 'aplikasinya', 'suruh', 'penumpang', 'beuli', 'daring', 'babi']","['naik', 'semenjak', 'baru', 'masuk', 'aplikasi', 'lambat', 'kepul', 'desak', 'cepat', 'pesan', 'tiket', 'kali', 'bagus', 'aplikasi', 'suruh', 'tumpang', 'beuli', 'daring', 'babi']"
684,apikasi sangat burukk,apikasi sangat buruk,apikasi sangat buruk,"['apikasi', 'sangat', 'buruk']","['apikasi', 'buruk']","['apikasi', 'buruk']"
271,ko malah lemot versi baru parah ah,kok malah lambat versi baru parah ah,kok malah lambat versi baru parah ah,"['kok', 'malah', 'lambat', 'versi', 'baru', 'parah', 'ah']","['lambat', 'versi', 'parah', 'ah']","['lambat', 'versi', 'parah', 'ah']"
131,jadi ribet gini,jadi ribet begini,jadi ribet begini,"['jadi', 'ribet', 'begini']",['ribet'],['ribet']
678,gak bagus update aplikasinya amat sangat terburuk bintang aja,enggak bagus memperbarui aplikasinya amat sangat terburuk bintang saja,enggak bagus memperbarui aplikasinya amat sangat terburuk bintang saja,"['enggak', 'bagus', 'memperbarui', 'aplikasinya', 'amat', 'sangat', 'terburuk', 'bintang', 'saja']","['bagus', 'memperbarui', 'aplikasinya', 'terburuk', 'bintang']","['bagus', 'baru', 'aplikasi', 'buruk', 'bintang']"
60,jd males pkenya setelah update ga bisa msuk loading terus jd ribet mu msen tiket ge,jadi malas pakainya setelah pembaruan enggak bisa masuk memuat terus jadi ribet mau memasan tiket gue,jadi malas pakainya setelah pembaruan enggak bisa masuk memuat terus jadi ribet mau memasan tiket gue,"['jadi', 'malas', 'pakainya', 'setelah', 'pembaruan', 'enggak', 'bisa', 'masuk', 'memuat', 'terus', 'jadi', 'ribet', 'mau', 'memasan', 'tiket', 'gue']","['malas', 'pakainya', 'pembaruan', 'masuk', 'memuat', 'ribet', 'memasan', 'tiket', 'gue']","['malas', 'pakai', 'baru', 'masuk', 'muat', 'ribet', 'mas', 'tiket', 'gue']"
310,hampir telat kereta karena otomatis update update terakhir justru makin buruk sangat lemot,hampir telat kereta karena otomatis memperbarui perbarui terakhir justru makin buruk sangat lambat,hampir telat kereta karena otomatis memperbarui perbarui terakhir justru makin buruk sangat lambat,"['hampir', 'telat', 'kereta', 'karena', 'otomatis', 'memperbarui', 'perbarui', 'terakhir', 'justru', 'makin', 'buruk', 'sangat', 'lambat']","['telat', 'kereta', 'otomatis', 'memperbarui', 'perbarui', 'buruk', 'lambat']","['telat', 'kereta', 'otomatis', 'baru', 'baru', 'buruk', 'lambat']"
30,lemot banget ga bisa login tolong perbaikannya,lambat banget enggak bisa masuk tolong perbaikannya,lambat banget enggak bisa masuk tolong perbaikannya,"['lambat', 'banget', 'enggak', 'bisa', 'masuk', 'tolong', 'perbaikannya']","['lambat', 'banget', 'masuk', 'tolong', 'perbaikannya']","['lambat', 'banget', 'masuk', 'tolong', 'baik']"
69,diperbarui bukannya update malah makin down nyesel bgt perbarui buka apk ditunggu berjam jam ga jalan bahkan seharian pun tetep ga jalan,diperbarui bukannya perbarui malah makin lemah menyesal banget perbarui buka aplikasi ditunggu berjam jam enggak jalan bahkan seharian pun tetap enggak jalan,diperbarui bukannya perbarui malah makin lemah menyesal banget perbarui buka aplikasi ditunggu berjam jam enggak jalan bahkan seharian pun tetap enggak jalan,"['diperbarui', 'bukannya', 'perbarui', 'malah', 'makin', 'lemah', 'menyesal', 'banget', 'perbarui', 'buka', 'aplikasi', 'ditunggu', 'berjam', 'jam', 'enggak', 'jalan', 'bahkan', 'seharian', 'pun', 'tetap', 'enggak', 'jalan']","['diperbarui', 'perbarui', 'lemah', 'menyesal', 'banget', 'perbarui', 'buka', 'aplikasi', 'ditunggu', 'berjam', 'jam', 'jalan', 'seharian', 'jalan']","['baru', 'baru', 'lemah', 'sesal', 'banget', 'baru', 'buka', 'aplikasi', 'tunggu', 'jam', 'jam', 'jalan', 'hari', 'jalan']"
417,setelah update semakin lemot payah buka aplikasi aja gak bisa,setelah memperbarui semakin lambat payah buka aplikasi saja enggak bisa,setelah memperbarui semakin lambat payah buka aplikasi saja enggak bisa,"['setelah', 'memperbarui', 'semakin', 'lambat', 'payah', 'buka', 'aplikasi', 'saja', 'enggak', 'bisa']","['memperbarui', 'lambat', 'payah', 'buka', 'aplikasi']","['baru', 'lambat', 'payah', 'buka', 'aplikasi']"
631,apliksh yang terbaru ini susa untuk pesan tiket di cek kursi ada tapi pas di klik gak bsa buat pesan tlong di perbaiki lagi,aplikasi yang terbaru ini susah untuk pesan tiket dicek kursi ada tetapi pas di klik enggak bisa buat pesan tolong diperbaiki lagi,aplikasi yang terbaru ini susah untuk pesan tiket dicek kursi ada tetapi pas di klik enggak bisa buat pesan tolong diperbaiki lagi,"['aplikasi', 'yang', 'terbaru', 'ini', 'susah', 'untuk', 'pesan', 'tiket', 'dicek', 'kursi', 'ada', 'tetapi', 'pas', 'di', 'klik', 'enggak', 'bisa', 'buat', 'pesan', 'tolong', 'diperbaiki', 'lagi']","['aplikasi', 'terbaru', 'susah', 'pesan', 'tiket', 'dicek', 'kursi', 'pas', 'klik', 'pesan', 'tolong', 'diperbaiki']","['aplikasi', 'baru', 'susah', 'pesan', 'tiket', 'cek', 'kursi', 'pas', 'klik', 'pesan', 'tolong', 'baik']"
44,tolong atuh perbaiki kualitas nya kan banyak yang pake aplikasi ini seharusnya lebih ditingkatkan lagi jangan tiba tiba keluar sendiri akun nya trs susah login lagi nya loading nya lama banget ampun,tolong dong perbaiki kualitasnya kan banyak yang pakai aplikasi ini seharusnya lebih ditingkatkan lagi jangan tiba-tiba keluar sendiri akunnya terus susah masuk laginya memuatnya lama banget ampun,tolong dong perbaiki kualitasnya kan banyak yang pakai aplikasi ini seharusnya lebih ditingkatkan lagi jangan tiba-tiba keluar sendiri akunnya terus susah masuk laginya memuatnya lama banget ampun,"['tolong', 'dong', 'perbaiki', 'kualitasnya', 'kan', 'banyak', 'yang', 'pakai', 'aplikasi', 'ini', 'seharusnya', 'lebih', 'ditingkatkan', 'lagi', 'jangan', 'tiba-tiba', 'keluar', 'sendiri', 'akunnya', 'terus', 'susah', 'masuk', 'laginya', 'memuatnya', 'lama', 'banget', 'ampun']","['tolong', 'perbaiki', 'kualitasnya', 'pakai', 'aplikasi', 'ditingkatkan', 'akunnya', 'susah', 'masuk', 'laginya', 'memuatnya', 'banget', 'ampun']","['tolong', 'baik', 'kualitas', 'pakai', 'aplikasi', 'tingkat', 'akun', 'susah', 'masuk', 'lagi', 'muat', 'banget', 'ampun']"
623,beberapa hari lalu ada pemberitahuan otomatis update aplikasi setelah update malah gak bisa dipake udah uninstall berkali login ulang berkali restart hp berkali tetep aja gak bisa masih sampek menu data diri sudah ada pemberitahuan kadaluwarsa masa pemesanan anda telah habis silakan melakukan pemesanan ulang laaah pesan aja beluuum,beberapa hari lalu ada pemberitahuan otomatis pembaruan aplikasi setelah perbarui malah enggak bisa dipakai sudah copot berkali masuk ulang berkali setel ulang telepon seluler berkali tetap saja enggak bisa masih sampai menu data diri sudah ada pemberitahuan kedaluwarsa masa pemesanan Anda telah habis silakan melakukan pemesanan ulanglah pesan saja belum,beberapa hari lalu ada pemberitahuan otomatis pembaruan aplikasi setelah perbarui malah enggak bisa dipakai sudah copot berkali masuk ulang berkali setel ulang telepon seluler berkali tetap saja enggak bisa masih sampai menu data diri sudah ada pemberitahuan kedaluwarsa masa pemesanan anda telah habis silakan melakukan pemesanan ulanglah pesan saja belum,"['beberapa', 'hari', 'lalu', 'ada', 'pemberitahuan', 'otomatis', 'pembaruan', 'aplikasi', 'setelah', 'perbarui', 'malah', 'enggak', 'bisa', 'dipakai', 'sudah', 'copot', 'berkali', 'masuk', 'ulang', 'berkali', 'setel', 'ulang', 'telepon', 'seluler', 'berkali', 'tetap', 'saja', 'enggak', 'bisa', 'masih', 'sampai', 'menu', 'data', 'diri', 'sudah', 'ada', 'pemberitahuan', 'kedaluwarsa', 'masa', 'pemesanan', 'anda', 'telah', 'habis', 'silakan', 'melakukan', 'pemesanan', 'ulanglah', 'pesan', 'saja', 'belum']","['pemberitahuan', 'otomatis', 'pembaruan', 'aplikasi', 'perbarui', 'dipakai', 'copot', 'berkali', 'masuk', 'ulang', 'berkali', 'setel', 'ulang', 'telepon', 'seluler', 'berkali', 'menu', 'data', 'pemberitahuan', 'kedaluwarsa', 'pemesanan', 'habis', 'silakan', 'pemesanan', 'ulanglah', 'pesan']","['pemberitahuan', 'otomatis', 'baru', 'aplikasi', 'baru', 'pakai', 'copot', 'kali', 'masuk', 'ulang', 'kali', 'setel', 'ulang', 'telepon', 'seluler', 'kali', 'menu', 'data', 'pemberitahuan', 'kedaluwarsa', 'mesan', 'habis', 'sila', 'mesan', 'ulang', 'pesan']"
70,makin ga efisien lebih baik apk sebelum nya,makin enggak efisien lebih baik aplikasi sebelumnya,makin enggak efisien lebih baik aplikasi sebelumnya,"['makin', 'enggak', 'efisien', 'lebih', 'baik', 'aplikasi', 'sebelumnya']","['efisien', 'aplikasi']","['efisien', 'aplikasi']"
514,tambahkan metode bayar dengan debit bank lain juga hmmm jadi superapps semoga tidak sering terjadi bug dan lemot ya saat digunakan,tambahkan metode bayar dengan debit bank lain juga hem jadi superapps semoga tidak sering terjadi eror dan lambat ya saat digunakan,tambahkan metode bayar dengan debit bank lain juga hem jadi superapps semoga tidak sering terjadi eror dan lambat ya saat digunakan,"['tambahkan', 'metode', 'bayar', 'dengan', 'debit', 'bank', 'lain', 'juga', 'hem', 'jadi', 'superapps', 'semoga', 'tidak', 'sering', 'terjadi', 'eror', 'dan', 'lambat', 'ya', 'saat', 'digunakan']","['tambahkan', 'metode', 'bayar', 'debit', 'bank', 'hem', 'superapps', 'semoga', 'eror', 'lambat', 'ya']","['tambah', 'metode', 'bayar', 'debit', 'bank', 'hem', 'superapps', 'moga', 'eror', 'lambat', 'ya']"
652,knapa malah time out terus saat pesan tiket kereta nya malah ancur gini sih apk nya,kenapa malah time out terus saat pesan tiket keretanya malah hancur begini sih aplikasinya,kenapa malah time out terus saat pesan tiket keretanya malah hancur begini sih aplikasinya,"['kenapa', 'malah', 'time', 'out', 'terus', 'saat', 'pesan', 'tiket', 'keretanya', 'malah', 'hancur', 'begini', 'sih', 'aplikasinya']","['time', 'out', 'pesan', 'tiket', 'keretanya', 'hancur', 'sih', 'aplikasinya']","['time', 'out', 'pesan', 'tiket', 'kereta', 'hancur', 'sih', 'aplikasi']"
249,terlalu diulang ulang,terlalu diulang ulang,terlalu diulang ulang,"['terlalu', 'diulang', 'ulang']","['diulang', 'ulang']","['ulang', 'ulang']"
209,loadingnya lama tiba tiba keluar sendiri dari aplikasi lebih enak versi lama,memuatnya lama tiba-tiba keluar sendiri dari aplikasi lebih enak versi lama,memuatnya lama tiba-tiba keluar sendiri dari aplikasi lebih enak versi lama,"['memuatnya', 'lama', 'tiba-tiba', 'keluar', 'sendiri', 'dari', 'aplikasi', 'lebih', 'enak', 'versi', 'lama']","['memuatnya', 'aplikasi', 'enak', 'versi']","['muat', 'aplikasi', 'enak', 'versi']"
165,knp mau masuk aja susah bngt sih klo yg versi lama bner canggih,kenapa mau masuk saja susah banget sih kalau yang versi lama benar canggih,kenapa mau masuk saja susah banget sih kalau yang versi lama benar canggih,"['kenapa', 'mau', 'masuk', 'saja', 'susah', 'banget', 'sih', 'kalau', 'yang', 'versi', 'lama', 'benar', 'canggih']","['masuk', 'susah', 'banget', 'sih', 'versi', 'canggih']","['masuk', 'susah', 'banget', 'sih', 'versi', 'canggih']"
396,kenapa aplikasinya saya buka tapi ngeblank putih terus ya layarnya gak bisa masuk download aplikasi yang sudah update tapi malah tidak bisa dibuka aplikasinya,kenapa aplikasinya saya buka tetapi berkembali putih terus ya layarnya enggak bisa masuk unduh aplikasi yang sudah memperbarui tetapi malah tidak bisa dibuka aplikasinya,kenapa aplikasinya saya buka tetapi berkembali putih terus ya layarnya enggak bisa masuk unduh aplikasi yang sudah memperbarui tetapi malah tidak bisa dibuka aplikasinya,"['kenapa', 'aplikasinya', 'saya', 'buka', 'tetapi', 'berkembali', 'putih', 'terus', 'ya', 'layarnya', 'enggak', 'bisa', 'masuk', 'unduh', 'aplikasi', 'yang', 'sudah', 'memperbarui', 'tetapi', 'malah', 'tidak', 'bisa', 'dibuka', 'aplikasinya']","['aplikasinya', 'buka', 'berkembali', 'putih', 'ya', 'layarnya', 'masuk', 'unduh', 'aplikasi', 'memperbarui', 'dibuka', 'aplikasinya']","['aplikasi', 'buka', 'kembal', 'putih', 'ya', 'layar', 'masuk', 'unduh', 'aplikasi', 'baru', 'buka', 'aplikasi']"
