,kalimat,kalimat_norm,kalimat_cf,kalimat_token,kalimat_stopwords,kalimat_stemmed
164,kenapa setelah di update jadi lama mau buka apknya gak cuma itu mau pencarian juga lama mohon ditingkatkan lagi biar tidak ada kendala,kenapa setelah diperbarui jadi lama mau buka aplikasinya enggak cuma itu mau pencarian juga lama mohon ditingkatkan lagi biar tidak ada kendala,kenapa setelah diperbarui jadi lama mau buka aplikasinya enggak cuma itu mau pencarian juga lama mohon ditingkatkan lagi biar tidak ada kendala,"['kenapa', 'setelah', 'diperbarui', 'jadi', 'lama', 'mau', 'buka', 'aplikasinya', 'enggak', 'cuma', 'itu', 'mau', 'pencarian', 'juga', 'lama', 'mohon', 'ditingkatkan', 'lagi', 'biar', 'tidak', 'ada', 'kendala']","['diperbarui', 'buka', 'aplikasinya', 'pencarian', 'mohon', 'ditingkatkan', 'biar', 'kendala']","['baru', 'buka', 'aplikasi', 'cari', 'mohon', 'tingkat', 'biar', 'kendala']"
554,tampilan emang bagus tapi loading nya jadi lemot bagusan yang dulu min yang sekarang info makin lengkap tapi aplikasii makin lemot,tampilan memang bagus tetapi memuatnya jadi lambat bagusan yang dahulu admin yang sekarang info makin lengkap tetapi aplikasi makin lemot,tampilan memang bagus tetapi memuatnya jadi lambat bagusan yang dahulu admin yang sekarang info makin lengkap tetapi aplikasi makin lemot,"['tampilan', 'memang', 'bagus', 'tetapi', 'memuatnya', 'jadi', 'lambat', 'bagusan', 'yang', 'dahulu', 'admin', 'yang', 'sekarang', 'info', 'makin', 'lengkap', 'tetapi', 'aplikasi', 'makin', 'lemot']","['tampilan', 'bagus', 'memuatnya', 'lambat', 'bagusan', 'admin', 'info', 'lengkap', 'aplikasi', 'lemot']","['tampil', 'bagus', 'muat', 'lambat', 'bagus', 'admin', 'info', 'lengkap', 'aplikasi', 'lot']"
323,kenapa aplikasinya jadi ribet begini susah masuknya lagi tolong diperbaiki lagi,kenapa aplikasinya jadi ribet begini susah masuknya lagi tolong diperbaiki lagi,kenapa aplikasinya jadi ribet begini susah masuknya lagi tolong diperbaiki lagi,"['kenapa', 'aplikasinya', 'jadi', 'ribet', 'begini', 'susah', 'masuknya', 'lagi', 'tolong', 'diperbaiki', 'lagi']","['aplikasinya', 'ribet', 'susah', 'masuknya', 'tolong', 'diperbaiki']","['aplikasi', 'ribet', 'susah', 'masuk', 'tolong', 'baik']"
65,yg baru ini gak bisa milih tempat duduk kah lemot bgt juga lebih suka yg lama,yang baru ini enggak bisa memilih tempat dudukkah lambat banget juga lebih suka yang lama,yang baru ini enggak bisa memilih tempat dudukkah lambat banget juga lebih suka yang lama,"['yang', 'baru', 'ini', 'enggak', 'bisa', 'memilih', 'tempat', 'dudukkah', 'lambat', 'banget', 'juga', 'lebih', 'suka', 'yang', 'lama']","['memilih', 'dudukkah', 'lambat', 'banget', 'suka']","['pilih', 'duduk', 'lambat', 'banget', 'suka']"
390,ini kenapa gabisa di buka apk kai nya,ini kenapa enggak bisa dibuka aplikasi KAI-nya,ini kenapa enggak bisa dibuka aplikasi kai-nya,"['ini', 'kenapa', 'enggak', 'bisa', 'dibuka', 'aplikasi', 'kai-nya']","['dibuka', 'aplikasi', 'kai-nya']","['buka', 'aplikasi', 'kai-nya']"
49,makin update makin jelek,makin memperbarui makin jelek,makin memperbarui makin jelek,"['makin', 'memperbarui', 'makin', 'jelek']","['memperbarui', 'jelek']","['baru', 'jelek']"
118,kok tambah lemot mau top up malah eror,kok tambah lambat mau isi ulang malah eror,kok tambah lambat mau isi ulang malah eror,"['kok', 'tambah', 'lambat', 'mau', 'isi', 'ulang', 'malah', 'eror']","['lambat', 'isi', 'ulang', 'eror']","['lambat', 'isi', 'ulang', 'eror']"
192,saya kira hanya terjadi di saya namun banyak juga yang mengeluhkan kalau kai access yg sekarang agak lebih ribet dari versi sebelumnya mohon maaf admin jujur saya merasa kai access yg sekarang terlalu mirip dengan aplikasi travelling yg lain saya apresiasi penambahan fitur seperti ka lokal krl dan kcic namun penambahan fitur lain seperti hotel dan bus menurut saya membuat kai access kehilangan identitasnya sebagai kai access,saya kira hanya terjadi di saya namun banyak juga yang mengeluhkan kalau Kai Access yang sekarang agak lebih ribet dari versi sebelumnya mohon maaf admin jujur saya merasa Kai Access yang sekarang terlalu mirip dengan aplikasi perjalanan yang lain saya apresiasi penambahan fitur seperti dan lokal kerla dan KCIC namun penambahan fitur lain seperti hotel dan bus menurut saya membuat kai akses kehilangan identitasnya sebagai kai access,saya kira hanya terjadi di saya namun banyak juga yang mengeluhkan kalau kai access yang sekarang agak lebih ribet dari versi sebelumnya mohon maaf admin jujur saya merasa kai access yang sekarang terlalu mirip dengan aplikasi perjalanan yang lain saya apresiasi penambahan fitur seperti dan lokal kerla dan kcic namun penambahan fitur lain seperti hotel dan bus menurut saya membuat kai akses kehilangan identitasnya sebagai kai access,"['saya', 'kira', 'hanya', 'terjadi', 'di', 'saya', 'namun', 'banyak', 'juga', 'yang', 'mengeluhkan', 'kalau', 'kai', 'access', 'yang', 'sekarang', 'agak', 'lebih', 'ribet', 'dari', 'versi', 'sebelumnya', 'mohon', 'maaf', 'admin', 'jujur', 'saya', 'merasa', 'kai', 'access', 'yang', 'sekarang', 'terlalu', 'mirip', 'dengan', 'aplikasi', 'perjalanan', 'yang', 'lain', 'saya', 'apresiasi', 'penambahan', 'fitur', 'seperti', 'dan', 'lokal', 'kerla', 'dan', 'kcic', 'namun', 'penambahan', 'fitur', 'lain', 'seperti', 'hotel', 'dan', 'bus', 'menurut', 'saya', 'membuat', 'kai', 'akses', 'kehilangan', 'identitasnya', 'sebagai', 'kai', 'access']","['mengeluhkan', 'kai', 'access', 'ribet', 'versi', 'mohon', 'maaf', 'admin', 'jujur', 'kai', 'access', 'aplikasi', 'perjalanan', 'apresiasi', 'penambahan', 'fitur', 'lokal', 'kerla', 'kcic', 'penambahan', 'fitur', 'hotel', 'bus', 'kai', 'akses', 'kehilangan', 'identitasnya', 'kai', 'access']","['keluh', 'kai', 'access', 'ribet', 'versi', 'mohon', 'maaf', 'admin', 'jujur', 'kai', 'access', 'aplikasi', 'jalan', 'apresiasi', 'tambah', 'fitur', 'lokal', 'kerla', 'kcic', 'tambah', 'fitur', 'hotel', 'bus', 'kai', 'akses', 'hilang', 'identitas', 'kai', 'access']"
39,aplikasi diperbarui tapi malah mempersulit dulu bisa bayar pakai ewallet sekarang gagal terus mending dikembalikan kesebelumya malah lancar,aplikasi diperbarui tetapi malah mempersulit dahulu bisa bayar pakai wallet sekarang gagal terus mending dikembalikan kesebelumnya malah lancar,aplikasi diperbarui tetapi malah mempersulit dahulu bisa bayar pakai wallet sekarang gagal terus mending dikembalikan kesebelumnya malah lancar,"['aplikasi', 'diperbarui', 'tetapi', 'malah', 'mempersulit', 'dahulu', 'bisa', 'bayar', 'pakai', 'wallet', 'sekarang', 'gagal', 'terus', 'mending', 'dikembalikan', 'kesebelumnya', 'malah', 'lancar']","['aplikasi', 'diperbarui', 'mempersulit', 'bayar', 'pakai', 'wallet', 'gagal', 'mending', 'dikembalikan', 'kesebelumnya', 'lancar']","['aplikasi', 'baru', 'sulit', 'bayar', 'pakai', 'wallet', 'gagal', 'mending', 'kembali', 'belum', 'lancar']"
259,saya suka kereta,saya suka kereta,saya suka kereta,"['saya', 'suka', 'kereta']","['suka', 'kereta']","['suka', 'kereta']"
434,makin di upgrade makin lambat gabisa pesen tiket ini gimana aku pulangnya ya allah,makin di meningkatkan makin lambat enggak bisa pesan tiket ini bagaimana aku pulangnya ya Allah,makin di meningkatkan makin lambat enggak bisa pesan tiket ini bagaimana aku pulangnya ya allah,"['makin', 'di', 'meningkatkan', 'makin', 'lambat', 'enggak', 'bisa', 'pesan', 'tiket', 'ini', 'bagaimana', 'aku', 'pulangnya', 'ya', 'allah']","['meningkatkan', 'lambat', 'pesan', 'tiket', 'pulangnya', 'ya', 'allah']","['tingkat', 'lambat', 'pesan', 'tiket', 'pulang', 'ya', 'allah']"
6,fitur lebih banyak dan tampilan lebih bagus tapi sayang lemotnya minta ampun untuk memilih tempat duduk lama sekali pembayaran tinggal menunggu kode pembayaran lama dan akhirnya time out akhirnya jadi ngga dapat tiket padahal ini untuk perjalanan mendadak beda jauh dengan waktu aplikasi yang lama sat set bisa cepat ngga loading terus,fitur lebih banyak dan tampilan lebih bagus tetapi sayang lambat minta ampun untuk memilih tempat duduk lama sekali pembayaran tinggal menunggu kode pembayaran lama dan akhirnya time out akhirnya jadi enggak dapat tiket padahal ini untuk perjalanan mendadak beda jauh dengan waktu aplikasi yang lama saat set bisa cepat enggak memuat terus,fitur lebih banyak dan tampilan lebih bagus tetapi sayang lambat minta ampun untuk memilih tempat duduk lama sekali pembayaran tinggal menunggu kode pembayaran lama dan akhirnya time out akhirnya jadi enggak dapat tiket padahal ini untuk perjalanan mendadak beda jauh dengan waktu aplikasi yang lama saat set bisa cepat enggak memuat terus,"['fitur', 'lebih', 'banyak', 'dan', 'tampilan', 'lebih', 'bagus', 'tetapi', 'sayang', 'lambat', 'minta', 'ampun', 'untuk', 'memilih', 'tempat', 'duduk', 'lama', 'sekali', 'pembayaran', 'tinggal', 'menunggu', 'kode', 'pembayaran', 'lama', 'dan', 'akhirnya', 'time', 'out', 'akhirnya', 'jadi', 'enggak', 'dapat', 'tiket', 'padahal', 'ini', 'untuk', 'perjalanan', 'mendadak', 'beda', 'jauh', 'dengan', 'waktu', 'aplikasi', 'yang', 'lama', 'saat', 'set', 'bisa', 'cepat', 'enggak', 'memuat', 'terus']","['fitur', 'tampilan', 'bagus', 'sayang', 'lambat', 'ampun', 'memilih', 'duduk', 'pembayaran', 'tinggal', 'menunggu', 'kode', 'pembayaran', 'time', 'out', 'tiket', 'perjalanan', 'mendadak', 'beda', 'aplikasi', 'set', 'cepat', 'memuat']","['fitur', 'tampil', 'bagus', 'sayang', 'lambat', 'ampun', 'pilih', 'duduk', 'bayar', 'tinggal', 'tunggu', 'kode', 'bayar', 'time', 'out', 'tiket', 'jalan', 'dadak', 'beda', 'aplikasi', 'set', 'cepat', 'muat']"
101,ok,oke,oke,['oke'],['oke'],['oke']
541,secara tampilan oke masalah sistem jauh sama yang lama lemot banget min kukira jaringan yg lemot ternyata bukan sampe restart hp berkali kali mau pesen malah jadi seribet ini mending yang lama,secara tampilan oke masalah sistem jauh sama yang lama lama banget admin kukira jaringan yang lambat ternyata bukan sampai mengulang telepon seluler berkali-kali mau pesan malah jadi seribet ini mending yang lama,secara tampilan oke masalah sistem jauh sama yang lama lama banget admin kukira jaringan yang lambat ternyata bukan sampai mengulang telepon seluler berkali-kali mau pesan malah jadi seribet ini mending yang lama,"['secara', 'tampilan', 'oke', 'masalah', 'sistem', 'jauh', 'sama', 'yang', 'lama', 'lama', 'banget', 'admin', 'kukira', 'jaringan', 'yang', 'lambat', 'ternyata', 'bukan', 'sampai', 'mengulang', 'telepon', 'seluler', 'berkali-kali', 'mau', 'pesan', 'malah', 'jadi', 'seribet', 'ini', 'mending', 'yang', 'lama']","['tampilan', 'oke', 'sistem', 'banget', 'admin', 'kukira', 'jaringan', 'lambat', 'mengulang', 'telepon', 'seluler', 'pesan', 'seribet', 'mending']","['tampil', 'oke', 'sistem', 'banget', 'admin', 'kira', 'jaring', 'lambat', 'ulang', 'telepon', 'seluler', 'pesan', 'seribet', 'mending']"
299,lemot paraaaaaaah aplikasinya,lambat parah aplikasinya,lambat parah aplikasinya,"['lambat', 'parah', 'aplikasinya']","['lambat', 'parah', 'aplikasinya']","['lambat', 'parah', 'aplikasi']"
503,keren jg update yg terbaru,keren juga memperbarui yang terbaru,keren juga memperbarui yang terbaru,"['keren', 'juga', 'memperbarui', 'yang', 'terbaru']","['keren', 'memperbarui', 'terbaru']","['keren', 'baru', 'baru']"
499,jangan gunakan aplikasi ini beli token pln sdh bayar tapi ngga ada aplikasi ini mempermalukan kai,jangan gunakan aplikasi ini beli token PLN sudah bayar tetapi enggak ada aplikasi ini mempermalukan kali,jangan gunakan aplikasi ini beli token pln sudah bayar tetapi enggak ada aplikasi ini mempermalukan kali,"['jangan', 'gunakan', 'aplikasi', 'ini', 'beli', 'token', 'pln', 'sudah', 'bayar', 'tetapi', 'enggak', 'ada', 'aplikasi', 'ini', 'mempermalukan', 'kali']","['aplikasi', 'beli', 'token', 'pln', 'bayar', 'aplikasi', 'mempermalukan', 'kali']","['aplikasi', 'beli', 'token', 'pln', 'bayar', 'aplikasi', 'malu', 'kali']"
318,gimna sihhh ini makin susah masuk aj harus log in teruss mana setiap hari pulang pergi kerja harus naek kereta tolong di benahi dong katanya lebih mudah tapi nyatanya,bagaimana sih ini makin susah masuk saja harus masuk terus mana setiap hari pulang pergi kerja harus naik kereta tolong dibenahi dong katanya lebih mudah tetapi nyatanya,bagaimana sih ini makin susah masuk saja harus masuk terus mana setiap hari pulang pergi kerja harus naik kereta tolong dibenahi dong katanya lebih mudah tetapi nyatanya,"['bagaimana', 'sih', 'ini', 'makin', 'susah', 'masuk', 'saja', 'harus', 'masuk', 'terus', 'mana', 'setiap', 'hari', 'pulang', 'pergi', 'kerja', 'harus', 'naik', 'kereta', 'tolong', 'dibenahi', 'dong', 'katanya', 'lebih', 'mudah', 'tetapi', 'nyatanya']","['sih', 'susah', 'masuk', 'masuk', 'pulang', 'pergi', 'kerja', 'kereta', 'tolong', 'dibenahi', 'mudah']","['sih', 'susah', 'masuk', 'masuk', 'pulang', 'pergi', 'kerja', 'kereta', 'tolong', 'benah', 'mudah']"
145,upgrade biar makin meningkat ini malah tambah parah lemot dioperasikan gimana sih malah mempersulit hubungi lewat sosial media lain no respon parah banget,meningkatkan biar makin meningkat ini malah tambah parah lambat dioperasikan bagaimana sih malah mempersulit hubungi lewat media sosial media lain respons parah banget,meningkatkan biar makin meningkat ini malah tambah parah lambat dioperasikan bagaimana sih malah mempersulit hubungi lewat media sosial media lain respons parah banget,"['meningkatkan', 'biar', 'makin', 'meningkat', 'ini', 'malah', 'tambah', 'parah', 'lambat', 'dioperasikan', 'bagaimana', 'sih', 'malah', 'mempersulit', 'hubungi', 'lewat', 'media', 'sosial', 'media', 'lain', 'respons', 'parah', 'banget']","['meningkatkan', 'biar', 'meningkat', 'parah', 'lambat', 'dioperasikan', 'sih', 'mempersulit', 'hubungi', 'media', 'sosial', 'media', 'respons', 'parah', 'banget']","['tingkat', 'biar', 'tingkat', 'parah', 'lambat', 'operasi', 'sih', 'sulit', 'hubung', 'media', 'sosial', 'media', 'respons', 'parah', 'banget']"
569,sejauh ini mudah digunakan dengan tampilan access baru tapi tolong diperbaiki tampilan kai antarkota ngga bisa diklik dibagian bawahnya krn tampilannya ngga full dan aplikasi sering berhenti sendiri terima kasih atensinya mohon segera dilakukan perbaikan sehingga bisa pesan tiket antarkota dgn mudah,sejauh ini mudah digunakan dengan tampilan akses baru tetapi tolong diperbaiki tampilan kali antarkota enggak bisa diklik di bagian bawahnya karena tampilannya enggak penuh dan aplikasi sering berhenti sendiri terima kasih atensinya mohon segera dilakukan perbaikan sehingga bisa pesan tiket antarkota dengan mudah,sejauh ini mudah digunakan dengan tampilan akses baru tetapi tolong diperbaiki tampilan kali antarkota enggak bisa diklik di bagian bawahnya karena tampilannya enggak penuh dan aplikasi sering berhenti sendiri terima kasih atensinya mohon segera dilakukan perbaikan sehingga bisa pesan tiket antarkota dengan mudah,"['sejauh', 'ini', 'mudah', 'digunakan', 'dengan', 'tampilan', 'akses', 'baru', 'tetapi', 'tolong', 'diperbaiki', 'tampilan', 'kali', 'antarkota', 'enggak', 'bisa', 'diklik', 'di', 'bagian', 'bawahnya', 'karena', 'tampilannya', 'enggak', 'penuh', 'dan', 'aplikasi', 'sering', 'berhenti', 'sendiri', 'terima', 'kasih', 'atensinya', 'mohon', 'segera', 'dilakukan', 'perbaikan', 'sehingga', 'bisa', 'pesan', 'tiket', 'antarkota', 'dengan', 'mudah']","['mudah', 'tampilan', 'akses', 'tolong', 'diperbaiki', 'tampilan', 'kali', 'antarkota', 'diklik', 'bawahnya', 'tampilannya', 'penuh', 'aplikasi', 'berhenti', 'terima', 'kasih', 'atensinya', 'mohon', 'perbaikan', 'pesan', 'tiket', 'antarkota', 'mudah']","['mudah', 'tampil', 'akses', 'tolong', 'baik', 'tampil', 'kali', 'antarkota', 'klik', 'bawah', 'tampil', 'penuh', 'aplikasi', 'henti', 'terima', 'kasih', 'atensi', 'mohon', 'baik', 'pesan', 'tiket', 'antarkota', 'mudah']"
353,super lelet asli lelet sedunia,super lelet asli lelet sedunia,super lelet asli lelet sedunia,"['super', 'lelet', 'asli', 'lelet', 'sedunia']","['super', 'lelet', 'asli', 'lelet', 'sedunia']","['super', 'lelet', 'asli', 'lelet', 'dunia']"
208,aplikasi jadi semakin susah dimengerti untuk cek jadwal krl aja ga detail seperti sebelumnya lemot malah jadi jelek,aplikasi jadi semakin susah dimengerti untuk cek jadwal kerla saja enggak detail seperti sebelumnya lambat malah jadi jelek,aplikasi jadi semakin susah dimengerti untuk cek jadwal kerla saja enggak detail seperti sebelumnya lambat malah jadi jelek,"['aplikasi', 'jadi', 'semakin', 'susah', 'dimengerti', 'untuk', 'cek', 'jadwal', 'kerla', 'saja', 'enggak', 'detail', 'seperti', 'sebelumnya', 'lambat', 'malah', 'jadi', 'jelek']","['aplikasi', 'susah', 'dimengerti', 'cek', 'jadwal', 'kerla', 'detail', 'lambat', 'jelek']","['aplikasi', 'susah', 'erti', 'cek', 'jadwal', 'kerla', 'detail', 'lambat', 'jelek']"
693,lemot,lemot,lemot,['lemot'],['lemot'],['lot']
361,beberapa hari terakhir jadi lambat banget proses pembayaran sama cek tiketnya bisa sampai makan waktu sampe menit cuman utk beli tiket sama menit cmn buat buka tiket untung saya masih ke kejar keretanya,beberapa hari terakhir jadi lambat banget proses pembayaran sama cek tiketnya bisa sampai makan waktu sampai menit cuma untuk beli tiket sama menit cuma buat buka tiket untung saya masih ke kejar keretanya,beberapa hari terakhir jadi lambat banget proses pembayaran sama cek tiketnya bisa sampai makan waktu sampai menit cuma untuk beli tiket sama menit cuma buat buka tiket untung saya masih ke kejar keretanya,"['beberapa', 'hari', 'terakhir', 'jadi', 'lambat', 'banget', 'proses', 'pembayaran', 'sama', 'cek', 'tiketnya', 'bisa', 'sampai', 'makan', 'waktu', 'sampai', 'menit', 'cuma', 'untuk', 'beli', 'tiket', 'sama', 'menit', 'cuma', 'buat', 'buka', 'tiket', 'untung', 'saya', 'masih', 'ke', 'kejar', 'keretanya']","['lambat', 'banget', 'proses', 'pembayaran', 'cek', 'tiketnya', 'makan', 'menit', 'beli', 'tiket', 'menit', 'buka', 'tiket', 'untung', 'kejar', 'keretanya']","['lambat', 'banget', 'proses', 'bayar', 'cek', 'tiket', 'makan', 'menit', 'beli', 'tiket', 'menit', 'buka', 'tiket', 'untung', 'kejar', 'kereta']"
86,aplikasi nya sangat lemot saya batal terus saat mau bayar karna loading nya lama sampai waktu limit pembayaran nya habis,aplikasinya sangat lambat saya batal terus saat mau bayar karena memuatnya lama sampai waktu limit pembayarannya habis,aplikasinya sangat lambat saya batal terus saat mau bayar karena memuatnya lama sampai waktu limit pembayarannya habis,"['aplikasinya', 'sangat', 'lambat', 'saya', 'batal', 'terus', 'saat', 'mau', 'bayar', 'karena', 'memuatnya', 'lama', 'sampai', 'waktu', 'limit', 'pembayarannya', 'habis']","['aplikasinya', 'lambat', 'batal', 'bayar', 'memuatnya', 'limit', 'pembayarannya', 'habis']","['aplikasi', 'lambat', 'batal', 'bayar', 'muat', 'limit', 'bayar', 'habis']"
473,kenapa setelah di upgrade malah jadi lemot ya saya kira jaringan nya ternyata aplikasi nya buka jadwal pembayaran malah jadi lama banget kebayang kalo lagi buru buru udah gak akan kekejar ini yang sebelum nya malah lebih cepet,kenapa setelah ditingkatkan malah jadi lambat ya saya kira jaringannya ternyata aplikasinya buka jadwal pembayaran malah jadi lama banget terbayang kalau lagi buru-buru sudah enggak akan kekejar ini yang sebelumnya malah lebih cepat,kenapa setelah ditingkatkan malah jadi lambat ya saya kira jaringannya ternyata aplikasinya buka jadwal pembayaran malah jadi lama banget terbayang kalau lagi buru-buru sudah enggak akan kekejar ini yang sebelumnya malah lebih cepat,"['kenapa', 'setelah', 'ditingkatkan', 'malah', 'jadi', 'lambat', 'ya', 'saya', 'kira', 'jaringannya', 'ternyata', 'aplikasinya', 'buka', 'jadwal', 'pembayaran', 'malah', 'jadi', 'lama', 'banget', 'terbayang', 'kalau', 'lagi', 'buru-buru', 'sudah', 'enggak', 'akan', 'kekejar', 'ini', 'yang', 'sebelumnya', 'malah', 'lebih', 'cepat']","['ditingkatkan', 'lambat', 'ya', 'jaringannya', 'aplikasinya', 'buka', 'jadwal', 'pembayaran', 'banget', 'terbayang', 'buru-buru', 'kekejar', 'cepat']","['tingkat', 'lambat', 'ya', 'jaring', 'aplikasi', 'buka', 'jadwal', 'bayar', 'banget', 'bayang', 'buru', 'kejar', 'cepat']"
422,ini aplikasi kenapa ya diupdate tapi malah gk bisa dipake,ini aplikasi kenapa ya diperbarui tetapi malah enggak bisa dipakai,ini aplikasi kenapa ya diperbarui tetapi malah enggak bisa dipakai,"['ini', 'aplikasi', 'kenapa', 'ya', 'diperbarui', 'tetapi', 'malah', 'enggak', 'bisa', 'dipakai']","['aplikasi', 'ya', 'diperbarui', 'dipakai']","['aplikasi', 'ya', 'baru', 'pakai']"
388,aneh gak bisa dibuka setelah update udh banyak penurunan ga bisa dibuka lagi ntah ala guna updatenya,aneh enggak bisa dibuka setelah memperbarui sudah banyak penurunan enggak bisa dibuka lagi entah ala guna pembaruannya,aneh enggak bisa dibuka setelah memperbarui sudah banyak penurunan enggak bisa dibuka lagi entah ala guna pembaruannya,"['aneh', 'enggak', 'bisa', 'dibuka', 'setelah', 'memperbarui', 'sudah', 'banyak', 'penurunan', 'enggak', 'bisa', 'dibuka', 'lagi', 'entah', 'ala', 'guna', 'pembaruannya']","['aneh', 'dibuka', 'memperbarui', 'penurunan', 'dibuka', 'ala', 'pembaruannya']","['aneh', 'buka', 'baru', 'turun', 'buka', 'ala', 'baru']"
41,hah ini apa malah jadi gabisa dibuka samsek daritadi buka cuma muncul logone tok ga berfungsi samsek,ha ini apa malah jadi enggak bisa dibuka sama sekali dari tadi buka cuma muncul logone tok enggak berfungsi sama sekali,ha ini apa malah jadi enggak bisa dibuka sama sekali dari tadi buka cuma muncul logone tok enggak berfungsi sama sekali,"['ha', 'ini', 'apa', 'malah', 'jadi', 'enggak', 'bisa', 'dibuka', 'sama', 'sekali', 'dari', 'tadi', 'buka', 'cuma', 'muncul', 'logone', 'tok', 'enggak', 'berfungsi', 'sama', 'sekali']","['ha', 'dibuka', 'buka', 'muncul', 'logone', 'tok', 'berfungsi']","['ha', 'buka', 'buka', 'muncul', 'logone', 'tok', 'fungsi']"
108,mau login ga bisa lemot cuma muter aja,mau masuk enggak bisa lambat cuma berputar saja,mau masuk enggak bisa lambat cuma berputar saja,"['mau', 'masuk', 'enggak', 'bisa', 'lambat', 'cuma', 'berputar', 'saja']","['masuk', 'lambat', 'berputar']","['masuk', 'lambat', 'putar']"
465,mantaap,mantap,mantap,['mantap'],['mantap'],['mantap']
56,gak bisa log in koneksi timeout terus,enggak bisa masuk koneksi timeout terus,enggak bisa masuk koneksi timeout terus,"['enggak', 'bisa', 'masuk', 'koneksi', 'timeout', 'terus']","['masuk', 'koneksi', 'timeout']","['masuk', 'koneksi', 'timeout']"
479,kesulitan untuk pembayaran via qris padahal aplikasi sebelum di update aman tanpa kendala error,kesulitan untuk pembayaran via qris padahal aplikasi sebelum diperbarui aman tanpa kendala eror,kesulitan untuk pembayaran via qris padahal aplikasi sebelum diperbarui aman tanpa kendala eror,"['kesulitan', 'untuk', 'pembayaran', 'via', 'qris', 'padahal', 'aplikasi', 'sebelum', 'diperbarui', 'aman', 'tanpa', 'kendala', 'eror']","['kesulitan', 'pembayaran', 'via', 'qris', 'aplikasi', 'diperbarui', 'aman', 'kendala', 'eror']","['sulit', 'bayar', 'via', 'qris', 'aplikasi', 'baru', 'aman', 'kendala', 'eror']"
513,setelah upgrade bukannya malah baik pelayanannya malah gak bisa bayar karena tertera waktu habis balik aplikasi lama saja lebih baik daripada yang baru tolong diperhatikan terimakasih,setelah meningkatkan bukannya malah baik pelayanannya malah enggak bisa bayar karena tertera waktu habis balik aplikasi lama saja lebih baik daripada yang baru tolong diperhatikan terima kasih,setelah meningkatkan bukannya malah baik pelayanannya malah enggak bisa bayar karena tertera waktu habis balik aplikasi lama saja lebih baik daripada yang baru tolong diperhatikan terima kasih,"['setelah', 'meningkatkan', 'bukannya', 'malah', 'baik', 'pelayanannya', 'malah', 'enggak', 'bisa', 'bayar', 'karena', 'tertera', 'waktu', 'habis', 'balik', 'aplikasi', 'lama', 'saja', 'lebih', 'baik', 'daripada', 'yang', 'baru', 'tolong', 'diperhatikan', 'terima', 'kasih']","['meningkatkan', 'pelayanannya', 'bayar', 'tertera', 'habis', 'aplikasi', 'tolong', 'diperhatikan', 'terima', 'kasih']","['tingkat', 'layan', 'bayar', 'tera', 'habis', 'aplikasi', 'tolong', 'perhati', 'terima', 'kasih']"
24,fitur reduksi harga dihilangkan aplikasi juga sangat lemot ciri khas bumn bgt,fitur reduksi harga dihilangkan aplikasi juga sangat lambat ciri khas bumn banget,fitur reduksi harga dihilangkan aplikasi juga sangat lambat ciri khas bumn banget,"['fitur', 'reduksi', 'harga', 'dihilangkan', 'aplikasi', 'juga', 'sangat', 'lambat', 'ciri', 'khas', 'bumn', 'banget']","['fitur', 'reduksi', 'harga', 'dihilangkan', 'aplikasi', 'lambat', 'ciri', 'khas', 'bumn', 'banget']","['fitur', 'reduksi', 'harga', 'hilang', 'aplikasi', 'lambat', 'ciri', 'khas', 'bumn', 'banget']"
218,setelah update malah lemot susah melakukan pemesanan tolong diperbaiki,setelah memperbarui malah lambat susah melakukan pemesanan tolong diperbaiki,setelah memperbarui malah lambat susah melakukan pemesanan tolong diperbaiki,"['setelah', 'memperbarui', 'malah', 'lambat', 'susah', 'melakukan', 'pemesanan', 'tolong', 'diperbaiki']","['memperbarui', 'lambat', 'susah', 'pemesanan', 'tolong', 'diperbaiki']","['baru', 'lambat', 'susah', 'mesan', 'tolong', 'baik']"
430,luemottt bettt,luemot banget,luemot banget,"['luemot', 'banget']","['luemot', 'banget']","['luemot', 'banget']"
281,tampilan ui jelek padahal lebih simpel dan elegan yg dulu,tampilan lu jelek padahal lebih simpel dan elegan yang dahulu,tampilan lu jelek padahal lebih simpel dan elegan yang dahulu,"['tampilan', 'lu', 'jelek', 'padahal', 'lebih', 'simpel', 'dan', 'elegan', 'yang', 'dahulu']","['tampilan', 'lu', 'jelek', 'simpel', 'elegan']","['tampil', 'lu', 'jelek', 'simpel', 'elegan']"
110,tetap update mudah digunakan berikan kami pelayanan yang terbaik,tetap memperbarui mudah digunakan berikan kami pelayanan yang terbaik,tetap memperbarui mudah digunakan berikan kami pelayanan yang terbaik,"['tetap', 'memperbarui', 'mudah', 'digunakan', 'berikan', 'kami', 'pelayanan', 'yang', 'terbaik']","['memperbarui', 'mudah', 'pelayanan', 'terbaik']","['baru', 'mudah', 'layan', 'baik']"
