"ulasan","Performa"
"setelah di upgrade malah jadi lancar. aplikasi nya buka jadwal/pembayaran malah jadi lebih cepet","Positif"
"Mohon maaf setelah update akses menjadi lebih lambat, tidak seperti pada aplikasi sebelumnya. Saat memilih kursi timeout menunggu lama sekali. Menghabiskan banyak waktu","Negatif"
"Di update bukan makin bagus . makin lemot jaringan susah masuk...gakjelas","Konflik"
"Ini setelah d update kenapa aplikasi nya jadi lemot banget min,bahkan logout sendiri,pas mau masuk jdi gk bisa masuk keterangan nya ""failed request"" padahal udah biasa dulu pake KAI acces, tolong donk klo memang harus pake aplikasi,aplikasinya yaa di bikin simpel dan mudah akses nya jangan jadi malah susah gini.","Negatif"
"semenjak update aplikasi jd ringan dan lancar bet","Positif"
"Setelah update malah ga lemot masuk nya, dr segi tampilan makin oke dan performanya makin baik","Positif"
"Tampilan baru memang terlihat fresh, tapi ya ampun gak selama ini juga loadingnya dong","Negatif"
"Setelah di update ke fitur baru jadi lemot bgt:(((","Negatif"
"Setelah update palah makin baik.. Apk ringan lancar tidak lemot","Positif"
"Ada update aplikasi otomatis malah nggak bisa di buka, bukannya tambah bagus malah tambah buruk","Konflik"
"Semenjak pembaruan sudah tidak ngelag, touchscreen responsif, lancar. suka jg ama fitur2 tambahnnya jadi app yg lebih multifungsi","Positif"
"kalo segalanya mau online harusnya aplikasinya disiapin dulu sampe mateng jauh dari bug, lemot, ini aplikasinya aja belum optimal banyak bug, susah masuk, lemot ko udah maen harus beli online aja kasian orang yang mau naik kereta dibikin ribet engga jelas, bumn kerjanya ko gini","Negatif"
"kualitasnya lebih baik untuk baru di update, saya mau pesan tiket juga makin mudah sudah tidak eror dan lemot","Positif"
"Aplikasinya sangat mudah di gunakan tambah bagus dan tidak lemot","Positif"
"aplikasi menjadi lebih lancar sesudah di update, smuanya lancar dan cepat, mudah login, mudah booking, yang dulu lemot muter terus saya pernah nunggu hampir 1 jam bulak balik masih saja lemot, untung sekarnag sudah di update lebih memudahkan booking tiket online","Positif"
"Maaf sebelumnya saya mau komplain kepada programmer yang mendesain tampilan UI serta UX pada aplikasi access ini, saya lebih suka tampilan yang sebelumnya dikarenakan tampilan yang sekarang terlalu banyak data yang di stored sehingga aplikasi ini tidak responsif seperti versi yang sebelumnya","Konflik"
"alhamdulillah jd lebih mudah... lancar, dulu susah banget kl mau hapus email (akun) krn sdh tdk aktif, skrg kl mau ganti nomer caranya udh gampang bgt. sukaaa","Positif"
"waktu pemesanan habis terus, pembayaran terganggu, aplikasi lemot, gak bisa ganti kursi penumpang. niat bikin aplikasi apa gak sih ? . email yang saya kirim segera di cek, disitu ada video kendalanya. jangan merespon seperti bot. PESAN TIKET KA LOKAL EROR. TOLONG PERBAIKI","Negatif"
"Bagus nih, tampilan enak diliat, tapi di gua gak lemot kok tampilannya, enteng juga apk nya ga berat","Positif"
"Performany sedikit lebih baik darisebelumnya,,,,","Positif"
"Saya pelanggan setia kai merasa paus dengan versi terbaruny memudahkan dlm segala hal pesan tiket mudah, cek tiket kereta mudah, bayrnya mudah, fitur tambahan yng juga berguna bagi saya. salutnya dg tambahan fitur yg banyak tpai masih lancar terus ga lemot lemot","Positif"
"Fitur menjadi lengkap namun sangat sulit untuk mengoprasikan. Fitur jadi tambah ribet gak efisien, masih enak apk sebelum update. Gak ada fitur filter nama kereta, tampilan jadi buruk banget, lemot banget, jadi gak fokus apk khusus KAI.","Negatif"
"Setelag update aplikasi menjadi sangat lemot di semua fiturnya, terutama di fitur Tiket Saya! Tiket yang sudah dibeli lama sekali bufferingnya menyebabkan kelamaan menunggu dipenukaran tiket/cetak boarding. Dan fitur Kereta untuk membeli tiker antar kotapun demikian begitu lemot bufferingnya. Mungkin seharusnya dicoba terlebih dahulu di internal KAI jangan langsung main update tetapi aplikasi belum bisa maksimal.","Negatif"
"Baru update.Log in ny butuh verifikasi sms hp tpi lama bgt kirim otp sms nya. Mlh d lock akun ny. Hadeh. Gmn sii???","Konflik"
"lancar banget tdk kendala wktu mau pembayaran malah jadi efektif","Positif"
