"ulasan","Performa"
"Semenjak aplikasinya update jadi makin lemot hadehh","Negatif"
"Sudah bisa dipakai lagi...","Netral"
"Aplikasinya sangat mudah di gunakan tambah bagus dan tidak lemot","Positif"
"Pake aplikasi dulu setiap mau pesan tiket sering gagal tapi diaplikasi sekarang selalu berhasil dna lebih cepet juga tidak lemot","Positif"
"Setelah update malah lemot, susah melakukan pemesanan, tolong diperbaiki","Negatif"
"Ko tiba tiba update kaget ama logo dan mana barunya tapi jadi makin lancar sihh","Positif"
"Bagus versi baru.... jadi lebih mudah dan lengkap... Terus tingkatkan efisiensi dan kurang bug...","Konflik"
"lag banget, padahal internet bagus, tapi apk susah masuk, apalagi semenjak update","Konflik"
"Bagus nih, tampilan enak diliat, tapi di gua gak lemot kok tampilannya, enteng juga apk nya ga berat","Positif"
"Udah bisapake Qris di kai access aya suka dengan pembayaran Qris jadi lebih simpel ditambah uga aplikasinya makin satset","Positif"
"Lemooooooooooooottttttt bangettttttttt,,setiap mau buka loadingnya lama padahal jaringan sudah bangus terus aplikasinya harus upgrade. Setiap mau buka harus masukin otp nya entah lewat email/sms,,padahal sebelum nya pernah kasih otp,,","Negatif"
"Mudah dan gag ribet gag perlu antri dan nunggu loket bukak, cuma sayang H-7 sudah gag dapat kursi.","Konflik"
"Alamdulillah setelah update akses menjadi lebih lancar, tidak seperti pada aplikasi sebelumnya lemot. Saat memilih kursi timeout tdk perlu nunggu waktu lama & membuang waktu","Positif"
"Diupdate malah bisa beli tiket dg mudah... lancar terus... UI nya yg diperbaiki jg lebih keren... lebih baik dari versi yg lama.. versi yg baru bagus banget performanya..","Positif"
"Setelah update aplikasi jadi lemot sekali, sering tiba-tiba log out sendiri, susah saat mau membeli tiket dan menyulitkan saat boarding","Negatif"
"Lemooooooooooooottttttt bangettttttttt,,setiap mau buka loadingnya lama padahal jaringan sudah bangus terus aplikasinya harus upgrade. Setiap mau buka harus masukin otp nya entah lewat email/sms,,padahal sebelum nya pernah kasih otp,,","Negatif"
"Setelah update malah lemot, susah melakukan pemesanan, tolong diperbaiki","Negatif"
"Setelah update jadi lancar, tapi tampilan antarmukanya bagusan yang sebelumnya","Positif"
"Woi admin balikin ke aplikasi lama lah.. lemot banget aplikasi update baru.. Setelah update malah makin tdk user friendly, filter hanya ada 1 pilihan (dulu bisa by waktu, harga, dan kelas), pilih kursi juga hrs scroll atas bawah (dulu 1 layar tampak semua), hadeuh bukannya makin maju","Negatif"
"Fitur memang makin lengkap,namun saat di operasikan sangat lemoot sekali dalam fitur pembelian tiket kereta dan pengecekan tiket kereta.masih bagusan yang sebelum updateðŸ¥²","Konflik"
"Lebih enak versi lama","Konflik"
"Versi terbaru, tapi makin buruk. Login via email dan no hp tetap aja muter sampe berkecambah","Negatif"
"Diupgrade malah tambah lancar,dari proses login sampe pambayran tiket","Positif"
"Sejak diperbarui makin garibet.. Pesen tiket jadi sat set.. ga lemot.. lbih mudah beli tiket di aplikasi skrng.. Hhh.. lebih baik daripada seblumnya.. Thx","Positif"
"Diperbarui makin bagus, lancar trus fiturnya juga banyak dan lengkap jadi pesen tiket kereta bisa seklain pesen hotel beli kuota internet juga","Positif"
"saran untuk para pengurus di KAI ..ini zaman sudah modern segala hal digital sudah serba cepat . ini masa saya batal kan tiket, pengembalian dana nya nunggu 30-45 hari.???? sekalian aja setahun baru tf dana nya .","Negatif"
"Kalo w ga butuh ma akses kereta ini males bgt dah make app ini, minggu2 ini loading trs, eror trs mana org tuh buru2, ini bner2 bkin emosi, pas nyampe stasiun disuruh ke loket, dari loket disuruh ke petugas dpn bner nyebelin bgt sampe ketinggalan jadwal kereta dong mana lg buru2, kalo org gbs beli diloket ya benerin dong tu app, jgn ngerugiin waktu orang.","Negatif"
"Hah ini apa malah jadi gabisa dibuka samsek daritadi buka cuma muncul logone tok ga berfungsi samsek","Negatif"
"Beberapa hari terakhir jadi lambat banget proses pembayaran sama cek tiketnya, bisa sampai makan waktu 30 sampe 40 menit cuman utk beli tiket, sama 10 menit cmn buat buka e-tiket untung saya masih ke kejar keretanya","Negatif"
"Setelah update jadi makin lancar, untuk buka aplikasinya langsung satset, tpi menurut saya tampilan antarmukanya bagusan yang sebelumnya","Positif"
"Sejak diupdate malah makin mudah Aplikasinya ga lemot lagi. mudah sekali ketika cek tiket dan ketika menyelesaikan step by step setelah isi data penumpang. Update terbaru ini sangat membantu saya puas","Positif"
"Iya sih makin lancar tapi aplikasi yang baru tidak efektif dalam pemilihan kursi. Tampilan kursi mending di aplikasi yang lama lebih efektif dan efisien","Positif"
"Pembayaran ga ribet pake kaipay makin mempermudah user kai buat pesen tikt sih ini fiturbarunya satset parah lagi","Positif"
"Tampilan emang have fun and youth. Fasilitas lebih banyak tapi masih belum berfungsi. Tapi namanya jadi tidak spesial. Orang lebih mudah mencari KAI dari pada Access. Nama Kai Access lebih keren dan spesial menunjukkan identitas aplikasi pesan tiket kereta api. Lah kalo ACCESS ini maknanya apa? Revamp ya revamp. Tapi gak jadi lebih aneh gitu. Jadi inget bikin stasiun tapi lupa buat jalan akses. Kan aneh. Mmm mungkin mau buat kayak LIVIN by mandiri","Negatif"
"LANCARR DI HP ku tapi dg spek lumayan tinggi lo, gatau kok orang-orang bilanylemot banget tapi di aku lancar. Banyak promo hotel jug","Positif"
"Saat ini apk nya malah jadi kurang membantu Detail kendala. Loadingnya lama sekali, saat mau cek jadwal commuter line susah sekali mencari nama stasiun . Memakan banyak waktu loading namun hasil pencarian malah tidak keluar.","Negatif"
"Kok semakin lemot ya lebih suka apk yang lama","Konflik"
"Gak tau apa yang melatarbelakangi pergantian dari KAI access ke access by KAI. Tapi sumpah kecewa banget. kualitas nya bukannya upgrade, ini malah downgrade. Pesen tiket jadi lebih lelet dari sebelumnya, bahkan untuk menambah kan daftar penumpang juga loading banget. Jadi tolong bukan tampilannya aja yang di ubah, tapi access kemudahannya harus terus ditingkatkan. Ini sih harus secepatnya diperbaiki, kata maaf aja gak akan pernah cukup","Konflik"
"Di update malah lancar bangettt yg dulu rada"" lemot soal ny,,,,,,buat pesen tiket & bayrnya lbh mudah skrang","Positif"
"baru di update apknya lancar terus, ga bikin nggu makin lama","Positif"
"Untuk proses pemesanan tiket lokal cepat banget, utk pembayaran ovo juga mudah","Positif"
"Diupdate jdi makin lancar, tak kasih bintang 5 deh buat aplikasi ini","Positif"
"Malah semakin bagus dan lancar banget aplikasi nya di versi terbaru ini...","Positif"
"Semakin memberikan kemudahan customer update an yg baru ini. Bintang 5 buat update an terbarunya kai udah ga lemot lagi jadi jos mantp is the best lancar jaya. Lebih suka aplikasi terbaru ini karena mudah dimengerti oleh customer/pengguna","Positif"
"enakan yg sekarang aplikasinya lancar ga l emot, tampilan lebih kelihatan seger ga ngebosenin","Positif"
"Lemot bgtttt si abis upgrade tp kualitas malah downgrade, bolak balik pemesanan tinggal bayar aja lemotnya MaasyaaAllah. Mau apasi","Negatif"
"Diperbarui makin bagus, lancar trus fiturnya juga banyak dan lengkap jadi pesen tiket kereta bisa seklain pesen hotel beli kuota internet juga","Positif"
"Saya senang dengan pembaruan aplikasi ini. Karena di aplikasi KAI accesa saat ini saya bisa melakukan update no hp. Karena di aplikasi sebelumnya tidak bisa dan sering gagal. Di tambah fiturÂ² terbaru nya yg sangat membantu pengguna nya. Buat performanya juga makin canggih dan makin cepet","Positif"
"tampilan ok pemesanan cepat lgsung dapat","Positif"
"Woi admin balikin ke aplikasi lama lah.. lemot banget aplikasi update baru.. Setelah update malah makin tdk user friendly, filter hanya ada 1 pilihan (dulu bisa by waktu, harga, dan kelas), pilih kursi juga hrs scroll atas bawah (dulu 1 layar tampak semua), hadeuh bukannya makin maju","Negatif"
"Gimana temenÂ², sudah bisa gnti jadwal kereta tnpa harus ke stasiun belum?? Apa gnti tampilan aja","Konflik"
"Ini setelah d update kenapa aplikasi nya jadi lemot banget min,bahkan logout sendiri,pas mau masuk jdi gk bisa masuk keterangan nya ""failed request"" padahal udah biasa dulu pake KAI acces, tolong donk klo memang harus pake aplikasi,aplikasinya yaa di bikin simpel dan mudah akses nya jangan jadi malah susah gini.","Negatif"
"Dikomentar lain banyak yang bilagn lemot tapi di akun lancar ini ga lemot samsek","Konflik"
"Mau masuk lancar bgt, proses ke pembayaran juga lancar, sampai- sampai waktu pembayaran hanya butuh waktu yang cepet ga lama. Ini aplikasi super lancar dari segala2nya","Positif"
"Setelah update, aplikasi sering bermasalah. (1) Tidak bisa login ke aplikasi setelah pengisian kode otp karena selalu loading sehingga harus menunggu di block 1 jam karena terlalu sering masukkan kode otp (2) ingin melakukan pembayaran melalui QRIS namun kode QRIS tidak kunjung muncul sehingga tidak bisa bayar tiket (3) jenis kelamin sudah diubah namun setelah direfresh kembali lagi ke jenis kelamin yang salah (tertukar antara laki dan perempuan) untuk semua penumpang.","Negatif"
"Lemot saat masuk menu. Saat lemot kadang akun sudah log out, lalu saat masuk lagi sudah log in.","Negatif"
"Abis tak update tampikan baru malah makin bagus dan jadi makin lancar, mw cari tiket juga gampang","Positif"
"Mau naik kereta api bookingnya makin mudah, aplikase lancar.. ","Positif"
"Di update malah lancar bangettt yg dulu rada"" lemot soal ny,,,,,,buat pesen tiket & bayrnya lbh mudah skrang","Positif"
"Tolong atuh perbaiki kualitas nya kan banyak yang pake aplikasi ini seharusnya lebih ditingkatkan lagi. Jangan tiba tiba keluar sendiri akun nya trs susah login lagi nya loading nya lama banget ampun","Negatif"
"Baru kali ini kecewa, update yang terbaru bukannya semakin bagus, malah semakin lambat. Mau login harus nunggu lama, mau pesan tiket jadi susah. Mohon untuk segera ada solusinya ðŸ™","Negatif"
"semenjak update aplikasi jd ringan dan lancar bet","Positif"
"Gara gara update lemot bangattt","Negatif"
"baru di update apknya lancar terus, ga bikin nggu makin lama","Positif"
"Lebih enak palikasi yang sebelumnya yang cepat","Konflik"
"Jd males pkenya setelah update ga bisa msuk loading terus jd ribet mu msen tiket geðŸ‘Ž","Konflik"
"Pembayaran ga ribet pake kaipay makin mempermudah user kai buat pesen tikt sih ini fiturbarunya satset parah lagi","Positif"
"Dari segi performa kai accsess terbaru lbih baik daripada seblumnya, booking tiekt makin mudah dan bayarnya bisa pake Qris ada fiturbuat pesen hotel juga lengkap","Positif"
"Aplikasi terbaru bukanya malah memudahkan,malah menyusahkan... Lebih bagus sebelum diupdate mudah dimengerti.","Konflik"
"Pake aplikasi dulu setiap mau pesan tiket sering gagal tapi diaplikasi sekarang selalu berhasil dna lebih cepet juga tidak lemot","Positif"
"Dari segi performa kai accsess terbaru lbih baik daripada seblumnya, booking tiekt makin mudah dan bayarnya bisa pake Qris ada fiturbuat pesen hotel juga lengkap","Positif"
"Baru kali ini kecewa, update yang terbaru bukannya semakin bagus, malah semakin lambat. Mau login harus nunggu lama, mau pesan tiket jadi susah. Mohon untuk segera ada solusinya ðŸ™","Negatif"
"Sejak diperbarui makin garibet.. Pesen tiket jadi sat set.. ga lemot.. lbih mudah beli tiket di aplikasi skrng.. Hhh.. lebih baik daripada seblumnya.. Thx","Positif"
"Fitur lebih banyak dan tampilan lebih bagus tapi sayang lemotnya minta ampun, untuk memilih tempat duduk lama sekali, pembayaran tinggal menunggu kode pembayaran lama dan akhirnya time out, akhirnya jadi ngga dapat tiket, padahal ini untuk perjalanan mendadak. Beda jauh dengan waktu aplikasi yang lama, sat set bisa cepat ngga loading terus.","Negatif"
"Udah bisapake Qris di kai access aya suka dengan pembayaran Qris jadi lebih simpel ditambah uga aplikasinya makin satset","Positif"
"Banyak fitur dan pilihannya tapi gabusa sama saja kalo tidak bisa terakses, lebih running sama versi yang lama nya, Merugikan konsumen apabila ada sesuatu mendesak dan butuh reshcedulle tiket tetapi gabisa, sudah coba telpon dan tanya ke 021121 service center juga ga ada solusi, sudah saya coba manual unistall kemudian download install lagi.. sama saja gabisa.. harus jadi perhatian dong ini","Negatif"
"Saat ini apk nya malah jadi kurang membantu Detail kendala. Loadingnya lama sekali, saat mau cek jadwal commuter line susah sekali mencari nama stasiun . Memakan banyak waktu loading namun hasil pencarian malah tidak keluar.","Negatif"
"Sangatt lemott","Negatif"
"Diupdate malah bisa beli tiket dg mudah... lancar terus... UI nya yg diperbaiki jg lebih keren... lebih baik dari versi yg lama.. versi yg baru bagus banget performanya..","Positif"
"Mohon maaf setelah update akses menjadi lebih lambat, tidak seperti pada aplikasi sebelumnya. Saat memilih kursi timeout menunggu lama sekali. Menghabiskan banyak waktu","Negatif"
"Lemooooooooooooottttttt bangettttttttt,,setiap mau buka loadingnya lama padahal jaringan sudah bangus terus aplikasinya harus upgrade. Setiap mau buka harus masukin otp nya entah lewat email/sms,,padahal sebelum nya pernah kasih otp,,","Negatif"
"Iya sih makin lancar tapi aplikasi yang baru tidak efektif dalam pemilihan kursi. Tampilan kursi mending di aplikasi yang lama lebih efektif dan efisien","Positif"
"Tampilan jauh lebih baik dengan fitur unggulan terbarunya yang menarik, thanks kai aplikasinya bagus dan lancar tdk ada trouble","Positif"
"Alamdulillah setelah update akses menjadi lebih lancar, tidak seperti pada aplikasi sebelumnya lemot. Saat memilih kursi timeout tdk perlu nunggu waktu lama & membuang waktu","Positif"
"Setelah di update dan tampilan baru malah lebih ..parah bug ny..loading lama....lemot..malah setelah update data nik berubah gmn ini team ...IT ny","Negatif"
"Setelah update tampilan lebih colourfull lebih lengkap bahkan jadwal commuterline..suka dg versi baru kai performnya meningkt jadi lebih cepet","Positif"
"Saya mau lihat jadwal kereta sekaligus pesan tiket udah lbih mudah.padahal sblmnya lemottt parah pdhal waktu itu lgi urgent..","Positif"
"Lancar banget... Mau melakukan pembayaran juga gamapng","Positif"
"Udah bisapake Qris di kai access aya suka dengan pembayaran Qris jadi lebih simpel ditambah uga aplikasinya makin satset","Positif"
"Bagaimana caranya agar bisa kembali ke yang lama ya? Saya upgrade kok reduksi saya malah tidak bisa.","Konflik"
"Gini dong lancar severny yg kemaren kok koneksinya timeout terus,    kalo diplikasi yg baru bisa sat set pesen tiket","Positif"
"Bagus.... benr2 bagus baik performa & tampilan","Positif"
"Di upgrade tambah satset","Positif"
"Aplikasi nggk banget, secara dulu waktu untuk pembayaran selama 10 Menit. Sekarang setelah di Update bukannya malah membaik malahan sering terjadi error ketika akan melakukan pembayaran, bahkan untuk waktunya sekarang di persingkat hanya 30 detik. Tidak worth it bagi pengguna Hp yang di rasa dengan proses loading yang cukup lama... ðŸ˜ŠðŸ˜„","Negatif"
"Fitur reduksi harga dihilangkan, aplikasi juga sangat lemot! Ciri khas bumn bgt!","Negatif"
"Setelah Update malah makin lancar g lemot, seblumnya saat masuk ke apk nya lemot bgt,sekarnang yg mau bli tiket atau mau bepergian naik Kereta jdi mudah apalagi yg mau pergi kerja","Positif"
"Setelah update jadi mudah buat login, ga butuh waktu yang lama untuk login. Keren nih app terupdatenya","Positif"
"Updetan versi terbaru bner2 makin bagus deh dah gaLemot banget, sanagat memudhakan daripada versi lama","Positif"
"Setelah Update malah makin lancar g lemot, seblumnya saat masuk ke apk nya lemot bgt,sekarnang yg mau bli tiket atau mau bepergian naik Kereta jdi mudah apalagi yg mau pergi kerja","Positif"
"Yang baru lucu tapi lemot parah.","Negatif"
"Lemmootnya minta ampun, tolong segera di perbaiki sistemnya. Lebih baik uninstal klo lemot bgt kya gini","Negatif"
"Versi terbaru, tapi makin buruk. Login via email dan no hp tetap aja muter sampe berkecambah","Negatif"
"Sangat buruk saya telat 2 menit uang gabisa di refund malah hangus,jadi 200rbu cuman beli angin","Negatif"
"Saat verifikasi kaipay loh kenapa tibaÂ² kode otp nya muncul dari kaspro.id. apa kerja sama ? Lebih suka aplikasi yang lama. Yang baru ini lemot","Konflik"
"Setelag update aplikasi menjadi sangat lemot di semua fiturnya, terutama di fitur Tiket Saya! Tiket yang sudah dibeli lama sekali bufferingnya menyebabkan kelamaan menunggu dipenukaran tiket/cetak boarding. Dan fitur Kereta untuk membeli tiker antar kotapun demikian begitu lemot bufferingnya. Mungkin seharusnya dicoba terlebih dahulu di internal KAI jangan langsung main update tetapi aplikasi belum bisa maksimal.","Negatif"
"Setelah update malah ga lemot masuk nya, dr segi tampilan makin oke dan performanya makin baik","Positif"
"Sejak diupdate malah makin mudah Aplikasinya ga lemot lagi. mudah sekali ketika cek tiket dan ketika menyelesaikan step by step setelah isi data penumpang. Update terbaru ini sangat membantu saya puas","Positif"
"Setelah update jadi makin lancar, untuk buka aplikasinya langsung satset, tpi menurut saya tampilan antarmukanya bagusan yang sebelumnya","Positif"
"Secara tampilan oke, masalah sistem jauh sama yang lama. Lemot banget min, kukira jaringan yg lemot ternyata bukan sampe restart hp berkali-kali Mau pesen malah jadi seribet ini. Mending yang lama","Konflik"
"Setelah di update jadi lebih baik ngga zonk lagi baik dari performa fitur""nya dll. tampilan dan pengoperasian jugalebih efisien versi terbaru sumpah, versi lamanya nyebelin. Aneh","Positif"
"Tidak jadwal waktu sholat seperti versi terdahulu","Netral"
"Setiap ada update bukannya lebih baik malah banyak masalah, padahal yang kemarin sudah bagus dan friendly user.. Dan yang ini lebih parah.. mau bayar ga bisa bisa.. ""waktu anda telah habis...""..padahal baru mencet metode pembayaran.. Tolong menu RESCHEDULE dan REFUND agar DIMUNCULKAN KEMBALI krn buat yg sering berubah keberangkatan sangat2 membantu.. sudah banyak ulasan dan kasih bintang 1, smg tim KAI bisa segera memperbaiki..","Konflik"
"Setelah di update jadi lebih baik ngga zonk lagi baik dari performa fitur""nya dll. tampilan dan pengoperasian jugalebih efisien versi terbaru sumpah, versi lamanya nyebelin. Aneh","Positif"
"KAI update otomatis di hp saya seltah saya buka dan ccoba versi barunya emang lebih user freandly,,,, syaa juga langsung pesan tiket untk kebernagkatan ke surabaya dg commuterline wah dari pencarian, pemesanan dan bayarnya mudah bettt lancar. suwun kai","Positif"
"Tampilannya bagus, tapi saat mau masuk ke aplikasi lamanya mbuat emosi banget","Negatif"
"Tampilan baru memang terlihat fresh, tapi ya ampun gak selama ini juga loadingnya dong","Negatif"
"Sy baru sadar kalau apk nya di upgrade, tampilannya bagus, tapi kok ini malah lemot skli, dan ngebug terus. Setiap mau pesen tiket antar kota selalu tidak tersedia? ini gmna si min, bagusan yg lama. Sy juga lihat balasan adminnya disini malah suruh update atau log ini lagi, udah sy coba segala cara sama ajaaaaaa, padahal ini apk sdh versi pling terbaru","Konflik"
"Terlalu bnyak menu semakin lemot aplikasinya....","Negatif"
"Selain apknya udah gak lemott lagi dan makin satset.... aku jg suka saat pesen tiket buat pilih kursinya lebih enak aja di versi skarang  daripada dulu","Positif"
"Waktu may Bayar sudah tidak loading terus lebih baik dari seblum ny performa nya meningkat","Positif"
"Setelah update jadi tak bisa di buka","Konflik"
"Tambah lemot, Fitur nambah tapi sistem gak support","Negatif"
"Jarang banget ngasi Ulasan gini, tp ini fix super lemot banget, kukira semakin baik, eh cuma tampilannya doang, masa mau buka apk aja lemot poll, kalo kek gini, kan gak bisa bur"" buka pas mau scan barcode ya","Negatif"
"Jadi lemot bgtt, enakan pake apk sblm diupdate","Negatif"
"1. Ribet. Jadwal yg habis tidak lgsg off, tp harus dibuka dulu baru muncul jam keberangkatan buat dilihat masih ada atau nggak. Gak efisien nyari jam yg masih ada bangkunya. 2. Lemot. LEMOOOOOT BANGET, selesai iai data diri mau pilih kursi loadingnya lama banget.","Negatif"
"Pada saat masuk kok lama sekali, gak seperti apk KAI acces","Konflik"
"Lemooooooooooooottttttt bangettttttttt,,setiap mau buka loadingnya lama padahal jaringan sudah bangus terus aplikasinya harus upgrade. Setiap mau buka harus masukin otp nya entah lewat email/sms,,padahal sebelum nya pernah kasih otp,,","Negatif"
"KAI update otomatis di hp saya seltah saya buka dan ccoba versi barunya emang lebih user freandly,,,, syaa juga langsung pesan tiket untk kebernagkatan ke surabaya dg commuterline wah dari pencarian, pemesanan dan bayarnya mudah bettt lancar. suwun kai","Positif"
"Tampilan baru malah makin lemot parah aplikasi nya...","Negatif"
"update jadi ringan dan lebih cepat. UX buat lihat detail harga inovasinya bagus","Positif"
"saran untuk para pengurus di KAI ..ini zaman sudah modern segala hal digital sudah serba cepat . ini masa saya batal kan tiket, pengembalian dana nya nunggu 30-45 hari.???? sekalian aja setahun baru tf dana nya .","Negatif"
"Semenjak update aplikasi udah ngak lemot,,tapi tampilan membingungkan. Kereta yang penuh masih muncul untungnya pesen tiket sama bayar nya aman dan gampang bgt.","Positif"
"Darisegi perfroma lbh baik dari versi seblmunya, suka bgt sama tampilan barunya","Negatif"
"Udah update versi terbaru tampilanya GEMESSSSS banget sukaa malah lancarr banget juga","Positif"
"Lemooooooooooooottttttt bangettttttttt,,setiap mau buka loadingnya lama padahal jaringan sudah bangus terus aplikasinya harus upgrade. Setiap mau buka harus masukin otp nya entah lewat email/sms,,padahal sebelum nya pernah kasih otp,,","Negatif"
"Aplikasi baru sering crash","Konflik"
"Setelag update aplikasi menjadi sangat lemot di semua fiturnya, terutama di fitur Tiket Saya! Tiket yang sudah dibeli lama sekali bufferingnya menyebabkan kelamaan menunggu dipenukaran tiket/cetak boarding. Dan fitur Kereta untuk membeli tiker antar kotapun demikian begitu lemot bufferingnya. Mungkin seharusnya dicoba terlebih dahulu di internal KAI jangan langsung main update tetapi aplikasi belum bisa maksimal.","Negatif"
"Lebih suka apk nya sebelum diperbarui","Konflik"
"tampilan ok pemesanan cepat lgsung dapat","Positif"
"Setelah update yang terbaru tampilan oke, kualitasnya juga bagus banget. Load pas buka appnya juga ga lama, pas mau ke pembayaran juga lancar banget, pembayarannya dapat dilakukan dengan mudah. Ini nih aplikasi yang kita butuhkan cepet, simple, dan mudah.","Positif"
"Saya menyarankan untuk mengembalikan antarmuka aplikasi seperti sebelumnya, yang setelah update baru jadi sulit untuk membedakan tiket yang masih ada sama yang sudah habis","Netral"
"Fitur lebih banyak dan tampilan lebih bagus tapi sayang lemotnya minta ampun, untuk memilih tempat duduk lama sekali, pembayaran tinggal menunggu kode pembayaran lama dan akhirnya time out, akhirnya jadi ngga dapat tiket, padahal ini untuk perjalanan mendadak. Beda jauh dengan waktu aplikasi yang lama, sat set bisa cepat ngga loading terus.","Negatif"
"Lemooooooooooooottttttt bangettttttttt,,setiap mau buka loadingnya lama padahal jaringan sudah bangus terus aplikasinya harus upgrade. Setiap mau buka harus masukin otp nya entah lewat email/sms,,padahal sebelum nya pernah kasih otp,,","Negatif"
"Bagus nih, tampilan enak diliat, tapi di gua gak lemot kok tampilannya, enteng juga apk nya ga berat","Positif"
"Aplikasi bagus banget setelah di update sudah tidak ada bug dan lancar banget","Positif"
"Abis tak update tampikan baru malah makin bagus dan jadi makin lancar, mw cari tiket juga gampang","Positif"
"Setelah update jadi lancar, tapi tampilan antarmukanya bagusan yang sebelumnya","Positif"
"diupdate malah gabisa masuk apk","Netral"
"Saya pelanggan setia kai merasa paus dengan versi terbaruny memudahkan dlm segala hal pesan tiket mudah, cek tiket kereta mudah, bayrnya mudah, fitur tambahan yng juga berguna bagi saya. salutnya dg tambahan fitur yg banyak tpai masih lancar terus ga lemot lemot","Positif"
"Pembayaran ga ribet pake kaipay makin mempermudah user kai buat pesen tikt sih ini fiturbarunya satset parah lagi","Positif"
"Apk sering error aneh udah update malah rasanya kayak downgrade sering tidak bisa pembayaran melalui qris sering gagal udak top up dana, link aja, ovo, tetep tidak bisa aneh banget qris nya sering gagal sampe uang habis cuma buat top up apk"" tersebut tatapi tidak berguna. Sama apk nya lemot banget badahal sinyal kenceng hp juga spek lumayan. Aneh banget dah apk nya","Negatif"
"waktu pemesanan habis terus, pembayaran terganggu, aplikasi lemot, gak bisa ganti kursi penumpang. niat bikin aplikasi apa gak sih ? . email yang saya kirim segera di cek, disitu ada video kendalanya. jangan merespon seperti bot. PESAN TIKET KA LOKAL EROR. TOLONG PERBAIKI","Negatif"
"Setelah diperbaharui semakin lemot..susah buat buka apkny padahal sinyal bagus..mau ngecek tiket jadi susah..semoga bisa diperbaiki lagi sehingga dpt memudahkan penumpang dalam menggunakan apk kai","Konflik"
"Lemooooooooooooottttttt bangettttttttt,,setiap mau buka loadingnya lama padahal jaringan sudah bangus terus aplikasinya harus upgrade. Setiap mau buka harus masukin otp nya entah lewat email/sms,,padahal sebelum nya pernah kasih otp,,","Negatif"
"Mau naik kereta api bookingnya makin mudah, aplikase lancar.. ","Positif"
"Udah gk lemot lagi mau mesen tiket lokal tiket antarkota semua pake online tapi apk nya lancar parah gk lemot. jadi makin memudahkan juga setelah diperbarui huhuhhu suka....","Positif"
"Bagus sekali tapi suka loading","Konflik"
"Tampilan baru memang terlihat fresh, tapi ya ampun gak selama ini juga loadingnya dong","Negatif"
"Performany sedikit lebih baik darisebelumnya,,,,","Positif"
