"ulasan","Performa"
"Jujur lebih baik versi sebelumnya, lebih simpel dan mempermudah, tinggal pilih tanggal langsung bisa lihat ketersediaan tiket. Versi terbaru malah jadi ribet, harus klik satu per satu keretanya baru bisa lihat ketersediaan tiket.","Konflik"
"Jelek...benar2 jelek..saya sampai ga bisa kerja tetap waktu karena sulitnya pesan tiket dari aplikasi ini...mending balikin ke yang sebelumnya..ga ribet..yang ini loadingnya bikin darah tinggi...","Negatif"
"Biasanya lemot poll...tapi setelah update malah lancar teros","Positif"
"Lebih mudah digunakan yg tampilan lama, yg baru lebih ruwet","Konflik"
"Tambah lemot, Fitur nambah tapi sistem gak support","Negatif"
"Lemot..!! Mau mesen tiket lokal aja lama loading nya! mesen harus online tapi apk nya lemot parah. udah sulit jadi makin dipersulit","Negatif"
"Untuk proses pemesanan tiket lokal cepat banget, utk pembayaran ovo juga mudah","Positif"
"lancar banget tdk kendala wktu mau pembayaran malah jadi efektif","Positif"
"Saya pelanggan setia kai merasa paus dengan versi terbaruny memudahkan dlm segala hal pesan tiket mudah, cek tiket kereta mudah, bayrnya mudah, fitur tambahan yng juga berguna bagi saya. salutnya dg tambahan fitur yg banyak tpai masih lancar terus ga lemot lemot","Positif"
"Berat bnget aplikasinya. ðŸ˜… sering keluar sendiri , jadwal krl gak lengkap setelah update. Buka aplikasi sampai 1 menit . Device lama samsung galaxy a50. Ini game berat?","Konflik"
"Saya senang dengan pembaruan aplikasi ini. Karena di aplikasi KAI accesa saat ini saya bisa melakukan update no hp. Karena di aplikasi sebelumnya tidak bisa dan sering gagal. Di tambah fiturÂ² terbaru nya yg sangat membantu pengguna nya. Buat performanya juga makin canggih dan makin cepet","Positif"
"Sudah tidak ada kendala lagi buat pesen tiket kereta pake aplikasi kai ini jadi makin mudah dan cepet","Positif"
"Aplikasi bagus banget setelah di update sudah tidak ada bug dan lancar banget","Positif"
"Updetan versi terbaru bner2 makin bagus deh dah gaLemot banget, sanagat memudhakan daripada versi lama","Positif"
"Sejak diupdate malah makin mudah Aplikasinya ga lemot lagi. mudah sekali ketika cek tiket dan ketika menyelesaikan step by step setelah isi data penumpang. Update terbaru ini sangat membantu saya puas","Positif"
"Otomatis terupdate, versi baru memudahkan, lebih lancar. Mau pesan tiket jadi mudah kearena saya PP kerja naik commuter","Positif"
"Dimana cara pesan reduksi lewat update yg baru ini","Netral"
"Banyak fitur dan pilihannya tapi gabusa sama saja kalo tidak bisa terakses, lebih running sama versi yang lama nya, Merugikan konsumen apabila ada sesuatu mendesak dan butuh reshcedulle tiket tetapi gabisa, sudah coba telpon dan tanya ke 021121 service center juga ga ada solusi, sudah saya coba manual unistall kemudian download install lagi.. sama saja gabisa.. harus jadi perhatian dong ini","Negatif"
"Setelah update, aplikasi sering bermasalah. (1) Tidak bisa login ke aplikasi setelah pengisian kode otp karena selalu loading sehingga harus menunggu di block 1 jam karena terlalu sering masukkan kode otp (2) ingin melakukan pembayaran melalui QRIS namun kode QRIS tidak kunjung muncul sehingga tidak bisa bayar tiket (3) jenis kelamin sudah diubah namun setelah direfresh kembali lagi ke jenis kelamin yang salah (tertukar antara laki dan perempuan) untuk semua penumpang.","Negatif"
"Lemot bgtttt si abis upgrade tp kualitas malah downgrade, bolak balik pemesanan tinggal bayar aja lemotnya MaasyaaAllah. Mau apasi","Negatif"
"Update baru bukan tambah baik malah tambah lemot...mending pakai yg sebelumnya sudah bagus kenapa kok diganti lagi...malah jd semarwut...jadi aplikasi unfaedah malahan.. Saran saya kembalikan seperti aplikasi sebelumnya saja mudah nyaman dan bagus","Negatif"
"Habis update malah ribet dan sangat sangat lemot, tolong di benahi lagi apa karena masih baru update belum dilalukan percobaan atau gmn, cth di pencarian stasiun kereta sangat lambat loading nya dan stasiun tidak di temukan padahal di versi sebelumnya bisa langsung ketemu dan cepat, pilih tempat duduk loading sampai 20 mnit blm slesai ahirnya beli di traveloka aja ,balikin ke versi sebelumnya aja,di tes dlu sampai benar2 jalan semua fiturnya sebelum apk nya di luncurin buat umum, smg d benerin","Negatif"
"Aplikasi update terbaru bagus, tp Saran q baikny harga2 tiket yg sdh habis terjual, d taruh paling bawah seperti aplikasi sebelumnya supaya gx bingung. Klu skrang d kirain msh ada tiketny, ternyata zonk.","Positif"
"Selaraskan antara kebijakan dan keandalan aplikasinya. Jangan buat peraturan untuk calon penumpang kereta lokal harus pesan tiket lewat aplikasi tapi aplikasinya tak bisa di andalkan. Kecepatan pelayanan melalui aplikasi juga menjadi daya tarik calon penumpang. Jangan sampai membuat penumpang menjadi kurang nyaman dengan performa aplikasi yang buruk.","Negatif"
"Lebih gampang aplikasi yg sebelumnya daripada ni.. Di upgrade malah kwalitasnya ðŸ‘ŽðŸ‘ŽðŸ‘ŽðŸ‘Ž","Konflik"
"KAI access terupdete fiturnya makin lengkp tapi ga lemot  dan lancar juga,,pesan tiket kereta lancar seperti biasanya","Positif"
"Daftar tiket saya tidak bisa diakses","Netral"
"Setelah diupdate , aplikasinya makin lancar ga lemot","Positif"
"ngelag","Netral"
"Setelah update malah gabisaÂ² masuk, memang dr segi tampilan makin oke tapi performanya makin buruk","Konflik"
"Ribet bagus aplikasi yang dulu","Konflik"
"Lemmootnya minta ampun, tolong segera di perbaiki sistemnya. Lebih baik uninstal klo lemot bgt kya gini","Negatif"
"enakan aplikasi yg lama","Konflik"
"Aplikasi bagus banget setelah di update sudah tidak ada bug dan lancar banget","Positif"
"Tampilan jauh lebih baik dengan fitur unggulan terbarunya yang menarik, thanks kai aplikasinya bagus dan lancar tdk ada trouble","Positif"
"Diupgrade malah tambah lancar,dari proses login sampe pambayran tiket","Positif"
"Selaraskan antara kebijakan dan keandalan aplikasinya. Jangan buat peraturan untuk calon penumpang kereta lokal harus pesan tiket lewat aplikasi tapi aplikasinya tak bisa di andalkan. Kecepatan pelayanan melalui aplikasi juga menjadi daya tarik calon penumpang. Jangan sampai membuat penumpang menjadi kurang nyaman dengan performa aplikasi yang buruk.","Negatif"
"Mangkin lengkap tpi kok makin ribet yaa","Konflik"
"Mending kembali ke aplikasi kai sebelumnya, aplikasi yang terbaru malah bikin emosi lemot maksimal","Konflik"
"Lemot saat masuk menu. Saat lemot kadang akun sudah log out, lalu saat masuk lagi sudah log in.","Negatif"
"setelah update tambah lemot pak","Negatif"
"Dih gemes banget sama aplikasi KAI yang sekarang kenapa sih pake di rubah segala enak yang dulu sekarang lemot pollll fitur2nya juga gak jelas , jelas an yang dulu please deh kembalikan aplikasi kai yang dulu aja ðŸ§ðŸ§ðŸ§ðŸ§","Negatif"
"Tidak megnecewakan siii setelah di update malah satset parah. Ada prommo kemerdekaan jgu sangat membantu sekali tengkyu kai","Positif"
"Tampilan UI jelek, padahal lebih simpel dan elegan yg dulu ðŸ˜ŒðŸ˜Œ","Konflik"
"alhamdulillah jd lebih mudah... lancar, dulu susah banget kl mau hapus email (akun) krn sdh tdk aktif, skrg kl mau ganti nomer caranya udh gampang bgt. sukaaa","Positif"
"Versi baru memang lebih menarik dengan tanpilan dan fitur baru, saya pesen tiket goshow langsung dapet ga ada lagi tuh macet lemot semua lancar2 aja. kalo saya suka dg pembayaran qrisnya lebih  simepl","Positif"
"Apk nya sekarang sudah tidak sering crash, jadi waktu mau memesan tiket selalu lancar tidak kehabisan waktu, pembayarannya juga mudah dg menggunaakn qris","Positif"
"SATU KATA UNTUK APLIKASI TERBARU ( LEMOT )","Konflik"
"Aplikasinya sangat mudah di gunakan tambah bagus dan tidak lemot","Positif"
"Semakin lama buka aplikasinya dan setiap langkah itu prosesnya lama banget, berbeda dengan yg sebelumnya lebih cepat. Malah sering kembali lagi kehalaman utama, semoga segera diperbaiki.terimakasih","Konflik"
"Iya sih makin lancar tapi aplikasi yang baru tidak efektif dalam pemilihan kursi. Tampilan kursi mending di aplikasi yang lama lebih efektif dan efisien","Positif"
"Stelah saya updte lagi app nya udah lebih lancar   pemesanan tiket commuter line sudah tidak eror lagi","Positif"
"Jarang banget ngasi Ulasan gini, tp ini fix super lemot banget, kukira semakin baik, eh cuma tampilannya doang, masa mau buka apk aja lemot poll, kalo kek gini, kan gak bisa bur"" buka pas mau scan barcode ya","Negatif"
"Semakin memberikan kemudahan customer update an yg baru ini. Bintang 5 buat update an terbarunya kai udah ga lemot lagi jadi jos mantp is the best lancar jaya. Lebih suka aplikasi terbaru ini karena mudah dimengerti oleh customer/pengguna","Positif"
"Pliss KAI segera perbaiki apknya secepatmyaaaaa! , setelah updet bnr bnr apk tidak membantu! Apalagi beli tiket lokal hrus pake apk gk bisa ots. Pas mau beli malah lemooootttt banget, sangat percuma penampilan bagus tapi gak fungsional. Tolong banget segera perbaiki, tadi pagi saya telat naik kereta dan gk jadi naik gra gra lemot apknya!! Lemotnya di semua mau pas log innya. Milih tiketnya, pembayaran dll. Dikasih waktu 5 mnit buat bayar tapi waktunya abis sama loading, udh ganti provider ttp.","Negatif"
"Tolong kenbalikan versi yang lama saja mudah dimengerti","Konflik"
"Aplikasi bagus banget setelah di update sudah tidak ada bug dan lancar banget","Positif"
"Bagus.... benr2 bagus baik performa & tampilan","Positif"
"Loading lamaaaaa...banget. pas pencarian kursi. Pas udah masuk,, udah dipilih sendiri dari apk nya, kn saya blm milih kursi padahal. Kadang lancar. Kadang ya gitu.. Yg versi lama lancar padahal.","Konflik"
"Saya pelanggan setia kai merasa paus dengan versi terbaruny memudahkan dlm segala hal pesan tiket mudah, cek tiket kereta mudah, bayrnya mudah, fitur tambahan yng juga berguna bagi saya. salutnya dg tambahan fitur yg banyak tpai masih lancar terus ga lemot lemot","Positif"
"Versi baru lebih ga lemot ... loadingnya ga pke lama buat akses masuk aplikasinya, pindah"" menu jg ga lemot","Positif"
"Jarang banget ngasi Ulasan gini, tp ini fix super lemot banget, kukira semakin baik, eh cuma tampilannya doang, masa mau buka apk aja lemot poll, kalo kek gini, kan gak bisa bur"" buka pas mau scan barcode ya","Negatif"
"Maaf ini aplikasi Sekarang tidak bisa pakai fitur connecting train dari Banyuwangi ke Cikarang, padahal sebelumnya bisa.. kenapa malah down grade ya?","Konflik"
"Udah maakin lancar ga lemot lagi, tapi tampilan masih enak dulu . Tampilan sekarang kayak pelangi, perpaduan warna kurang cocok","Positif"
"lancar banget tdk kendala wktu mau pembayaran malah jadi efektif","Positif"
"Setelah update tampilan lebih colourfull lebih lengkap bahkan jadwal commuterline..suka dg versi baru kai performnya meningkt jadi lebih cepet","Positif"
"Yg versi baru lemot... pol... masih mending yg versi sebelumnya...","Konflik"
"banyak tools tp lemot..suka time out..","Negatif"
"Untuk membuka aplikasi jadi memerlukan waktu yang cukup lama setelah pembaruan.","Netral"
"Setelah di update ke fitur baru jadi lemot bgt:(((","Negatif"
"Hah ini apa malah jadi gabisa dibuka samsek daritadi buka cuma muncul logone tok ga berfungsi samsek","Negatif"
"Kalo dibandingin kai yg dulu sama sekarang beda bgt dari segi performa nya makin lancar dari pesen tiket, bayarnya, tmpilannya menarik juga ditambah fitur2 terbaru yg bermanfaat bangett menurut saya","Positif"
"Masih susah dibuka enakan yang lama","Konflik"
"Secara UI sudah oke namun secara ux yang kurang, terutama saat mencari danmembeli tiket, harusnya tiket yang sudah sebagian sold rangenya di tulis mulai dari yang available bukan dari range harga awal. Trus ditawarkan memilih makanan saat memesan tiket adalah hal yang konyol, pilihan membeli tiket dari h-45 hari namun sudah di tanyain ingin membeli makanan apa itu hal aneh. Kecewa sih sama ux yang sekarang, better yg kemarin","Konflik"
"Setelah di update dan tampilan baru malah lebih ..parah bug ny..loading lama....lemot..malah setelah update data nik berubah gmn ini team ...IT ny","Negatif"
"Diupdate malah bisa beli tiket dg mudah... lancar terus... UI nya yg diperbaiki jg lebih keren... lebih baik dari versi yg lama.. versi yg baru bagus banget performanya..","Positif"
"Diupdate malah bisa beli tiket dg mudah... lancar terus... UI nya yg diperbaiki jg lebih keren... lebih baik dari versi yg lama.. versi yg baru bagus banget performanya..","Positif"
"yg baru ini gak bisa milih tempat duduk kah?lemot bgt juga. lebih suka yg lama","Konflik"
"Untuk update aplikasi nya lancar bangett, tapi lebih enak dilihat yang dulu tampilan menu aplikasinya","Positif"
"Kalo w ga butuh ma akses kereta ini males bgt dah make app ini, minggu2 ini loading trs, eror trs mana org tuh buru2, ini bner2 bkin emosi, pas nyampe stasiun disuruh ke loket, dari loket disuruh ke petugas dpn bner nyebelin bgt sampe ketinggalan jadwal kereta dong mana lg buru2, kalo org gbs beli diloket ya benerin dong tu app, jgn ngerugiin waktu orang.","Negatif"
"lemot..","Konflik"
"Setelah update yang terbaru tampilan oke, kualitasnya juga bagus banget. Load pas buka appnya juga ga lama, pas mau ke pembayaran juga lancar banget, pembayarannya dapat dilakukan dengan mudah. Ini nih aplikasi yang kita butuhkan cepet, simple, dan mudah.","Positif"
"update masih banyak bug !! lebih smooth apps yg versi lama","Konflik"
"Aplikasi diperbarui makin ga susah buat masuk. seblumny tiap masuk selalu bendal atau kalau bisa masuk, mutarnya lama sekarang dah lancar dan normal lagi. Tulung diperbaiki servernya juga.","Konflik"
"Diperbarui makin bagus, lancar trus fiturnya juga banyak dan lengkap jadi pesen tiket kereta bisa seklain pesen hotel beli kuota internet juga","Positif"
"Ini setelah d update kenapa aplikasi nya jadi lemot banget min,bahkan logout sendiri,pas mau masuk jdi gk bisa masuk keterangan nya ""failed request"" padahal udah biasa dulu pake KAI acces, tolong donk klo memang harus pake aplikasi,aplikasinya yaa di bikin simpel dan mudah akses nya jangan jadi malah susah gini.","Negatif"
"Aplikasi nya sangat lemot... Saya batal terus saat mau bayar karna loading nya lama sampai waktu limit pembayaran nya habis","Negatif"
"Aplikasi Di update malah step by step lemooottttt bangetttttttt yaAllah gimana kalau yg buruÂ²ðŸ¥º waktu pembayaran juga abis sama lemotnyaaaaaaaaa!!!!","Negatif"
"Tampilan jauh lebih baik dengan fitur unggulan terbarunya yang menarik, thanks kai aplikasinya bagus dan lancar tdk ada trouble","Positif"
"setelah di upgrade malah jadi lancar. aplikasi nya buka jadwal/pembayaran malah jadi lebih cepet","Positif"
"Good job KAI aplikasinya jadi lancar banget, pemesanan cepat bgt, di upgrade jd lebih baik dan lebih mudah diakses","Positif"
"Apakah ini upgrade an KAI ACCESS sebelum ini?","Netral"
"Lemot, udah bayar tiket, tapi ga muncul","Negatif"
"Setelah update gak ada masalah, login aman, cek fitur lain aman, aplikasi nya lebih smooth. Padahal hpku kentang lho ðŸ¤£","Positif"
"Setelah aplikasi diupdate semakin lancar bgt. Sangat memudahkan.....","Positif"
"kualitasnya lebih baik untuk baru di update, saya mau pesan tiket juga makin mudah sudah tidak eror dan lemot","Positif"
"Fitur lebih banyak dan tampilan lebih bagus tapi sayang lemotnya minta ampun, untuk memilih tempat duduk lama sekali, pembayaran tinggal menunggu kode pembayaran lama dan akhirnya time out, akhirnya jadi ngga dapat tiket, padahal ini untuk perjalanan mendadak. Beda jauh dengan waktu aplikasi yang lama, sat set bisa cepat ngga loading terus.","Negatif"
"Mau masuk lancar bgt, proses ke pembayaran juga lancar, sampai- sampai waktu pembayaran hanya butuh waktu yang cepet ga lama. Ini aplikasi super lancar dari segala2nya","Positif"
"Udahh Lancar banget buat beli dan cari tiket malah tambah enak dipandaang ux terbaru nya","Positif"
"alhamdulillah jd lebih mudah... lancar, dulu susah banget kl mau hapus email (akun) krn sdh tdk aktif, skrg kl mau ganti nomer caranya udh gampang bgt. sukaaa","Positif"
"Apk nya sekarang sudah tidak sering crash, jadi waktu mau memesan tiket selalu lancar tidak kehabisan waktu, pembayarannya juga mudah dg menggunaakn qris","Positif"
"Ini update versi terbaru malah nggak bisa dibuka. Gimana yaaaaðŸ¥º","Konflik"
"LANCARR DI HP ku tapi dg spek lumayan tinggi lo, gatau kok orang-orang bilanylemot banget tapi di aku lancar. Banyak promo hotel jug","Positif"
"Habis update malah ribet dan sangat sangat lemot, tolong di benahi lagi apa karena masih baru update belum dilalukan percobaan atau gmn, cth di pencarian stasiun kereta sangat lambat loading nya dan stasiun tidak di temukan padahal di versi sebelumnya bisa langsung ketemu dan cepat, pilih tempat duduk loading sampai 20 mnit blm slesai ahirnya beli di traveloka aja ,balikin ke versi sebelumnya aja,di tes dlu sampai benar2 jalan semua fiturnya sebelum apk nya di luncurin buat umum, smg d benerin","Negatif"
"Terlalu bnyak menu semakin lemot aplikasinya....","Negatif"
"Semenjak update aplikasi udah ngak lemot,,tapi tampilan membingungkan. Kereta yang penuh masih muncul untungnya pesen tiket sama bayar nya aman dan gampang bgt.","Positif"
"Update terbaru malah jadi parah. Tambah lemot dan tambah ribet","Negatif"
"alhamdulillah jd lebih mudah... lancar, dulu susah banget kl mau hapus email (akun) krn sdh tdk aktif, skrg kl mau ganti nomer caranya udh gampang bgt. sukaaa","Positif"
"Biasanya lemot poll...tapi setelah update malah lancar teros","Positif"
"Kalo dibandingin kai yg dulu sama sekarang beda bgt dari segi performa nya makin lancar dari pesen tiket, bayarnya, tmpilannya menarik juga ditambah fitur2 terbaru yg bermanfaat bangett menurut saya","Positif"
"Fitur lebih banyak dan tampilan lebih bagus tapi sayang lemotnya minta ampun, untuk memilih tempat duduk lama sekali, pembayaran tinggal menunggu kode pembayaran lama dan akhirnya time out, akhirnya jadi ngga dapat tiket, padahal ini untuk perjalanan mendadak. Beda jauh dengan waktu aplikasi yang lama, sat set bisa cepat ngga loading terus.","Negatif"
"Saya senang dengan pembaruan aplikasi ini. Karena di aplikasi KAI accesa saat ini saya bisa melakukan update no hp. Karena di aplikasi sebelumnya tidak bisa dan sering gagal. Di tambah fiturÂ² terbaru nya yg sangat membantu pengguna nya. Buat performanya juga makin canggih dan makin cepet","Positif"
"Saat ini apk nya malah jadi kurang membantu Detail kendala. Loadingnya lama sekali, saat mau cek jadwal commuter line susah sekali mencari nama stasiun . Memakan banyak waktu loading namun hasil pencarian malah tidak keluar.","Negatif"
"Mau masuk lancar bgt, proses ke pembayaran juga lancar, sampai- sampai waktu pembayaran hanya butuh waktu yang cepet ga lama. Ini aplikasi super lancar dari segala2nya","Positif"
"Setelah di update ke fitur baru jadi lemot bgt:(((","Negatif"
"Update terbaru malah jadi parah. Tambah lemot dan tambah ribet","Negatif"
"Akunya suka tiba-tiba keluar sendiri","Netral"
"Update besar2an aplikasi KAI semakin bagus, respon cepat dan UI keren. Cuma ada kekurangan yaitu metode pembayaran e wallet cuma ada opsi OVO, mungkin kedepan bisa ditambahkan wallet lain seperti gopay, shopeepay, dana atau virtual account.","Positif"
"Iya sih makin lancar tapi aplikasi yang baru tidak efektif dalam pemilihan kursi. Tampilan kursi mending di aplikasi yang lama lebih efektif dan efisien","Positif"
"Baru buka apk aja kok udh lemot ya? Padhal udh di upgrade","Negatif"
"Ada bangku tapi pas dipilih seat no available.... payah.....makin diupdate makin payah. Tampilan gak user friendly, makin berat, dan problem lama belum solve juga","Konflik"
"Kenapa sekarang susah banget masuk pesen semua nya loading parah","Konflik"
"Fitur reduksi harga dihilangkan, aplikasi juga sangat lemot! Ciri khas bumn bgt!","Negatif"
"waktu pemesanan habis terus, pembayaran terganggu, aplikasi lemot, gak bisa ganti kursi penumpang. niat bikin aplikasi apa gak sih ? . email yang saya kirim segera di cek, disitu ada video kendalanya. jangan merespon seperti bot. PESAN TIKET KA LOKAL EROR. TOLONG PERBAIKI","Negatif"
"Setelah update yang terbaru tampilan oke, kualitasnya juga bagus banget. Load pas buka appnya juga ga lama, pas mau ke pembayaran juga lancar banget, pembayarannya dapat dilakukan dengan mudah. Ini nih aplikasi yang kita butuhkan cepet, simple, dan mudah.","Positif"
"Udah maakin lancar ga lemot lagi, tapi tampilan masih enak dulu . Tampilan sekarang kayak pelangi, perpaduan warna kurang cocok","Positif"
"Sudah update bukannya makin bagus malah jadi semakin membuat emosi, saat pembayaran menggunakan e wallet jadi susah sekali, password ovo yang saya punya tidak bisa muncul dan dikatakan pembayaran gagal padahal saya sudah update ovo, kesel banget.... Lebih bagus kai access versi lama..","Negatif"
"Semenjak upgrade makin lancar untuk pembayaran makin memudahkan","Positif"
"Ternyata harus restart hp setelah update aplikasi biar ga lemot","Positif"
"Setelah update yang terbaru tampilan oke, kualitasnya juga bagus banget. Load pas buka appnya juga ga lama, pas mau ke pembayaran juga lancar banget, pembayarannya dapat dilakukan dengan mudah. Ini nih aplikasi yang kita butuhkan cepet, simple, dan mudah.","Positif"
"Aplikasi bagus banget setelah di update sudah tidak ada bug dan lancar banget","Positif"
"Untuk aplikasi KAI access yg lama, untuk UI tbh simple dan kesannya B aja. Untuk KAI access versi baru, bagus banget UI-nya. Tapi biarpun UI-nya bagus dan fitur2nya banyak tidak perlu waktu lama untuk loading-nya. Mantap kai UI-nya bagus & simple tapi juga ngga berat. Tq","Konflik"
"Makin ga efisien, lebih baik apk sebelum nya","Konflik"
"Pake aplikasi dulu setiap mau pesan tiket sering gagal tapi diaplikasi sekarang selalu berhasil dna lebih cepet juga tidak lemot","Positif"
"Udah satu jam lebih beli tiket tapi muter trus loding. Kalo loding pembayaran nya jangan kasih waktu.. ulang lagi ulang lagi waktu kadaluarsa karena loding","Negatif"
"Banyak fitur dan pilihannya tapi gabusa sama saja kalo tidak bisa terakses, lebih running sama versi yang lama nya, Merugikan konsumen apabila ada sesuatu mendesak dan butuh reshcedulle tiket tetapi gabisa, sudah coba telpon dan tanya ke 021121 service center juga ga ada solusi, sudah saya coba manual unistall kemudian download install lagi.. sama saja gabisa.. harus jadi perhatian dong ini","Negatif"
"Versi baru memang lebih menarik dengan tanpilan dan fitur baru, saya pesen tiket goshow langsung dapet ga ada lagi tuh macet lemot semua lancar2 aja. kalo saya suka dg pembayaran qrisnya lebih  simepl","Positif"
"Saya mau lihat jadwal kereta sekaligus pesan tiket udah lbih mudah.padahal sblmnya lemottt parah pdhal waktu itu lgi urgent..","Positif"
"Baru buka apk aja kok udh lemot ya? Padhal udh di upgrade","Negatif"
"Sejak diupdate malah makin mudah Aplikasinya ga lemot lagi. mudah sekali ketika cek tiket dan ketika menyelesaikan step by step setelah isi data penumpang. Update terbaru ini sangat membantu saya puas","Positif"
"Udah gk lemot lagi mau mesen tiket lokal tiket antarkota semua pake online tapi apk nya lancar parah gk lemot. jadi makin memudahkan juga setelah diperbarui huhuhhu suka....","Positif"
"Untuk update aplikasi nya lancar bangett, tapi lebih enak dilihat yang dulu tampilan menu aplikasinya","Positif"
"Aplikasi kaiacces ada update semakin simpel dan mempermudah. makin lancar dan ga lemot juga","Positif"
"Sejak diperbarui makin garibet.. Pesen tiket jadi sat set.. ga lemot.. lbih mudah beli tiket di aplikasi skrng.. Hhh.. lebih baik daripada seblumnya.. Thx","Positif"
"Kalo w ga butuh ma akses kereta ini males bgt dah make app ini, minggu2 ini loading trs, eror trs mana org tuh buru2, ini bner2 bkin emosi, pas nyampe stasiun disuruh ke loket, dari loket disuruh ke petugas dpn bner nyebelin bgt sampe ketinggalan jadwal kereta dong mana lg buru2, kalo org gbs beli diloket ya benerin dong tu app, jgn ngerugiin waktu orang.","Negatif"
"Banyak fitur dan pilihannya tapi gabusa sama saja kalo tidak bisa terakses, lebih running sama versi yang lama nya, Merugikan konsumen apabila ada sesuatu mendesak dan butuh reshcedulle tiket tetapi gabisa, sudah coba telpon dan tanya ke 021121 service center juga ga ada solusi, sudah saya coba manual unistall kemudian download install lagi.. sama saja gabisa.. harus jadi perhatian dong ini","Negatif"
"Saat ini apk nya malah jadi kurang membantu Detail kendala. Loadingnya lama sekali, saat mau cek jadwal commuter line susah sekali mencari nama stasiun . Memakan banyak waktu loading namun hasil pencarian malah tidak keluar.","Negatif"
"Kenapa sekarang ada menit nya sih mau pesen tiket jadi gak tenang","Konflik"
"Lemot banget ga bisa login Tolong perbaikannya","Konflik"
"Ternyata harus restart hp setelah update aplikasi biar ga lemot","Positif"
"Diupgrade malah aneh, di cek masih sisa kursi tersedia 3 di beli ga bisa","Konflik"
"Versi baru memang lebih menarik dengan tanpilan dan fitur baru, saya pesen tiket goshow langsung dapet ga ada lagi tuh macet lemot semua lancar2 aja. kalo saya suka dg pembayaran qrisnya lebih  simepl","Positif"
"Setelah di update jadi lebih baik ngga zonk lagi baik dari performa fitur""nya dll. tampilan dan pengoperasian jugalebih efisien versi terbaru sumpah, versi lamanya nyebelin. Aneh","Positif"
"Aplikasi update terbaru bagus, tp Saran q baikny harga2 tiket yg sdh habis terjual, d taruh paling bawah seperti aplikasi sebelumnya supaya gx bingung. Klu skrang d kirain msh ada tiketny, ternyata zonk.","Positif"
"Ok","Netral"
"Dari segi performa kai accsess terbaru lbih baik daripada seblumnya, booking tiekt makin mudah dan bayarnya bisa pake Qris ada fiturbuat pesen hotel juga lengkap","Positif"
"Kalo dibandingin kai yg dulu sama sekarang beda bgt dari segi performa nya makin lancar dari pesen tiket, bayarnya, tmpilannya menarik juga ditambah fitur2 terbaru yg bermanfaat bangett menurut saya","Positif"
"Dari segi tampilan udah oke tapi udah nyaman sama versi lama dan lebih satset tiap pembelian kerta KAJJ versi baru pendingnya lumayan lama","Positif"
